H8634 ,Local CCP ,HEALTH CARE SERVICE CORPORATION ,"Blue Cross and Blue Shield of IL, NM ",Health Care Service Corporation ,4,3,3,4,4,5,4,3,4,,,,,,,,,,,,,,,,,,,,,,,,,,,,,,,,,,,,,,
H8649 ,Local CCP ,AETNA HEALTH OF UTAH INC ,Aetna Medicare ,CVS Health Corporation ,2,3,4,4,5,5,4,4,3,,,,,,,,,,,,,,,,,,,,,,,,,,,,,,,,,,,,,,
H8711 ,Local CCP ,WELLCARE HEALTH INSURANCE COMPANY OF NEW JERSEY ,Wellcare ,Centene Corporation ,2,2,Not enough data available ,Not enough data available ,3,5,3,Not enough data available ,3,,,,,,,,,,,,,,,,,,,,,,,,,,,,,,,,,,,,,,
H8764 ,Local CCP ,ASPIRE HEALTH PLAN ,Aspire Health ,Montage Health ,5,3,3,4,4,5,4,2,2,,,,,,,,,,,,,,,,,,,,,,,,,,,,,,,,,,,,,,
H8768 ,Local CCP ,CARE IMPROVEMENT PLUS SOUTH CENTRAL INSURANCE CO. ,UnitedHealthcare ,"UnitedHealth Group, Inc. ",4,3,3,4,5,5,4,4,4,,,,,,,,,,,,,,,,,,,,,,,,,,,,,,,,,,,,,,
H8783 ,Local CCP ,"UCARE HEALTH, INC. ",UCare ,UCare Minnesota ,4,3,4,4,Not enough data available ,5,5,4,4,,,,,,,,,,,,,,,,,,,,,,,,,,,,,,,,,,,,,,
H8786 ,Demo ,"AMERIGROUP TEXAS, INC. ",Amerigroup STAR+PLUS MMP ,"Elevance Health, Inc. ",Not enough data available ,Not enough data available ,Not enough data available ,Not enough data available ,Not enough data available ,Not enough data available ,Not enough data available ,Not enough data available ,Not enough data available,,,,,,,,,,,,,,,,,,,,,,,,,,,,,,,,,,,,,,
H8794 ,Local CCP ,"KAISER FOUNDATION HP, INC. ",Kaiser Permanente ,"Kaiser Foundation Health Plan, Inc. ",Plan too new to be measured ,Plan too new to be measured ,Plan too new to be measured ,Plan too new to be measured ,Plan too new to be measured ,Plan too new to be measured ,Plan too new to be measured ,Plan too new to be measured ,Plan too new to be measured,,,,,,,,,,,,,,,,,,,,,,,,,,,,,,,,,,,,,,
H8797 ,Local CCP ,"PERENNIAL ADVANTAGE OF OHIO, INC. ",Perennial Advantage ,"Perennial Consortium, LLC ",Not enough data available ,Not enough data available ,Not enough data available ,Not enough data available ,Not enough data available ,5,Not enough data available ,Not enough data available ,4,,,,,,,,,,,,,,,,,,,,,,,,,,,,,,,,,,,,,,
H8845 ,Local CCP ,"MOLINA HEALTHCARE OF ARIZONA, INC. ",Molina Healthcare of Arizona ,"Molina Healthcare, Inc., ",Not enough data available ,Not enough data available ,Not enough data available ,Not enough data available ,Not enough data available ,5,Not enough data available ,Not enough data available ,Not enough data available,,,,,,,,,,,,,,,,,,,,,,,,,,,,,,,,,,,,,,
H8849 ,Local CCP ,AMERIGROUP INSURANCE COMPANY ,Amerigroup ,"Elevance Health, Inc. ",4,3,2,3,4,5,3,2,3,,,,,,,,,,,,,,,,,,,,,,,,,,,,,,,,,,,,,,
H8854 ,Local CCP ,"CareFirst Advantage DSNP, Inc. ",CareFirst BlueCross BlueShield Medicare Advantage ,"CareFirst, Inc. ",3,3,3,3,4,5,3,3,2,,,,,,,,,,,,,,,,,,,,,,,,,,,,,,,,,,,,,,
H8889 ,Local CCP ,MEDICA HEALTH PLANS ,Medica ,Medica Holding Company ,5,3,4,5,4,4,5,3,5,,,,,,,,,,,,,,,,,,,,,,,,,,,,,,,,,,,,,,
H8894 ,Local CCP ,Inland Empire Health Plan ,IEHP DualChoice ,INLAND EMPIRE HEALTH PLAN ,Plan too new to be measured ,Plan too new to be measured ,Plan too new to be measured ,Plan too new to be measured ,Plan too new to be measured ,3,Plan too new to be measured ,Plan too new to be measured ,Plan too new to be measured,,,,,,,,,,,,,,,,,,,,,,,,,,,,,,,,,,,,,,
H8902 ,Local CCP ,"SCAN HEALTH PLAN TEXAS, INC. ",SCAN Health Plan ,SCAN Group ,Plan too new to be measured ,Plan too new to be measured ,Plan too new to be measured ,Plan too new to be measured ,Plan too new to be measured ,4,Plan too new to be measured ,Plan too new to be measured ,Plan too new to be measured,,,,,,,,,,,,,,,,,,,,,,,,,,,,,,,,,,,,,,
H8908 ,Local CCP ,"HUMANA MEDICAL PLAN OF MICHIGAN, INC. ",Humana ,Humana Inc. ,3,4,3,3,5,5,4,5,2,,,,,,,,,,,,,,,,,,,,,,,,,,,,,,,,,,,,,,
H8928 ,Local CCP ,FALLON COMMUNITY HEALTH PLAN ,Fallon Health ,"Fallon Community Health Plan, Inc. ",4,4,4,5,4,4,5,4,4,,,,,,,,,,,,,,,,,,,,,,,,,,,,,,,,,,,,,,
H8947 ,Local CCP ,PEAK HEALTH INSURANCE CORPORATION ,Peak Health ,"West Virginia United Health System, Inc. ",Plan too new to be measured ,Plan too new to be measured ,Plan too new to be measured ,Plan too new to be measured ,Plan too new to be measured ,Plan too new to be measured ,Plan too new to be measured ,Plan too new to be measured ,Plan too new to be measured,,,,,,,,,,,,,,,,,,,,,,,,,,,,,,,,,,,,,,
H8967 ,Local CCP ,SANFORD HEALTH PLAN ,Great Plains Medicare Advantage ,Sanford Health ,Not enough data available ,Not enough data available ,Not enough data available ,Not enough data available ,Not enough data available ,3,Not enough data available ,Not enough data available ,4,,,,,,,,,,,,,,,,,,,,,,,,,,,,,,,,,,,,,,
H8998 ,Local CCP ,MOUNT CARMEL HEALTH PLAN OF CONNECTICUT INC ,Trinity Health Plan Of New England ,Trinity Health Corporation ,Plan too new to be measured ,Plan too new to be measured ,Plan too new to be measured ,Plan too new to be measured ,Plan too new to be measured ,5,Plan too new to be measured ,Plan too new to be measured ,Plan too new to be measured,,,,,,,,,,,,,,,,,,,,,,,,,,,,,,,,,,,,,,
H9001 ,Local CCP ,FALLON COMMUNITY HEALTH PLAN ,Fallon Health ,"Fallon Community Health Plan, Inc. ",4,4,4,4,4,4,4,4,4,,,,,,,,,,,,,,,,,,,,,,,,,,,,,,,,,,,,,,
H9003 ,Local CCP ,KAISER FOUNDATION HP OF THE N W ,Kaiser Permanente ,"Kaiser Foundation Health Plan, Inc. ",5,4,2,4,4,1,4,5,5,,,,,,,,,,,,,,,,,,,,,,,,,,,,,,,,,,,,,,
H9042 ,Local CCP ,"SOUTHEASTERN INDIANA HEALTH ORGANIZATION, INC. ",MyTruAdvantage ,"SIHO Holding, Inc. ",Not enough data available ,Not enough data available ,Not enough data available ,Not enough data available ,Not enough data available ,4,Not enough data available ,Not enough data available ,3,,,,,,,,,,,,,,,,,,,,,,,,,,,,,,,,,,,,,,
H9047 ,Local CCP ,PROVIDENCE HEALTH ASSURANCE ,Providence Medicare Advantage Plans ,Providence St Joseph Health ,5,4,3,4,4,4,4,2,3,,,,,,,,,,,,,,,,,,,,,,,,,,,,,,,,,,,,,,
H9065 ,Local CCP ,"AMH HEALTH, LLC ",AMH Health ,"Elevance Health, Inc. ",3,4,3,4,4,5,4,4,4,,,,,,,,,,,,,,,,,,,,,,,,,,,,,,,,,,,,,,
H9066 ,Local CCP ,VISITING NURSE ASSOCIATION OF CENTRAL NEW YORK ,Nascentia Health Plus ,VISITING NURSE ASSOCIATION OF CENTRAL NEW YORK ,Not enough data available ,Not enough data available ,Not enough data available ,Not enough data available ,Not enough data available ,4,Not enough data available ,Not enough data available ,Not enough data available,,,,,,,,,,,,,,,,,,,,,,,,,,,,,,,,,,,,,,
H9096 ,Local CCP ,"DEAN HEALTH PLAN, INC. ",Dean Advantage ,Medica Holding Company ,5,4,4,4,4,4,4,4,4,,,,,,,,,,,,,,,,,,,,,,,,,,,,,,,,,,,,,,
H9104 ,Local CCP ,SCAN HEALTH PLAN ,SCAN Health Plan ,SCAN Group ,Not enough data available ,Not enough data available ,Not enough data available ,Not enough data available ,Not enough data available ,4,Not enough data available ,Not enough data available ,Not enough data available,,,,,,,,,,,,,,,,,,,,,,,,,,,,,,,,,,,,,,
H9147 ,Local CCP ,BLUE CROSS AND BLUE SHIELD OF NC SENIOR HEALTH ,Blue Cross and Blue Shield of North Carolina ,Blue Cross and Blue Shield of North Carolina ,2,3,3,2,Not enough data available ,4,2,2,2,,,,,,,,,,,,,,,,,,,,,,,,,,,,,,,,,,,,,,
H9153 ,Local CCP ,"WEST VIRGINIA SENIOR ADVANTAGE, INC. ",West Virginia Senior Advantage ,"SNP Holdings, LLC ",Not enough data available ,Not enough data available ,Not enough data available ,5,Not enough data available ,4,4,Not enough data available ,4,,,,,,,,,,,,,,,,,,,,,,,,,,,,,,,,,,,,,,
H9179 ,Local CCP ,TRINITY HEALTH PLAN OF MICHIGAN INC ,Trinity Health Plan of Michigan ,Trinity Health Corporation ,Plan too new to be measured ,Plan too new to be measured ,Plan too new to be measured ,Plan too new to be measured ,Plan too new to be measured ,Plan too new to be measured ,Plan too new to be measured ,Plan too new to be measured ,Plan too new to be measured,,,,,,,,,,,,,,,,,,,,,,,,,,,,,,,,,,,,,,
H9191 ,Local CCP ,"PROVIDER PARTNERS HEALTH PLAN OF MISSOURI, INC. ",Provider Partners Health Plans ,"Rifkin Managed Care Holding, LLC ",Not enough data available ,4,Not enough data available ,4,3,3,4,Not enough data available ,3,,,,,,,,,,,,,,,,,,,,,,,,,,,,,,,,,,,,,,
H9207 ,Local CCP ,"HEALTH PARTNERS PLANS, INC. ",Jefferson Health Plans ,Thomas Jefferson University ,4,3,4,4,4,4,4,Not enough data available ,3,,,,,,,,,,,,,,,,,,,,,,,,,,,,,,,,,,,,,,
H9219 ,Local CCP ,"AMH HEALTH PLANS OF MAINE, INC. ",AMH Health ,"Elevance Health, Inc. ",4,Not enough data available ,3,4,Not enough data available ,5,4,2,3,,,,,,,,,,,,,,,,,,,,,,,,,,,,,,,,,,,,,,
H9231 ,Local CCP ,DEVOTED HEALTH INSURANCE COMPANY OF TENNESSEE INC ,Devoted Health ,"Devoted Health, Inc. ",Plan too new to be measured ,Plan too new to be measured ,Plan too new to be measured ,Plan too new to be measured ,Plan too new to be measured ,5,Plan too new to be measured ,Plan too new to be measured ,Plan too new to be measured,,,,,,,,,,,,,,,,,,,,,,,,,,,,,,,,,,,,,,
H9239 ,Demo ,UNITEDHEALTHCARE INSURANCE COMPANY ,UnitedHealthcare ,"UnitedHealth Group, Inc. ",Plan too new to be measured ,Plan too new to be measured ,Plan too new to be measured ,Plan too new to be measured ,Plan too new to be measured ,Plan too new to be measured ,Plan too new to be measured ,Plan too new to be measured ,Plan too new to be measured,,,,,,,,,,,,,,,,,,,,,,,,,,,,,,,,,,,,,,
H9258 ,Local CCP ,"WELLCARE HEALTH PLANS OF RHODE ISLAND, INC. ",Wellcare ,Centene Corporation ,Not enough data available ,Not enough data available ,Not enough data available ,Not enough data available ,Not enough data available ,5,Not enough data available ,Not enough data available ,4,,,,,,,,,,,,,,,,,,,,,,,,,,,,,,,,,,,,,,
H9276 ,Local CCP ,"SUNSHINE HEALTH COMMUNITY SOLUTIONS, INC. ",Allwell ,Centene Corporation ,Not enough data available ,Not enough data available ,Not enough data available ,Not enough data available ,Not enough data available ,Not enough data available ,Not enough data available ,Not enough data available ,Not enough data available,,,,,,,,,,,,,,,,,,,,,,,,,,,,,,,,,,,,,,
H9306 ,Local CCP ,"ALTERWOOD ADVANTAGE, INC. ",Alterwood Advantage ,"Alterwood Health, Inc. ",Plan too new to be measured ,3,2,4,Plan too new to be measured ,5,4,3,3,,,,,,,,,,,,,,,,,,,,,,,,,,,,,,,,,,,,,,
H9335 ,Local CCP ,"WELLCARE HEALTH PLANS OF MISSOURI, INC. ",Wellcare ,Centene Corporation ,1,2,3,2,5,5,3,3,3,,,,,,,,,,,,,,,,,,,,,,,,,,,,,,,,,,,,,,
H9357 ,Local CCP ,CENTENE VENTURE INSURANCE COMPANY TEXAS ,Wellcare by Allwell ,Centene Corporation ,Plan too new to be measured ,Plan too new to be measured ,2,1,Plan too new to be measured ,5,1,Plan too new to be measured ,4,,,,,,,,,,,,,,,,,,,,,,,,,,,,,,,,,,,,,,
H9364 ,Local CCP ,"WELLCARE OF MAINE, INC. ",Wellcare ,Centene Corporation ,3,4,3,3,4,5,3,4,4,,,,,,,,,,,,,,,,,,,,,,,,,,,,,,,,,,,,,,
H9387 ,Local CCP ,"SUNFLOWER STATE HEALTH PLAN, INC. ",Wellcare by Allwell ,Centene Corporation ,1,Not enough data available ,3,2,Not enough data available ,5,2,Not enough data available ,2,,,,,,,,,,,,,,,,,,,,,,,,,,,,,,,,,,,,,,
H9403 ,Local CCP ,"CLEAR SPRING HEALTH (SC), INC. ",Clear Spring Health ,Group 1001 ,Not enough data available ,Not enough data available ,Not enough data available ,Not enough data available ,Not enough data available ,4,Not enough data available ,Not enough data available ,Not enough data available,,,,,,,,,,,,,,,,,,,,,,,,,,,,,,,,,,,,,,
H9412 ,Local CCP ,"GEISINGER QUALITY OPTIONS, INC. ",Geisinger Gold ,Geisinger Health ,Not enough data available ,Not enough data available ,Not enough data available ,Not enough data available ,Not enough data available ,Not enough data available ,Not enough data available ,Not enough data available ,Not enough data available,,,,,,,,,,,,,,,,,,,,,,,,,,,,,,,,,,,,,,
H9414 ,Local CCP ,"Commonwealth Care Alliance Massachusetts, LLC. ",Commonwealth Care Alliance Massachusetts ,"Commonwealth Care Alliance, Inc. ",Plan too new to be measured ,Plan too new to be measured ,Plan too new to be measured ,Plan too new to be measured ,Plan too new to be measured ,4,Plan too new to be measured ,Plan too new to be measured ,2,,,,,,,,,,,,,,,,,,,,,,,,,,,,,,,,,,,,,,
H9428 ,Local CCP ,"WELLCARE HEALTH INSURANCE OF TENNESSEE, INC. ",Wellcare ,Centene Corporation ,1,2,Not enough data available ,1,Not enough data available ,5,2,3,3,,,,,,,,,,,,,,,,,,,,,,,,,,,,,,,,,,,,,,
H9431 ,Local CCP ,FIRST HEALTH LIFE & HEALTH INSURANCE COMPANY ,Aetna Medicare ,CVS Health Corporation ,3,3,2,4,4,5,4,2,3,,,,,,,,,,,,,,,,,,,,,,,,,,,,,,,,,,,,,,
H9460 ,Local CCP ,"CIGNA HEALTHCARE OF ST LOUIS, INC. ",Cigna Healthcare ,The Cigna Group ,3,3,4,3,4,4,3,3,3,,,,,,,,,,,,,,,,,,,,,,,,,,,,,,,,,,,,,,
H9469 ,Local CCP ,UNICARE LIFE AND HEALTH INSURANCE COMPANY ,Simply Healthcare ,"Elevance Health, Inc. ",Plan too new to be measured ,Plan too new to be measured ,Plan too new to be measured ,Plan too new to be measured ,Plan too new to be measured ,5,Plan too new to be measured ,Plan too new to be measured ,Plan too new to be measured,,,,,,,,,,,,,,,,,,,,,,,,,,,,,,,,,,,,,,
H9485 ,Local CCP ,"Mass General Brigham Health Plan, Inc. ",Mass General Brigham Health Plan ,Mass General Brigham Incorporated ,Plan too new to be measured ,Plan too new to be measured ,Plan too new to be measured ,Plan too new to be measured ,Plan too new to be measured ,3,Plan too new to be measured ,Plan too new to be measured ,Plan too new to be measured,,,,,,,,,,,,,,,,,,,,,,,,,,,,,,,,,,,,,,
H9489 ,Local CCP ,"VERMONT BLUE ADVANTAGE, INC. ",Vermont Blue Advantage ,Blue Cross Blue Shield of Michigan Mutual Ins. Co. ,Not enough data available ,Not enough data available ,Not enough data available ,Not enough data available ,Not enough data available ,5,Not enough data available ,Not enough data available ,4,,,,,,,,,,,,,,,,,,,,,,,,,,,,,,,,,,,,,,
H9525 ,Local CCP ,COMPCARE HEALTH SERVICES INSURANCE CORPORATION ,Anthem Blue Cross and Blue Shield ,"Elevance Health, Inc. ",2,3,5,4,4,5,4,4,3,,,,,,,,,,,,,,,,,,,,,,,,,,,,,,,,,,,,,,
H9545 ,Local CCP ,MOLINA HEALTHCARE OF INDIANA INC ,Molina Healthcare of Indiana ,"Molina Healthcare, Inc., ",Plan too new to be measured ,Plan too new to be measured ,Plan too new to be measured ,Plan too new to be measured ,Plan too new to be measured ,Plan too new to be measured ,Plan too new to be measured ,Plan too new to be measured ,Plan too new to be measured,,,,,,,,,,,,,,,,,,,,,,,,,,,,,,,,,,,,,,
H9572 ,Local CCP ,BCBS OF MICHIGAN MUTUAL INSURANCE COMPANY ,Blue Cross Blue Shield of Michigan ,Blue Cross Blue Shield of Michigan Mutual Ins. Co. ,5,4,3,4,4,5,4,4,4,,,,,,,,,,,,,,,,,,,,,,,,,,,,,,,,,,,,,,
H9576 ,Demo ,NEIGHBORHOOD HEALTH PLAN OF RHODE ISLAND ,NEIGHBORHOOD HEALTH PLAN OF RHODE ISLAND ,NEIGHBORHOOD HEALTH PLAN OF RHODE ISLAND ,Not enough data available ,Not enough data available ,Not enough data available ,Not enough data available ,Not enough data available ,Not enough data available ,Not enough data available ,Not enough data available ,Not enough data available,,,,,,,,,,,,,,,,,,,,,,,,,,,,,,,,,,,,,,
H9585 ,Local CCP ,"BOSTON MEDICAL CENTER HEALTH PLAN, INC. ",WellSense Health Plan ,"BMC Health System, Inc. ",4,4,3,4,Not enough data available ,4,5,Not enough data available ,4,,,,,,,,,,,,,,,,,,,,,,,,,,,,,,,,,,,,,,
H9589 ,Local CCP ,"CLEAR SPRING HEALTH (GA), INC. ",Clear Spring Health ,Group 1001 ,Not enough data available ,Not enough data available ,Not enough data available ,Not enough data available ,Not enough data available ,4,Not enough data available ,Not enough data available ,Not enough data available,,,,,,,,,,,,,,,,,,,,,,,,,,,,,,,,,,,,,,
H9590 ,Local CCP ,"LONGEVITY HEALTH PLAN OF ILLINOIS, INC. ",Longevity Health ,"Longevity Health Founders, LLC ",Not enough data available ,Not enough data available ,Not enough data available ,Not enough data available ,Not enough data available ,3,Not enough data available ,Not enough data available ,4,,,,,,,,,,,,,,,,,,,,,,,,,,,,,,,,,,,,,,
H9614 ,Local CCP ,"ALIGNMENT HEALTH INSURANCE COMPANY OF ARIZONA, INC ",Alignment Health Plan ,"Alignment Healthcare USA, LLC ",Plan too new to be measured ,Plan too new to be measured ,Plan too new to be measured ,Plan too new to be measured ,Plan too new to be measured ,5,Plan too new to be measured ,Plan too new to be measured ,Plan too new to be measured,,,,,,,,,,,,,,,,,,,,,,,,,,,,,,,,,,,,,,
H9615 ,Local CCP ,"MVP HEALTH PLAN, INC. ",MVP HEALTH CARE ,"MVP Health Care, Inc. ",4,3,4,4,4,4,4,3,4,,,,,,,,,,,,,,,,,,,,,,,,,,,,,,,,,,,,,,
H9630 ,Local CCP ,"ARKANSAS HEALTH AND WELLNESS HEALTH PLAN, INC ",Wellcare by Allwell ,Centene Corporation ,3,2,4,3,5,5,3,4,3,,,,,,,,,,,,,,,,,,,,,,,,,,,,,,,,,,,,,,
H9656 ,Local CCP ,"BLUE CROSS OF IDAHO CARE PLUS, INC. ",Blue Cross of Idaho ,"Blue Cross of Idaho Health Service, Inc. ",Plan too new to be measured ,Plan too new to be measured ,Plan too new to be measured ,Plan too new to be measured ,Plan too new to be measured ,Plan too new to be measured ,Plan too new to be measured ,Plan too new to be measured ,Plan too new to be measured,,,,,,,,,,,,,,,,,,,,,,,,,,,,,,,,,,,,,,
H9662 ,Local CCP ,"CIGNA HEALTHCARE OF CALIFORNIA, INC. ",Cigna ,The Cigna Group ,Not enough data available ,Not enough data available ,Not enough data available ,Not enough data available ,Not enough data available ,Not enough data available ,Not enough data available ,Not enough data available ,Not enough data available,,,,,,,,,,,,,,,,,,,,,,,,,,,,,,,,,,,,,,
H9678 ,Local CCP ,"HEALTHFIRST INSURANCE COMPANY, INC. ",Healthfirst Medicare Plan ,"Healthfirst, Inc. ",Plan too new to be measured ,Plan too new to be measured ,Plan too new to be measured ,Plan too new to be measured ,Plan too new to be measured ,5,Plan too new to be measured ,Plan too new to be measured ,Plan too new to be measured,,,,,,,,,,,,,,,,,,,,,,,,,,,,,,,,,,,,,,
H9686 ,Local CCP ,"ALIGNMENT HEALTH PLAN OF NEVADA, INC. ",Alignment Health Plan ,"Alignment Healthcare USA, LLC ",3,4,2,3,4,5,3,4,4,,,,,,,,,,,,,,,,,,,,,,,,,,,,,,,,,,,,,,
H9690 ,Local CCP ,AMERICAN HEALTH PLAN OF INDIANA INC ,American Health Advantage of Indiana ,Mitchell Family Office ,Plan too new to be measured ,Plan too new to be measured ,Plan too new to be measured ,Plan too new to be measured ,Plan too new to be measured ,Plan too new to be measured ,Plan too new to be measured ,Plan too new to be measured ,Plan too new to be measured,,,,,,,,,,,,,,,,,,,,,,,,,,,,,,,,,,,,,,
H9699 ,Local CCP ,"HMO PARTNERS, INC. ",Arkansas Blue Medicare ,USAble Mutual Insurance Company ,3,3,4,4,4,5,4,3,3,,,,,,,,,,,,,,,,,,,,,,,,,,,,,,,,,,,,,,
H9706 ,Local CCP ,HCSC INSURANCE SERVICES COMPANY ,Blue Cross and Blue Shield of Texas ,Health Care Service Corporation ,4,2,3,3,4,5,3,3,3,,,,,,,,,,,,,,,,,,,,,,,,,,,,,,,,,,,,,,
H9712 ,Demo ,"HAP EMPOWERED HEALTH PLAN, INC. ",HAP Empowered MI Health Link ,Henry Ford Health System ,Not enough data available ,Not enough data available ,Not enough data available ,Not enough data available ,Not enough data available ,Not enough data available ,Not enough data available ,Not enough data available ,Not enough data available,,,,,,,,,,,,,,,,,,,,,,,,,,,,,,,,,,,,,,
H9725 ,Local CCP ,"CIGNA HEALTHCARE OF NORTH CAROLINA, INC. ",Cigna Healthcare ,The Cigna Group ,3,4,5,4,4,4,4,4,4,,,,,,,,,,,,,,,,,,,,,,,,,,,,,,,,,,,,,,
H9730 ,Local CCP ,"WELLCARE HEALTH INSURANCE COMPANY OF KENTUCKY, INC ",Wellcare ,Centene Corporation ,2,3,4,3,3,5,3,5,3,,,,,,,,,,,,,,,,,,,,,,,,,,,,,,,,,,,,,,
H9761 ,Local CCP ,"WELLCARE HEALTH PLANS OF MASSACHUSETTS, INC. ",Wellcare ,Centene Corporation ,Plan too new to be measured ,2,3,2,Plan too new to be measured ,5,2,Plan too new to be measured ,3,,,,,,,,,,,,,,,,,,,,,,,,,,,,,,,,,,,,,,
H9763 ,Local CCP ,"OCHSNER HEALTH PLAN, INC. ",Ochsner Health Plan ,Ochsner Clinic Foundation ,Plan too new to be measured ,Plan too new to be measured ,4,5,Plan too new to be measured ,3,5,5,3,,,,,,,,,,,,,,,,,,,,,,,,,,,,,,,,,,,,,,
H9808 ,Local CCP ,CARE N' CARE INSURANCE COMPANY OF NORTH CAROLINA ,CARE N'' CARE INSURANCE COMPANY OF NORTH CAROLINA ,"HTA Holdings, LLC ",5,4,5,4,4,4,4,4,3,,,,,,,,,,,,,,,,,,,,,,,,,,,,,,,,,,,,,,
H9811 ,Local CCP ,"MAGNOLIA HEALTH PLAN, INC. ",Wellcare by Allwell ,Centene Corporation ,2,2,Not enough data available ,2,Not enough data available ,5,3,Not enough data available ,3,,,,,,,,,,,,,,,,,,,,,,,,,,,,,,,,,,,,,,
H9826 ,Local CCP ,"COMMUNITY HEALTH CHOICE TEXAS, INC. ",Community Health Choice ,Harris County Hospital District ,Not enough data available ,Not enough data available ,Not enough data available ,Not enough data available ,Not enough data available ,4,Not enough data available ,Not enough data available ,2,,,,,,,,,,,,,,,,,,,,,,,,,,,,,,,,,,,,,,
H9827 ,Local CCP ,"MOUNT CARMEL HEALTH PLAN OF NEW YORK, INC. ",MediGold ,Trinity Health Corporation ,Plan too new to be measured ,Plan too new to be measured ,Plan too new to be measured ,Plan too new to be measured ,Plan too new to be measured ,5,Plan too new to be measured ,Plan too new to be measured ,3,,,,,,,,,,,,,,,,,,,,,,,,,,,,,,,,,,,,,,
H9834 ,Local CCP ,QUARTZ HEALTH PLAN MN CORPORATION ,Quartz Medicare Advantage ,University of Wisconsin Hospitals and Clincs Autho ,5,4,5,4,4,5,4,5,4,,,,,,,,,,,,,,,,,,,,,,,,,,,,,,,,,,,,,,
H9861 ,Local CCP ,"CCA HEALTH MICHIGAN, INC. ",CCA Health Michigan ,"Commonwealth Care Alliance, Inc. ",Not enough data available ,2,Not enough data available ,Not enough data available ,Not enough data available ,4,Not enough data available ,Not enough data available ,3,,,,,,,,,,,,,,,,,,,,,,,,,,,,,,,,,,,,,,
H9869 ,Demo ,"PARTNERS HEALTH PLAN, INC. ",Partners Health Plan ,"PHSI, Inc. ",Not enough data available ,Not enough data available ,Not enough data available ,Not enough data available ,Not enough data available ,Not enough data available ,Not enough data available ,Not enough data available ,Not enough data available,,,,,,,,,,,,,,,,,,,,,,,,,,,,,,,,,,,,,,
H9876 ,Local CCP ,"Commonwealth Care Alliance Rhode Island, LLC ",CCA Health Rhode Island ,"Commonwealth Care Alliance, Inc. ",Plan too new to be measured ,Plan too new to be measured ,Plan too new to be measured ,Plan too new to be measured ,Plan too new to be measured ,4,Plan too new to be measured ,Plan too new to be measured ,Plan too new to be measured,,,,,,,,,,,,,,,,,,,,,,,,,,,,,,,,,,,,,,
H9884 ,Local CCP ,DEVOTED HEALTH INSURANCE COMPANY ,Devoted Health ,"Devoted Health, Inc. ",Plan too new to be measured ,Plan too new to be measured ,Plan too new to be measured ,Plan too new to be measured ,Plan too new to be measured ,5,Plan too new to be measured ,Plan too new to be measured ,4,,,,,,,,,,,,,,,,,,,,,,,,,,,,,,,,,,,,,,
H9888 ,Local CCP ,DEVOTED HEALTH INSURANCE COMPANY OF ALABAMA INC ,Devoted Health ,"Devoted Health, Inc. ",Plan too new to be measured ,Plan too new to be measured ,Plan too new to be measured ,Plan too new to be measured ,Plan too new to be measured ,5,Plan too new to be measured ,Plan too new to be measured ,Plan too new to be measured,,,,,,,,,,,,,,,,,,,,,,,,,,,,,,,,,,,,,,
H9900 ,Local CCP ,"WELLCARE OF OKLAHOMA, INC. ",Wellcare ,Centene Corporation ,Plan too new to be measured ,2,Plan too new to be measured ,1,Plan too new to be measured ,5,1,Plan too new to be measured ,2,,,,,,,,,,,,,,,,,,,,,,,,,,,,,,,,,,,,,,
H9904 ,Local CCP ,"CENTRAL MASS HEALTH, LLC ",Mass Advantage ,Central Mass Health Holding LLC ,Plan too new to be measured ,Plan too new to be measured ,Plan too new to be measured ,Plan too new to be measured ,Plan too new to be measured ,5,Plan too new to be measured ,Plan too new to be measured ,3,,,,,,,,,,,,,,,,,,,,,,,,,,,,,,,,,,,,,,
H9907 ,Local CCP ,TUFTS ASSOCIATED HEALTH MAINTENANCE ORGANIZATION ,Tufts Health Plan ,"Point32Health, Inc. ",Plan too new to be measured ,Plan too new to be measured ,Plan too new to be measured ,Plan too new to be measured ,Plan too new to be measured ,5,Plan too new to be measured ,Plan too new to be measured ,Plan too new to be measured,,,,,,,,,,,,,,,,,,,,,,,,,,,,,,,,,,,,,,
H9909 ,Local CCP ,"AMERICAN HEALTH PLAN OF MS, INC. ",American Health Advantage of MS ,Mitchell Family Office ,Not enough data available ,Not enough data available ,Not enough data available ,Not enough data available ,Not enough data available ,3,Not enough data available ,Not enough data available ,3,,,,,,,,,,,,,,,,,,,,,,,,,,,,,,,,,,,,,,
H9917 ,Local CCP ,"ALIGN SENIOR CARE FLORIDA, INC. ",Align Senior Care ,"Innovative Long Term Care Management, Inc. ",Not enough data available ,Not enough data available ,Not enough data available ,Not enough data available ,Not enough data available ,5,Not enough data available ,Not enough data available ,Not enough data available,,,,,,,,,,,,,,,,,,,,,,,,,,,,,,,,,,,,,,
H9940 ,Local CCP ,LONGEVITY HEALTH PLAN OF MASSACHUSETTS INC ,Longevity Health Plan of Massachusetts ,"Longevity Health Founders, LLC ",Plan too new to be measured ,Plan too new to be measured ,Plan too new to be measured ,Plan too new to be measured ,Plan too new to be measured ,3,Plan too new to be measured ,Plan too new to be measured ,Plan too new to be measured,,,,,,,,,,,,,,,,,,,,,,,,,,,,,,,,,,,,,,
H9942 ,Local CCP ,LONGEVITY HEALTH PLAN OF NEW JERSEY INSURANCE COMP ,Longevity Health Plan ,"Longevity Health Founders, LLC ",Not enough data available ,Not enough data available ,Not enough data available ,5,Not enough data available ,3,4,Not enough data available ,4,,,,,,,,,,,,,,,,,,,,,,,,,,,,,,,,,,,,,,
H9943 ,Local CCP ,ALIGNMENT HEALTH PLAN OF FLORIDA INC ,Alignment Health Plan ,"Alignment Healthcare USA, LLC ",Plan too new to be measured ,Plan too new to be measured ,Plan too new to be measured ,Plan too new to be measured ,Plan too new to be measured ,5,Plan too new to be measured ,Plan too new to be measured ,Plan too new to be measured,,,,,,,,,,,,,,,,,,,,,,,,,,,,,,,,,,,,,,
