2024 Domain Star View: Medicare Report Card Master Table,,,,,,,,,,,,,,,,,,,,,,,,,,,,,,,,,,,,,,,,,,,,,,,,,,,
Contract Number,Organization Type,Contract Name,Organization Marketing Name,Parent Organization,"HD1: Staying Healthy: Screenings, Tests and Vaccines",HD2: Managing Chronic (Long Term) Conditions,HD3: Member Experience with Health Plan,HD4: Member Complaints and Changes in the Health Plan's Performance,HD5: Health Plan Customer Service,DD1: Drug Plan Customer Service,DD2: Member Complaints and Changes in the Drug Plan’s Performance,DD3: Member Experience with the Drug Plan,DD4: Drug Safety and Accuracy of Drug Pricing,,,,,,,,,,,,,,,,,,,,,,,,,,,,,,,,,,,,,,
E3014 ,Employer/Union Only Direct Contract PDP ,PSERS HOP PROGRAM ,Pennsylvania Public School Employees Retirement Sy ,Commonwealth of PA Pub Schools Retirement System ,Plan not required to report measure ,Plan not required to report measure ,Plan not required to report measure ,Plan not required to report measure ,Plan not required to report measure ,Not enough data available ,5,5,4,,,,,,,,,,,,,,,,,,,,,,,,,,,,,,,,,,,,,,
H0022 ,Demo ,"BUCKEYE COMMUNITY HEALTH PLAN, INC. ",Buckeye Health Plan - MyCare Ohio ,Centene Corporation ,Not enough data available ,Not enough data available ,Not enough data available ,Not enough data available ,Not enough data available ,Not enough data available ,Not enough data available ,Not enough data available ,Not enough data available,,,,,,,,,,,,,,,,,,,,,,,,,,,,,,,,,,,,,,
H0028 ,Local CCP ,"CHA HMO, INC. ",Humana ,Humana Inc. ,4,4,3,4,5,5,4,4,3,,,,,,,,,,,,,,,,,,,,,,,,,,,,,,,,,,,,,,
H0029 ,Local CCP ,"COORDINATED CARE OF WASHINGTON, INC. ",Allwell ,Centene Corporation ,Not enough data available ,Not enough data available ,Not enough data available ,Not enough data available ,Not enough data available ,Not enough data available ,Not enough data available ,Not enough data available ,Not enough data available,,,,,,,,,,,,,,,,,,,,,,,,,,,,,,,,,,,,,,
H0034 ,Local CCP ,"HAMASPIK, INC. ","Hamaspik, Inc. ","Hamaspik of Rockland County, Inc. ",Not enough data available ,2,Not enough data available ,3,Not enough data available ,4,3,Not enough data available ,2,,,,,,,,,,,,,,,,,,,,,,,,,,,,,,,,,,,,,,
H0062 ,Local CCP ,"SUPERIOR HEALTHPLAN, INC. ",Wellcare by Allwell ,Centene Corporation ,4,2,Not enough data available ,Not enough data available ,Not enough data available ,Not enough data available ,3,Not enough data available ,3,,,,,,,,,,,,,,,,,,,,,,,,,,,,,,,,,,,,,,
H0074 ,Local CCP ,"WELLCARE OF MISSISSIPPI, INC. ",Wellcare ,Centene Corporation ,3,Not enough data available ,3,2,Not enough data available ,5,2,3,3,,,,,,,,,,,,,,,,,,,,,,,,,,,,,,,,,,,,,,
H0088 ,Local CCP ,"WELLCARE HEALTH INSURANCE OF NEW YORK, INC. ",Wellcare ,Centene Corporation ,2,2,Not enough data available ,2,Not enough data available ,5,2,Not enough data available ,2,,,,,,,,,,,,,,,,,,,,,,,,,,,,,,,,,,,,,,
H0104 ,Local CCP ,BLUE CROSS AND BLUE SHIELD OF ALABAMA ,Blue Cross and Blue Shield of Alabama ,BlueCross BlueShield of Alabama ,3,3,4,4,5,5,5,3,3,,,,,,,,,,,,,,,,,,,,,,,,,,,,,,,,,,,,,,
H0107 ,Local CCP ,HEALTH CARE SERVICE CORPORATION ,Blue Cross and Blue Shield of Montana ,Health Care Service Corporation ,4,3,4,4,4,5,4,2,3,,,,,,,,,,,,,,,,,,,,,,,,,,,,,,,,,,,,,,
H0111 ,Local CCP ,"WELLCARE OF GEORGIA, INC. ",Wellcare ,Centene Corporation ,2,2,3,2,3,5,2,4,3,,,,,,,,,,,,,,,,,,,,,,,,,,,,,,,,,,,,,,
H0137 ,Demo ,"COMMONWEALTH CARE ALLIANCE, INC. ",Commonwealth Care Alliance Massachusetts ,"Commonwealth Care Alliance, Inc. ",Not enough data available ,Not enough data available ,Not enough data available ,Not enough data available ,Not enough data available ,Not enough data available ,Not enough data available ,Not enough data available ,Not enough data available,,,,,,,,,,,,,,,,,,,,,,,,,,,,,,,,,,,,,,
H0154 ,Local CCP ,"VIVA HEALTH, INC. ",VIVA Medicare ,"Triton Health Systems, L.L.C. ",3,4,5,4,4,5,4,5,3,,,,,,,,,,,,,,,,,,,,,,,,,,,,,,,,,,,,,,
H0169 ,Local CCP ,"UNITEDHEALTHCARE OF WISCONSIN, INC. ",UnitedHealthcare ,"UnitedHealth Group, Inc. ",3,4,5,4,5,5,4,5,4,,,,,,,,,,,,,,,,,,,,,,,,,,,,,,,,,,,,,,
H0174 ,Local CCP ,"WELLCARE OF TEXAS, INC. ",Wellcare ,Centene Corporation ,3,3,3,3,4,5,4,4,3,,,,,,,,,,,,,,,,,,,,,,,,,,,,,,,,,,,,,,
H0192 ,Demo ,"AMERIHEALTH MICHIGAN, INC. ",AmeriHealth Caritas VIP Care Plus ,"Independence Health Group, Inc. ",Not enough data available ,Not enough data available ,Not enough data available ,Not enough data available ,Not enough data available ,Not enough data available ,Not enough data available ,Not enough data available ,Not enough data available,,,,,,,,,,,,,,,,,,,,,,,,,,,,,,,,,,,,,,
H0251 ,Local CCP ,"UNITEDHEALTHCARE PLAN OF THE RIVER VALLEY, INC. ",UnitedHealthcare ,"UnitedHealth Group, Inc. ",2,3,5,5,4,Not enough data available ,5,5,3,,,,,,,,,,,,,,,,,,,,,,,,,,,,,,,,,,,,,,
H0270 ,Local CCP ,WELLCARE HEALTH INSURANCE COMPANY OF AMERICA ,Wellcare ,Centene Corporation ,2,3,3,2,Not enough data available ,5,3,4,3,,,,,,,,,,,,,,,,,,,,,,,,,,,,,,,,,,,,,,
H0271 ,Local CCP ,CARE IMPROVEMENT PLUS SOUTH CENTRAL INSURANCE CO. ,UnitedHealthcare ,"UnitedHealth Group, Inc. ",3,3,4,4,5,5,4,5,3,,,,,,,,,,,,,,,,,,,,,,,,,,,,,,,,,,,,,,
H0292 ,Local CCP ,"HUMANA HEALTH PLAN OF OHIO, INC. ",Humana ,Humana Inc. ,4,4,5,4,5,5,3,5,3,,,,,,,,,,,,,,,,,,,,,,,,,,,,,,,,,,,,,,
H0294 ,Local CCP ,UNITEDHEALTHCARE INSURANCE COMPANY ,UnitedHealthcare ,"UnitedHealth Group, Inc. ",4,4,3,4,5,5,4,2,4,,,,,,,,,,,,,,,,,,,,,,,,,,,,,,,,,,,,,,
H0302 ,Local CCP ,"MEDISUN, INC. ",Blue Cross Blue Shield of Arizona (AZ Blue) ,Blue Cross Blue Shield of Arizona ,4,3,3,4,5,5,4,4,4,,,,,,,,,,,,,,,,,,,,,,,,,,,,,,,,,,,,,,
H0321 ,Local CCP ,"ARIZONA PHYSICIANS IPA, INC. ",UnitedHealthcare ,"UnitedHealth Group, Inc. ",3,3,3,4,4,5,4,4,3,,,,,,,,,,,,,,,,,,,,,,,,,,,,,,,,,,,,,,
H0332 ,Local CCP ,"KS PLAN ADMINISTRATORS, LLC ",KelseyCare Advantage ,"UnitedHealth Group, Inc. ",5,4,5,4,5,5,5,5,4,,,,,,,,,,,,,,,,,,,,,,,,,,,,,,,,,,,,,,
H0336 ,Demo ,"HUMANA HEALTH PLAN, INC. ",Humana ,Humana Inc. ,Not enough data available ,Not enough data available ,Not enough data available ,Not enough data available ,Not enough data available ,Not enough data available ,Not enough data available ,Not enough data available ,Not enough data available,,,,,,,,,,,,,,,,,,,,,,,,,,,,,,,,,,,,,,
H0342 ,Local CCP ,"CAREPARTNERS OF CONNECTICUT, INC. ",CarePartners of Connecticut ,"Point32Health, Inc. ",Not enough data available ,Not enough data available ,Not enough data available ,Not enough data available ,Not enough data available ,5,Not enough data available ,Not enough data available ,4,,,,,,,,,,,,,,,,,,,,,,,,,,,,,,,,,,,,,,
H0351 ,Local CCP ,"HEALTH NET OF ARIZONA, INC. ",Wellcare by Allwell ,Centene Corporation ,3,3,2,4,5,5,4,2,4,,,,,,,,,,,,,,,,,,,,,,,,,,,,,,,,,,,,,,
H0354 ,Local CCP ,"CIGNA HEALTHCARE OF ARIZONA, INC. ",Cigna Healthcare ,The Cigna Group ,4,4,4,4,4,4,5,4,4,,,,,,,,,,,,,,,,,,,,,,,,,,,,,,,,,,,,,,
H0363 ,Local CCP ,"LONGEVITY HEALTH PLAN OF COLORADO, INC. ",Longevity Health Plan ,"Longevity Health Founders, LLC ",Not enough data available ,Not enough data available ,Not enough data available ,Not enough data available ,Not enough data available ,3,Not enough data available ,Not enough data available ,5,,,,,,,,,,,,,,,,,,,,,,,,,,,,,,,,,,,,,,
H0422 ,Local CCP ,"UCARE HEALTH, INC. ",UCare ,UCare Minnesota ,5,Not enough data available ,3,Not enough data available ,Not enough data available ,5,Not enough data available ,2,4,,,,,,,,,,,,,,,,,,,,,,,,,,,,,,,,,,,,,,
H0423 ,Local CCP ,"METROPLUS HEALTH PLAN, INC. ",MetroPlus Health Plan ,New York City Health and Hospitals Corporation ,4,4,3,3,4,4,3,2,4,,,,,,,,,,,,,,,,,,,,,,,,,,,,,,,,,,,,,,
H0432 ,Local CCP ,"UNITEDHEALTHCARE OF THE MIDLANDS, INC. ",UnitedHealthcare ,"UnitedHealth Group, Inc. ",3,3,5,3,5,5,4,5,3,,,,,,,,,,,,,,,,,,,,,,,,,,,,,,,,,,,,,,
H0439 ,Local CCP ,"CIGNA HEALTHCARE OF GEORGIA, INC. ",Cigna Healthcare ,The Cigna Group ,3,3,4,4,4,4,4,4,3,,,,,,,,,,,,,,,,,,,,,,,,,,,,,,,,,,,,,,
H0473 ,Local CCP ,HUMANA INSURANCE COMPANY OF KENTUCKY ,Humana ,Humana Inc. ,3,3,4,3,5,5,3,4,2,,,,,,,,,,,,,,,,,,,,,,,,,,,,,,,,,,,,,,
H0480 ,Demo ,"MERIDIAN HEALTH PLAN OF MICHIGAN, INC. ",MeridianComplete (Medicare-Medicaid Plan) ,Centene Corporation ,Not enough data available ,Not enough data available ,Not enough data available ,Not enough data available ,Not enough data available ,Not enough data available ,Not enough data available ,Not enough data available ,Not enough data available,,,,,,,,,,,,,,,,,,,,,,,,,,,,,,,,,,,,,,
H0482 ,Local CCP ,CENTENE VENTURE COMPANY MICHIGAN ,Wellcare by Allwell ,Centene Corporation ,2,3,3,2,Not enough data available ,5,3,4,3,,,,,,,,,,,,,,,,,,,,,,,,,,,,,,,,,,,,,,
H0504 ,Local CCP ,CALIFORNIA PHYSICIANS' SERVICE ,Blue Shield of California ,California Physicians' Service ,5,3,2,4,5,5,4,3,4,,,,,,,,,,,,,,,,,,,,,,,,,,,,,,,,,,,,,,
H0523 ,Local CCP ,AETNA HEALTH OF CALIFORNIA INC. ,Aetna Medicare ,CVS Health Corporation ,3,3,1,3,5,5,3,3,4,,,,,,,,,,,,,,,,,,,,,,,,,,,,,,,,,,,,,,
H0524 ,Local CCP ,"KAISER FOUNDATION HP, INC. ",Kaiser Permanente ,"Kaiser Foundation Health Plan, Inc. ",5,4,2,4,4,1,4,5,5,,,,,,,,,,,,,,,,,,,,,,,,,,,,,,,,,,,,,,
H0543 ,Local CCP ,UHC OF CALIFORNIA ,UnitedHealthcare ,"UnitedHealth Group, Inc. ",4,4,3,4,5,5,4,4,4,,,,,,,,,,,,,,,,,,,,,,,,,,,,,,,,,,,,,,
H0544 ,Local CCP ,BLUE CROSS OF CALIFORNIA ,Anthem Blue Cross ,"Elevance Health, Inc. ",3,3,1,3,4,5,4,2,3,,,,,,,,,,,,,,,,,,,,,,,,,,,,,,,,,,,,,,
H0562 ,Local CCP ,"HEALTH NET OF CALIFORNIA, INC. ",Wellcare by Health Net ,Centene Corporation ,4,3,2,3,4,5,4,2,4,,,,,,,,,,,,,,,,,,,,,,,,,,,,,,,,,,,,,,
H0571 ,Local CCP ,CHINESE COMMUNITY HEALTH PLAN ,CCHP (Chinese Community Health Plan) ,Chinese Hospital Association ,4,3,2,4,4,4,4,3,3,,,,,,,,,,,,,,,,,,,,,,,,,,,,,,,,,,,,,,
H0609 ,Local CCP ,"UnitedHealthcare Benefits of Texas, Inc. ",UnitedHealthcare ,"UnitedHealth Group, Inc. ",5,4,3,5,5,5,5,4,4,,,,,,,,,,,,,,,,,,,,,,,,,,,,,,,,,,,,,,
H0624 ,Local CCP ,"UnitedHealthcare Benefits of Texas, Inc. ",UnitedHealthcare ,"UnitedHealth Group, Inc. ",3,4,4,4,5,5,4,3,4,,,,,,,,,,,,,,,,,,,,,,,,,,,,,,,,,,,,,,
H0628 ,Local CCP ,AETNA HEALTH OF OHIO INC. ,Aetna Medicare ,CVS Health Corporation ,3,4,5,3,4,5,4,4,3,,,,,,,,,,,,,,,,,,,,,,,,,,,,,,,,,,,,,,
H0630 ,Local CCP ,KAISER FOUNDATION HP OF CO ,Kaiser Permanente ,"Kaiser Foundation Health Plan, Inc. ",5,4,4,4,4,1,5,5,5,,,,,,,,,,,,,,,,,,,,,,,,,,,,,,,,,,,,,,
H0672 ,Local CCP ,"CIGNA HEALTHCARE OF COLORADO, INC. ",Cigna Healthcare ,The Cigna Group ,3,4,2,4,4,4,3,2,3,,,,,,,,,,,,,,,,,,,,,,,,,,,,,,,,,,,,,,
H0710 ,Local CCP ,CARE IMPROVEMENT PLUS SOUTH CENTRAL INSURANCE CO. ,UnitedHealthcare ,"UnitedHealth Group, Inc. ",Not enough data available ,5,Not enough data available ,5,4,5,5,Not enough data available ,5,,,,,,,,,,,,,,,,,,,,,,,,,,,,,,,,,,,,,,
H0712 ,Local CCP ,"WELLCARE OF CONNECTICUT, INC. ",Wellcare ,Centene Corporation ,3,3,3,3,4,5,3,3,3,,,,,,,,,,,,,,,,,,,,,,,,,,,,,,,,,,,,,,
H0724 ,Local CCP ,"BUCKEYE HEALTH PLAN COMMUNITY SOLUTIONS, Inc. ",Wellcare by Allwell ,Centene Corporation ,2,2,3,2,Not enough data available ,5,2,Not enough data available ,3,,,,,,,,,,,,,,,,,,,,,,,,,,,,,,,,,,,,,,
H0738 ,Local CCP ,"AmeriHealth Caritas VIP Next, Inc. ",AmeriHealth Caritas VIP Care (HMO-D-SNP) ,"Independence Health Group, Inc. ",Plan too new to be measured ,Plan too new to be measured ,Plan too new to be measured ,Plan too new to be measured ,Plan too new to be measured ,4,Plan too new to be measured ,Plan too new to be measured ,Plan too new to be measured,,,,,,,,,,,,,,,,,,,,,,,,,,,,,,,,,,,,,,
H0755 ,Local CCP ,CARE IMPROVEMENT PLUS SOUTH CENTRAL INSURANCE CO. ,UnitedHealthcare ,"UnitedHealth Group, Inc. ",5,3,3,3,5,5,4,3,4,,,,,,,,,,,,,,,,,,,,,,,,,,,,,,,,,,,,,,
H0764 ,Local CCP ,"UNITEDHEALTHCARE OF NEW ENGLAND, INC. ",UnitedHealthcare ,"UnitedHealth Group, Inc. ",Plan too new to be measured ,Plan too new to be measured ,Plan too new to be measured ,Plan too new to be measured ,Plan too new to be measured ,5,Plan too new to be measured ,Plan too new to be measured ,Plan too new to be measured,,,,,,,,,,,,,,,,,,,,,,,,,,,,,,,,,,,,,,
H0783 ,Local CCP ,"HUMANA BENEFIT PLAN OF TEXAS, INC. ",Humana ,Humana Inc. ,Not enough data available ,Not enough data available ,Not enough data available ,Not enough data available ,Not enough data available ,5,Not enough data available ,Not enough data available ,4,,,,,,,,,,,,,,,,,,,,,,,,,,,,,,,,,,,,,,
H0838 ,Local CCP ,"UNIVERSAL CARE, INC. ",Brand New Day ,"Bright Health Group, Inc. ",4,3,1,3,4,5,3,2,2,,,,,,,,,,,,,,,,,,,,,,,,,,,,,,,,,,,,,,
H0845 ,Local CCP ,"UNITEDHEALTHCARE OF ILLINOIS, INC. ",UnitedHealthcare ,"UnitedHealth Group, Inc. ",Plan too new to be measured ,Plan too new to be measured ,Plan too new to be measured ,Plan too new to be measured ,Plan too new to be measured ,Plan too new to be measured ,Plan too new to be measured ,Plan too new to be measured ,Plan too new to be measured,,,,,,,,,,,,,,,,,,,,,,,,,,,,,,,,,,,,,,
H0876 ,Local CCP ,"Commonwealth Care Alliance Rhode Island, LLC ",CCA Health Rhode Island ,"Commonwealth Care Alliance, Inc. ",Plan too new to be measured ,Plan too new to be measured ,Plan too new to be measured ,Plan too new to be measured ,Plan too new to be measured ,4,Plan too new to be measured ,Plan too new to be measured ,Plan too new to be measured,,,,,,,,,,,,,,,,,,,,,,,,,,,,,,,,,,,,,,
H0885 ,Local CCP ,HEALTHIER NEW JERSEY INSURANCE COMPANY ,Braven Health ,"NJ Collaborative Care, LLC ",3,3,4,4,4,5,5,2,4,,,,,,,,,,,,,,,,,,,,,,,,,,,,,,,,,,,,,,
H0907 ,Local CCP ,"AMERIGROUP IOWA, INC. ",Amerigroup Iowa ,"Elevance Health, Inc. ",3,4,3,3,Not enough data available ,5,3,4,3,,,,,,,,,,,,,,,,,,,,,,,,,,,,,,,,,,,,,,
H0908 ,Local CCP ,"BUCKEYE COMMUNITY HEALTH PLAN, INC. ",Wellcare by Allwell ,Centene Corporation ,2,2,3,1,5,5,1,2,3,,,,,,,,,,,,,,,,,,,,,,,,,,,,,,,,,,,,,,
H0913 ,Local CCP ,"WELLCARE HEALTH PLANS OF NEW JERSEY, INC. ",Wellcare ,Centene Corporation ,3,3,Not enough data available ,3,4,5,3,4,3,,,,,,,,,,,,,,,,,,,,,,,,,,,,,,,,,,,,,,
H0927 ,Demo ,HEALTH CARE SERVICE CORPORATION ,Blue Cross Community MMAI ,Health Care Service Corporation ,Not enough data available ,Not enough data available ,Not enough data available ,Not enough data available ,Not enough data available ,Not enough data available ,Not enough data available ,Not enough data available ,Not enough data available,,,,,,,,,,,,,,,,,,,,,,,,,,,,,,,,,,,,,,
H0969 ,Local CCP ,WELLCARE HEALTH INSURANCE COMPANY OF NEW HAMPSHIRE ,Wellcare ,Centene Corporation ,2,2,2,3,Not enough data available ,5,3,2,3,,,,,,,,,,,,,,,,,,,,,,,,,,,,,,,,,,,,,,
H0976 ,Local CCP ,SCAN HEALTH PLAN ,SCAN Health Plan ,SCAN Group ,Plan too new to be measured ,Plan too new to be measured ,Plan too new to be measured ,Plan too new to be measured ,Plan too new to be measured ,Plan too new to be measured ,Plan too new to be measured ,Plan too new to be measured ,Plan too new to be measured,,,,,,,,,,,,,,,,,,,,,,,,,,,,,,,,,,,,,,
H0978 ,Local CCP ,"SCAN HEALTH PLAN NEVADA, INC. ",SCAN Health Plan ,SCAN Group ,Plan too new to be measured ,4,1,3,Plan too new to be measured ,4,3,3,5,,,,,,,,,,,,,,,,,,,,,,,,,,,,,,,,,,,,,,
H0982 ,Local CCP ,"SOLIS HEALTH PLANS, INC. ",Solis Health Plans ,"Athena Healthcare Holdings, LLC ",3,4,5,3,Not enough data available ,4,2,5,3,,,,,,,,,,,,,,,,,,,,,,,,,,,,,,,,,,,,,,
H1016 ,Local CCP ,"AVMED, INC. ",AvMed Medicare ,Sentara Health Care (SHC) ,5,4,3,3,5,5,3,3,3,,,,,,,,,,,,,,,,,,,,,,,,,,,,,,,,,,,,,,
H1019 ,Local CCP ,"CAREPLUS HEALTH PLANS, INC. ","CarePlus Health Plans, Inc. ",Humana Inc. ,4,4,3,3,5,4,4,4,4,,,,,,,,,,,,,,,,,,,,,,,,,,,,,,,,,,,,,,
H1032 ,Local CCP ,"Sunshine State Health Plan, Inc. ",Wellcare ,Centene Corporation ,4,3,3,3,4,5,4,4,4,,,,,,,,,,,,,,,,,,,,,,,,,,,,,,,,,,,,,,
H1035 ,Local CCP ,"FLORIDA BLUE MEDICARE, INC. ",Florida Blue HMO ,Guidewell Mutual Holding Corporation ,4,3,4,4,4,2,4,5,4,,,,,,,,,,,,,,,,,,,,,,,,,,,,,,,,,,,,,,
H1036 ,Local CCP ,"HUMANA MEDICAL PLAN, INC. ",Humana ,Humana Inc. ,4,4,4,4,5,5,4,5,4,,,,,,,,,,,,,,,,,,,,,,,,,,,,,,,,,,,,,,
H1045 ,Local CCP ,"PREFERRED CARE PARTNERS, INC. ",UnitedHealthcare ,"UnitedHealth Group, Inc. ",4,4,4,5,5,5,5,4,4,,,,,,,,,,,,,,,,,,,,,,,,,,,,,,,,,,,,,,
H1099 ,Local CCP ,HEALTH FIRST HEALTH PLANS ,"Health First Health Plans, Inc. ","Health First Shared Services, Inc. ",4,4,3,4,5,4,4,4,4,,,,,,,,,,,,,,,,,,,,,,,,,,,,,,,,,,,,,,
H1109 ,Local CCP ,AETNA HEALTH INC.(GA) ,Aetna Medicare ,CVS Health Corporation ,4,4,4,4,Not enough data available ,5,4,4,3,,,,,,,,,,,,,,,,,,,,,,,,,,,,,,,,,,,,,,
H1112 ,Local CCP ,"WELLCARE OF GEORGIA, INC. ",Wellcare ,Centene Corporation ,3,3,3,3,4,5,3,4,3,,,,,,,,,,,,,,,,,,,,,,,,,,,,,,,,,,,,,,
H1119 ,Local CCP ,"TSG GUARD, INC. ",Valor Health Plan ,"The Schroer Group, Inc. ",Not enough data available ,Not enough data available ,Not enough data available ,5,Not enough data available ,4,4,Not enough data available ,5,,,,,,,,,,,,,,,,,,,,,,,,,,,,,,,,,,,,,,
H1170 ,Local CCP ,"KAISER FOUNDATION HP OF GA, INC. ",Kaiser Permanente ,"Kaiser Foundation Health Plan, Inc. ",5,4,3,3,2,1,4,5,4,,,,,,,,,,,,,,,,,,,,,,,,,,,,,,,,,,,,,,
H1181 ,MSA ,NETWORK HEALTH INSURANCE CORPORATION ,Network Health Medicare Advantage Plans ,"Network Health, Inc. ",2,4,4,3,Not enough data available ,Plan not required to report measure ,Plan not required to report measure ,Plan not required to report measure ,Plan not required to report measure,,,,,,,,,,,,,,,,,,,,,,,,,,,,,,,,,,,,,,
H1189 ,Local CCP ,CHRISTUS HEALTH PLAN ,CHRISTUS Health Advantage ,CHRISTUS Health ,4,3,4,3,4,4,4,2,3,,,,,,,,,,,,,,,,,,,,,,,,,,,,,,,,,,,,,,
H1206 ,Local CCP ,"COVENTRY HEALTH CARE OF ILLINOIS, INC. ",Aetna Medicare ,CVS Health Corporation ,Plan too new to be measured ,Plan too new to be measured ,Plan too new to be measured ,Plan too new to be measured ,Plan too new to be measured ,Plan too new to be measured ,Plan too new to be measured ,Plan too new to be measured ,Plan too new to be measured,,,,,,,,,,,,,,,,,,,,,,,,,,,,,,,,,,,,,,
H1215 ,Local CCP ,"NEBRASKA TOTAL CARE, INC. ",Wellcare ,Centene Corporation ,Plan too new to be measured ,3,3,2,Plan too new to be measured ,5,2,3,3,,,,,,,,,,,,,,,,,,,,,,,,,,,,,,,,,,,,,,
H1224 ,Local CCP ,LOCAL INITIATIVE HEALTH AUTHORITY FOR LA COUNTY ,L.A. Care Health Plan ,Local Initiative Health Authority for LA County ,Plan too new to be measured ,Plan too new to be measured ,Plan too new to be measured ,Plan too new to be measured ,Plan too new to be measured ,3,Plan too new to be measured ,Plan too new to be measured ,Plan too new to be measured,,,,,,,,,,,,,,,,,,,,,,,,,,,,,,,,,,,,,,
H1225 ,Local CCP ,"HOPKINS HEALTH ADVANTAGE, INC. ",Johns Hopkins Advantage MD ,Johns Hopkins Healthcare LLC ,4,3,2,3,4,5,4,3,3,,,,,,,,,,,,,,,,,,,,,,,,,,,,,,,,,,,,,,
H1230 ,Local CCP ,"KAISER FOUNDATION HP, INC. ",Kaiser Permanente ,"Kaiser Foundation Health Plan, Inc. ",5,4,3,4,Not enough data available ,1,4,5,5,,,,,,,,,,,,,,,,,,,,,,,,,,,,,,,,,,,,,,
H1248 ,Local CCP ,LOUISIANA HEALTH SERVICE & INDEMNITY COMPANY ,Blue Cross and Blue Shield of Louisiana ,Louisiana Health Service & Indemnity Company ,4,4,5,4,Not enough data available ,4,4,3,3,,,,,,,,,,,,,,,,,,,,,,,,,,,,,,,,,,,,,,
H1277 ,Local CCP ,"ALIGN SENIOR CARE, INC. ",Align Senior Care ,"Innovative Long Term Care Management, Inc. ",Not enough data available ,Not enough data available ,Not enough data available ,Not enough data available ,Not enough data available ,5,Not enough data available ,Not enough data available ,Not enough data available,,,,,,,,,,,,,,,,,,,,,,,,,,,,,,,,,,,,,,
H1278 ,Local CCP ,CARE IMPROVEMENT PLUS SOUTH CENTRAL INSURANCE CO. ,UnitedHealthcare ,"UnitedHealth Group, Inc. ",4,3,3,4,5,5,4,2,4,,,,,,,,,,,,,,,,,,,,,,,,,,,,,,,,,,,,,,
H1280 ,Local CCP ,"ETERNALHEALTH,INC. ",eternalHealth ,"Eternal Health of Delaware, Inc. ",Plan too new to be measured ,Plan too new to be measured ,Plan too new to be measured ,Plan too new to be measured ,Plan too new to be measured ,2,Plan too new to be measured ,Plan too new to be measured ,Plan too new to be measured,,,,,,,,,,,,,,,,,,,,,,,,,,,,,,,,,,,,,,
H1290 ,Local CCP ,"DEVOTED HEALTH PLAN OF FLORIDA, INC. ",Devoted Health ,"Devoted Health, Inc. ",4,5,4,4,5,5,3,5,4,,,,,,,,,,,,,,,,,,,,,,,,,,,,,,,,,,,,,,
H1302 ,Local CCP ,"BLUE CROSS OF IDAHO CARE PLUS, INC. ",Blue Cross of Idaho ,"Blue Cross of Idaho Health Service, Inc. ",2,Not enough data available ,4,5,Not enough data available ,Not enough data available ,Not enough data available ,Not enough data available ,Not enough data available,,,,,,,,,,,,,,,,,,,,,,,,,,,,,,,,,,,,,,
H1304 ,Local CCP ,"REGENCE BLUESHIELD OF IDAHO, INC. ",Regence BlueShield Of Idaho ,"Cambia Health Solutions, Inc. ",4,3,4,4,4,4,5,3,3,,,,,,,,,,,,,,,,,,,,,,,,,,,,,,,,,,,,,,
H1339 ,Local CCP ,"JOHNS HOPKINS HEALTH PLAN OF VIRGINIA, INC. ",Johns Hopkins Advantage MD ,Johns Hopkins Healthcare LLC ,Plan too new to be measured ,Plan too new to be measured ,Plan too new to be measured ,Plan too new to be measured ,Plan too new to be measured ,Plan too new to be measured ,Plan too new to be measured ,Plan too new to be measured ,Plan too new to be measured,,,,,,,,,,,,,,,,,,,,,,,,,,,,,,,,,,,,,,
H1347 ,Local CCP ,PATRIUS HEALTH INC ,Patrius Health ,BlueCross BlueShield of Alabama ,Plan too new to be measured ,Plan too new to be measured ,Plan too new to be measured ,Plan too new to be measured ,Plan too new to be measured ,5,Plan too new to be measured ,Plan too new to be measured ,Plan too new to be measured,,,,,,,,,,,,,,,,,,,,,,,,,,,,,,,,,,,,,,
H1350 ,Local CCP ,"BLUE CROSS OF IDAHO CARE PLUS, INC. ",Blue Cross of Idaho ,"Blue Cross of Idaho Health Service, Inc. ",3,3,4,5,4,5,5,4,3,,,,,,,,,,,,,,,,,,,,,,,,,,,,,,,,,,,,,,
H1352 ,Local CCP ,"BLUE-ADVANTAGE PLUS OF KANSAS CITY, INC. ",Blue Medicare Advantage ,Blue Cross and Blue Shield of Kansas City ,4,3,5,4,3,4,4,5,4,,,,,,,,,,,,,,,,,,,,,,,,,,,,,,,,,,,,,,
H1353 ,Local CCP ,"WELLCARE OF WASHINGTON, INC. ",Wellcare ,Centene Corporation ,2,2,Not enough data available ,2,4,5,2,Not enough data available ,3,,,,,,,,,,,,,,,,,,,,,,,,,,,,,,,,,,,,,,
H1360 ,Local CCP ,"UnitedHealthcare Benefits of Texas, Inc. ",UnitedHealthcare ,"UnitedHealth Group, Inc. ",3,3,3,3,4,5,3,4,4,,,,,,,,,,,,,,,,,,,,,,,,,,,,,,,,,,,,,,
H1365 ,Local CCP ,"MARTIN'S POINT GENERATIONS ADVANTAGE, INC. ",Martin's Point Generations Advantage ,"Martin's Point Health Care, Inc. ",4,4,4,5,Not enough data available ,5,4,5,4,,,,,,,,,,,,,,,,,,,,,,,,,,,,,,,,,,,,,,
H1372 ,Local CCP ,"MARQUIS ADVANTAGE, INC. ",AgeRight Advantage ,"Marquis Companies I, Inc. ",Not enough data available ,Not enough data available ,Not enough data available ,Not enough data available ,Not enough data available ,4,Not enough data available ,Not enough data available ,5,,,,,,,,,,,,,,,,,,,,,,,,,,,,,,,,,,,,,,
H1395 ,Local CCP ,"NEBRASKA TOTAL CARE, INC. ",Wellcare ,Centene Corporation ,Plan too new to be measured ,2,2,2,Plan too new to be measured ,5,2,3,3,,,,,,,,,,,,,,,,,,,,,,,,,,,,,,,,,,,,,,
H1416 ,Local CCP ,"HARMONY HEALTH PLAN,  INC. ",Wellcare ,Centene Corporation ,3,2,4,3,4,5,3,3,3,,,,,,,,,,,,,,,,,,,,,,,,,,,,,,,,,,,,,,
H1423 ,Local CCP ,"AMERIGROUP OHIO, INC. ",Amerigroup ,"Elevance Health, Inc. ",4,3,2,3,5,5,3,1,4,,,,,,,,,,,,,,,,,,,,,,,,,,,,,,,,,,,,,,
H1426 ,Local CCP ,"CCA HEALTH PLANS OF CALIFORNIA, INC. ",CCA Health California ,"Commonwealth Care Alliance, Inc. ",Not enough data available ,Not enough data available ,Not enough data available ,Not enough data available ,Not enough data available ,3,Not enough data available ,Not enough data available ,3,,,,,,,,,,,,,,,,,,,,,,,,,,,,,,,,,,,,,,
H1463 ,Local CCP ,"HEALTH ALLIANCE CONNECT, INC. ",Health Alliance Medicare ,The Carle Foundation ,4,3,5,5,3,4,5,4,4,,,,,,,,,,,,,,,,,,,,,,,,,,,,,,,,,,,,,,
H1468 ,Local CCP ,"HUMANA BENEFIT PLAN OF ILLINOIS, INC. ",Humana ,Humana Inc. ,4,4,4,4,5,5,5,5,3,,,,,,,,,,,,,,,,,,,,,,,,,,,,,,,,,,,,,,
H1526 ,Local CCP ,GOLD KIDNEY OF FLORIDA INC ,Gold Kidney Health Plan ,Gold Kidney Health Plan ,Plan too new to be measured ,Plan too new to be measured ,Plan too new to be measured ,Plan too new to be measured ,Plan too new to be measured ,Plan too new to be measured ,Plan too new to be measured ,Plan too new to be measured ,Plan too new to be measured,,,,,,,,,,,,,,,,,,,,,,,,,,,,,,,,,,,,,,
H1537 ,Local CCP ,CARE IMPROVEMENT PLUS SOUTH CENTRAL INSURANCE CO. ,UnitedHealthcare ,"UnitedHealth Group, Inc. ",5,4,4,4,4,Not enough data available ,4,5,4,,,,,,,,,,,,,,,,,,,,,,,,,,,,,,,,,,,,,,
H1587 ,Local CCP ,"ARKANSAS SUPERIOR SELECT, INC. ",Tribute Health Plans ,"Select Founders, LLC ",Not enough data available ,3,Not enough data available ,5,Not enough data available ,4,5,Not enough data available ,5,,,,,,,,,,,,,,,,,,,,,,,,,,,,,,,,,,,,,,
H1607 ,Local CCP ,"ANTHEM INSURANCE COMPANIES, INC. ",Anthem Blue Cross and Blue Shield ,"Elevance Health, Inc. ",3,3,4,4,4,5,3,2,3,,,,,,,,,,,,,,,,,,,,,,,,,,,,,,,,,,,,,,
H1608 ,Local CCP ,COVENTRY HEALTH AND LIFE INSURANCE COMPANY ,Aetna Medicare ,CVS Health Corporation ,3,3,5,4,4,5,4,4,4,,,,,,,,,,,,,,,,,,,,,,,,,,,,,,,,,,,,,,
H1609 ,Local CCP ,AETNA HEALTH INC. (FL) ,Aetna Medicare ,CVS Health Corporation ,4,4,3,3,4,5,4,4,4,,,,,,,,,,,,,,,,,,,,,,,,,,,,,,,,,,,,,,
H1610 ,Local CCP ,"COVENTRY HEALTH CARE OF VIRGINIA, INC. ",Aetna Better Health of Virginia ,CVS Health Corporation ,2,3,4,4,4,5,4,5,3,,,,,,,,,,,,,,,,,,,,,,,,,,,,,,,,,,,,,,
H1619 ,Local CCP ,PARTNERS INSURANCE COMPANY INC ,Jefferson Health Plans Medicare ,Thomas Jefferson University ,Plan too new to be measured ,Plan too new to be measured ,Plan too new to be measured ,Plan too new to be measured ,Plan too new to be measured ,Plan too new to be measured ,Plan too new to be measured ,Plan too new to be measured ,Plan too new to be measured,,,,,,,,,,,,,,,,,,,,,,,,,,,,,,,,,,,,,,
