H5644 ,Local CCP ,NETWORK HEALTH INSURANCE CORPORATION ,Network Health Medicare Advantage Plans ,"Network Health, Inc. ",Plan too small to be measured ,Plan too small to be measured ,Plan too small to be measured ,Plan too small to be measured ,Plan too small to be measured ,Plan too small to be measured ,Plan not required to report measure ,Plan not required to report measure ,Plan not required to report measure ,Plan too small to be measured ,Plan too small to be measured ,Plan too small to be measured ,Plan too small to be measured ,Plan too small to be measured ,Plan too small to be measured ,Plan too small to be measured ,Plan too small to be measured ,Plan too small to be measured ,Plan too small to be measured ,Plan too small to be measured ,Plan too small to be measured ,Plan too small to be measured ,Plan too small to be measured ,Plan too small to be measured ,Plan too small to be measured ,Plan too small to be measured ,Plan too small to be measured ,No data available ,Not enough data available ,Not enough data available ,Not enough data available ,Not enough data available ,Not enough data available ,Not enough data available ,No data available ,Not enough data available ,Not enough data available ,Plan too small to be measured ,Plan too small to be measured ,Not enough data available ,Not enough data available ,Not enough data available ,Not enough data available ,Not required to report ,Not enough data available
H5649 ,Local CCP ,"CENTRAL HEALTH PLAN OF CALIFORNIA, INC. ",Central Health Medicare Plan ,"Molina Healthcare, Inc. ",71%,69%,77%,70%,82%,56%,55%,96%,94%,68%,80%,85%,67%,77%,59%,38%,76%,11%,85%,48%,55%,74,Not enough data available ,Not enough data available ,83,83,Not enough data available ,0.14,18%,Medicare shows only a Star Rating for this topic ,99%,96%,100%,100%,0.14,18%,Medicare shows only a Star Rating for this topic ,87,Not enough data available ,99,86%,87%,85%,74%,90%
H5652 ,Local CCP ,"SIERRA HEALTH AND LIFE INSURANCE COMPANY, INC. ",UnitedHealthcare ,"UnitedHealth Group, Inc. ",89%,72%,91%,70%,84%,62%,87%,100%,100%,Not enough data available ,91%,94%,75%,86%,69%,47%,79%,7%,Not enough data available ,53%,74%,83,87,93,89,89,87,0.06,2%,Medicare shows only a Star Rating for this topic ,100%,100%,100%,100%,0.06,2%,Medicare shows only a Star Rating for this topic ,89,92,100,87%,91%,92%,98%,81%
H5692 ,Local CCP ,SANTA CRUZ MONTEREY MERCED SAN BENITO MARIPOSA MAN ,Central California Alliance for Health ,SANTA CRUZ MONTEREY MERCED SAN BENITO MARIPOSA MAN ,Plan too new to be measured ,Plan too new to be measured ,Plan too new to be measured ,Plan too new to be measured ,Plan too new to be measured ,Plan too new to be measured ,Plan too new to be measured ,Plan too new to be measured ,Plan too new to be measured ,Plan too new to be measured ,Plan too new to be measured ,Plan too new to be measured ,Plan too new to be measured ,Plan too new to be measured ,Plan too new to be measured ,Plan too new to be measured ,Plan too new to be measured ,Plan too new to be measured ,Plan too new to be measured ,Plan too new to be measured ,Plan too new to be measured ,Plan too new to be measured ,Plan too new to be measured ,Plan too new to be measured ,Plan too new to be measured ,Plan too new to be measured ,Plan too new to be measured ,Plan too new to be measured ,Plan too new to be measured ,Plan too new to be measured ,Not enough data available ,Not enough data available ,Plan too new to be measured ,Plan too new to be measured ,Plan too new to be measured ,Plan too new to be measured ,Plan too new to be measured ,Plan too new to be measured ,Plan too new to be measured ,Plan too new to be measured ,Plan too new to be measured ,Plan too new to be measured ,Plan too new to be measured ,Plan too new to be measured ,Plan too new to be measured
H5703 ,Local CCP ,SOUTH COUNTRY HEALTH ALLIANCE ,South Country Health Alliance ,South Country Health Alliance ,Plan too small to be measured ,Plan too small to be measured ,Plan too small to be measured ,Not enough data available ,Not enough data available ,Plan too small to be measured ,52%,Not enough data available ,Not enough data available ,Plan too small to be measured ,Plan too small to be measured ,Plan too small to be measured ,Plan too small to be measured ,Plan too small to be measured ,Plan too small to be measured ,Plan too small to be measured ,Plan too small to be measured ,Plan too small to be measured ,Plan too small to be measured ,Plan too small to be measured ,Plan too small to be measured ,Plan too small to be measured ,Plan too small to be measured ,Plan too small to be measured ,Plan too small to be measured ,Plan too small to be measured ,Plan too small to be measured ,Not enough data available ,Not enough data available ,Not enough data available ,Not enough data available ,Not enough data available ,97%,97%,Not enough data available ,Not enough data available ,Medicare shows only a Star Rating for this topic ,Plan too small to be measured ,Plan too small to be measured ,100,93%,88%,90%,95%,91%
H5718 ,Local CCP ,DEVOTED HEALTH INSURANCE COMPANY OF KENTUCKY INC ,Devoted Health ,"Devoted Health, Inc. ",Plan too new to be measured ,Plan too new to be measured ,Plan too new to be measured ,Plan too new to be measured ,Plan too new to be measured ,Plan too new to be measured ,Plan too new to be measured ,Plan too new to be measured ,Plan too new to be measured ,Plan too new to be measured ,Plan too new to be measured ,Plan too new to be measured ,Plan too new to be measured ,Plan too new to be measured ,Plan too new to be measured ,Plan too new to be measured ,Plan too new to be measured ,Plan too new to be measured ,Plan too new to be measured ,Plan too new to be measured ,Plan too new to be measured ,Plan too new to be measured ,Plan too new to be measured ,Plan too new to be measured ,Plan too new to be measured ,Plan too new to be measured ,Plan too new to be measured ,Plan too new to be measured ,Not enough data available ,Plan too new to be measured ,Not enough data available ,Not enough data available ,98%,100%,Plan too new to be measured ,Not enough data available ,Plan too new to be measured ,Plan too new to be measured ,Plan too new to be measured ,Plan too new to be measured ,Plan too new to be measured ,Plan too new to be measured ,Plan too new to be measured ,Plan too new to be measured ,Plan too new to be measured
H5734 ,Local CCP ,SAN JOAQUIN COUNTY HEALTH COMMISSION ,Health Plan of San Joaquin / Mountain Valley Healt ,SAN JOAQUIN COUNTY HEALTH COMMISSION ,Plan too new to be measured ,Plan too new to be measured ,Plan too new to be measured ,Plan too new to be measured ,Plan too new to be measured ,Plan too new to be measured ,Plan too new to be measured ,Plan too new to be measured ,Plan too new to be measured ,Plan too new to be measured ,Plan too new to be measured ,Plan too new to be measured ,Plan too new to be measured ,Plan too new to be measured ,Plan too new to be measured ,Plan too new to be measured ,Plan too new to be measured ,Plan too new to be measured ,Plan too new to be measured ,Plan too new to be measured ,Plan too new to be measured ,Plan too new to be measured ,Plan too new to be measured ,Plan too new to be measured ,Plan too new to be measured ,Plan too new to be measured ,Plan too new to be measured ,Plan too new to be measured ,Plan too new to be measured ,Plan too new to be measured ,Not enough data available ,Not enough data available ,Plan too new to be measured ,Plan too new to be measured ,Plan too new to be measured ,Plan too new to be measured ,Plan too new to be measured ,Plan too new to be measured ,Plan too new to be measured ,Plan too new to be measured ,Plan too new to be measured ,Plan too new to be measured ,Plan too new to be measured ,Plan too new to be measured ,Plan too new to be measured
H5774 ,Local CCP ,"TRIPLE S ADVANTAGE, INC. ",Triple S Advantage ,Guidewell Mutual Holding Corporation ,88%,87%,52%,70%,77%,57%,92%,100%,100%,90%,94%,94%,75%,93%,64%,55%,89%,10%,90%,70%,60%,81,83,92,93,93,87,0.15,10%,Medicare shows only a Star Rating for this topic ,100%,100%,97%,98%,0.15,10%,Medicare shows only a Star Rating for this topic ,93,93,99,90%,91%,86%,95%,93%
H5779 ,Local CCP ,"MERIDIAN HEALTH PLAN OF ILLINOIS, INC. ",Wellcare ,Centene Corporation ,67%,63%,68%,Not enough data available ,Not enough data available ,46%,Plan not required to report measure ,Plan not required to report measure ,Plan not required to report measure ,Not enough data available ,75%,82%,63%,76%,64%,Not enough data available ,66%,11%,84%,56%,50%,76,83,87,85,84,86,0.43,38%,Medicare shows only a Star Rating for this topic ,100%,100%,100%,100%,0.43,38%,Medicare shows only a Star Rating for this topic ,86,Not enough data available ,100,86%,89%,88%,91%,90%
H5793 ,Local CCP ,AETNA HEALTH INC. (CT) ,Aetna Medicare ,CVS Health Corporation ,74%,70%,70%,75%,88%,53%,60%,100%,93%,40%,79%,87%,55%,81%,65%,40%,89%,10%,88%,56%,63%,80,79,91,85,88,86,0.17,22%,Medicare shows only a Star Rating for this topic ,98%,99%,98%,100%,0.17,22%,Medicare shows only a Star Rating for this topic ,87,88,99,89%,91%,90%,89%,89%
H5810 ,Local CCP ,MOLINA HEALTHCARE OF CALIFORNIA ,Molina Healthcare of California ,"Molina Healthcare, Inc. ",65%,63%,64%,Not enough data available ,Not enough data available ,Not enough data available ,Plan not required to report measure ,Plan not required to report measure ,Plan not required to report measure ,Not enough data available ,68%,83%,59%,76%,Not enough data available ,Not enough data available ,46%,No data available ,Not enough data available ,38%,44%,74,Not enough data available ,86,Not enough data available ,83,Not enough data available ,3.15,24%,Medicare shows only a Star Rating for this topic ,100%,100%,100%,100%,3.15,24%,Medicare shows only a Star Rating for this topic ,84,Not enough data available ,99,85%,91%,86%,96%,89%
H5823 ,Local CCP ,"MOLINA HEALTHCARE OF WASHINGTON, INC. ","Molina Healthcare of Washington, Inc. ","Molina Healthcare, Inc. ",58%,66%,61%,Not enough data available ,Not enough data available ,41%,51%,91%,90%,25%,62%,82%,54%,73%,54%,Not enough data available ,70%,11%,82%,54%,50%,75,Not enough data available ,88,82,81,Not enough data available ,0.33,12%,Medicare shows only a Star Rating for this topic ,99%,97%,100%,100%,0.33,12%,Medicare shows only a Star Rating for this topic ,86,Not enough data available ,99,89%,89%,90%,85%,84%
H5826 ,Local CCP ,COMMUNITY HEALTH PLAN OF WASHINGTON ,Community Health Plan of WA Medicare Advantage ,Community Health Plan of Washington ,67%,63%,68%,Not enough data available ,Not enough data available ,54%,46%,91%,89%,31%,72%,81%,59%,74%,54%,51%,66%,9%,88%,57%,56%,76,79,88,84,84,85,0.08,12%,Medicare shows only a Star Rating for this topic ,87%,93%,100%,98%,0.08,12%,Medicare shows only a Star Rating for this topic ,87,88,99,89%,90%,90%,87%,88%
H5828 ,Local CCP ,"WELLPOINT TENNESSEE, INC. ",Wellpoint ,"Elevance Health, Inc. ",60%,57%,59%,Not enough data available ,Not enough data available ,37%,57%,93%,92%,25%,69%,81%,53%,70%,62%,37%,68%,11%,84%,57%,53%,82,86,89,86,84,86,0.35,31%,Medicare shows only a Star Rating for this topic ,100%,100%,100%,100%,0.35,31%,Medicare shows only a Star Rating for this topic ,88,90,99,82%,85%,84%,95%,86%
H5843 ,Local CCP ,"BANNER HEALTH PLAN, INC. ",Banner Medicare Advantage ,Banner Health ,77%,72%,68%,66%,84%,57%,Plan not required to report measure ,Plan not required to report measure ,Plan not required to report measure ,53%,78%,89%,73%,82%,56%,45%,88%,11%,84%,80%,83%,78,81,91,86,85,84,0.17,34%,Medicare shows only a Star Rating for this topic ,99%,92%,98%,98%,0.17,34%,Medicare shows only a Star Rating for this topic ,87,90,98,89%,92%,91%,94%,88%
H5852 ,Local CCP ,AIDS HEALTHCARE FOUNDATION ,AHF ,AIDS Healthcare Foundation ,Not enough data available ,74%,88%,Not enough data available ,Not enough data available ,Not enough data available ,70%,97%,96%,Not enough data available ,66%,88%,74%,79%,Not enough data available ,Not enough data available ,85%,No data available ,No data available ,74%,49%,84,Not enough data available ,90,89,90,86,Not enough data available ,Not enough data available ,Medicare shows only a Star Rating for this topic ,Not enough data available ,Not enough data available ,89%,90%,Not enough data available ,Not enough data available ,Medicare shows only a Star Rating for this topic ,93,Not enough data available ,98,91%,91%,90%,93%,90%
H5854 ,Local CCP ,"ANTHEM HEALTH PLANS, INC. ",Anthem Blue Cross and Blue Shield ,"Elevance Health, Inc. ",72%,73%,67%,73%,88%,51%,66%,95%,95%,27%,72%,82%,60%,77%,66%,49%,88%,12%,88%,71%,60%,82,85,90,87,88,87,0.13,12%,Medicare shows only a Star Rating for this topic ,93%,100%,100%,100%,0.13,12%,Medicare shows only a Star Rating for this topic ,88,89,99,89%,89%,89%,91%,87%
H5859 ,Local CCP ,"HEALTH PLAN OF CAREOREGON, INC. ",CareOregon Advantage ,"CareOregon, Inc. ",61%,63%,59%,61%,78%,48%,63%,95%,96%,45%,73%,82%,48%,80%,59%,40%,99%,11%,91%,89%,70%,74,76,Not enough data available ,83,85,Not enough data available ,0.07,9%,Medicare shows only a Star Rating for this topic ,100%,94%,92%,98%,0.07,9%,Medicare shows only a Star Rating for this topic ,87,Not enough data available ,99,89%,89%,90%,90%,88%
H5883 ,Local CCP ,BLUE CARE NETWORK OF MICHIGAN ,Blue Care Network ,Blue Cross Blue Shield of Michigan Mutual Ins. Co. ,82%,81%,71%,70%,86%,49%,Plan not required to report measure ,Plan not required to report measure ,Plan not required to report measure ,57%,82%,92%,71%,82%,52%,46%,81%,9%,87%,65%,66%,84,85,90,88,89,88,0.06,4%,Medicare shows only a Star Rating for this topic ,100%,100%,100%,98%,0.06,4%,Medicare shows only a Star Rating for this topic ,86,89,99,86%,91%,90%,94%,89%
H5900 ,Local CCP ,"WELLMARK ADVANTAGE HEALTH PLAN, INC. ",Wellmark Advantage Health Plan ,Blue Cross Blue Shield of Michigan Mutual Ins. Co. ,78%,78%,68%,Plan too new to be measured ,Plan too new to be measured ,43%,Plan not required to report measure ,Plan not required to report measure ,Plan not required to report measure ,50%,83%,86%,55%,80%,51%,50%,59%,10%,88%,47%,56%,85,86,88,88,87,89,0.09,4%,Medicare shows only a Star Rating for this topic ,90%,94%,100%,100%,0.09,4%,Medicare shows only a Star Rating for this topic ,86,91,98,89%,91%,91%,88%,82%
H5926 ,Local CCP ,"MOLINA HEALTHCARE OF MICHIGAN, INC. ",Molina Healthcare of Michigan ,"Molina Healthcare, Inc. ",70%,73%,60%,Not enough data available ,Not enough data available ,49%,64%,90%,92%,10%,81%,78%,57%,72%,Not enough data available ,Not enough data available ,54%,11%,85%,45%,57%,83,86,88,85,85,83,0.23,17%,Medicare shows only a Star Rating for this topic ,98%,98%,100%,100%,0.23,17%,Medicare shows only a Star Rating for this topic ,86,88,99,87%,89%,88%,93%,87%
H5928 ,Local CCP ,California Physicians' Service ,Blue Shield of California ,California Physicians' Service ,75%,74%,76%,Not enough data available ,Not enough data available ,62%,Plan not required to report measure ,Plan not required to report measure ,Plan not required to report measure ,47%,86%,86%,75%,74%,62%,Not enough data available ,79%,11%,88%,63%,60%,78,83,92,85,86,Not enough data available ,0.15,14%,Medicare shows only a Star Rating for this topic ,76%,98%,98%,100%,0.15,14%,Medicare shows only a Star Rating for this topic ,88,Not enough data available ,99,88%,90%,87%,95%,91%
H5932 ,Local CCP ,"GATEWAY HEALTH PLAN, INC. ",Highmark Wholecare Medicare Assured ,Highmark Health ,67%,66%,66%,Not enough data available ,Not enough data available ,44%,41%,91%,92%,41%,77%,85%,57%,81%,64%,Not enough data available ,80%,12%,87%,68%,56%,82,85,91,88,90,89,0.09,13%,Medicare shows only a Star Rating for this topic ,99%,99%,91%,95%,0.09,13%,Medicare shows only a Star Rating for this topic ,90,91,98,89%,89%,90%,83%,87%
H5937 ,Local CCP ,UCARE MINNESOTA ,UCare ,UCare Minnesota ,72%,67%,67%,Not enough data available ,Not enough data available ,No data available ,49%,Not enough data available ,Not enough data available ,Not enough data available ,81%,85%,53%,77%,No data available ,No data available ,65%,14%,88%,59%,65%,77,80,88,86,87,86,0.12,5%,Medicare shows only a Star Rating for this topic ,100%,98%,95%,97%,0.12,5%,Medicare shows only a Star Rating for this topic ,87,89,100,86%,86%,87%,80%,86%
H5938 ,Local CCP ,CAPITAL HEALTH PLAN ,Capital Health Plan ,Guidewell Mutual Holding Corporation ,86%,83%,79%,68%,86%,55%,Plan not required to report measure ,Plan not required to report measure ,Plan not required to report measure ,81%,86%,90%,78%,84%,54%,54%,77%,9%,86%,65%,54%,84,87,93,90,93,86,0.03,1%,Medicare shows only a Star Rating for this topic ,100%,100%,98%,98%,0.03,1%,Medicare shows only a Star Rating for this topic ,90,90,99,86%,90%,89%,89%,86%
H5943 ,Local CCP ,SCAN HEALTH PLAN ,VillageHealth ,SCAN Group ,58%,56%,82%,Not enough data available ,Not enough data available ,Not enough data available ,52%,82%,90%,Not enough data available ,73%,51%,Not enough data available ,Not enough data available ,Not enough data available ,Not enough data available ,19%,No data available ,Not enough data available ,45%,44%,79,Not enough data available ,89,Not enough data available ,87,Not enough data available ,Not enough data available ,Not enough data available ,Not enough data available ,Not enough data available ,Not enough data available ,97%,100%,Not enough data available ,Not enough data available ,Not enough data available ,88,Not enough data available ,99,Not enough data available ,Not enough data available ,Not enough data available ,95%,Not enough data available
H5945 ,Local CCP ,PROMINENCE HEALTHFIRST ,Prominence Health Plan ,"Universal Health Services, Inc. ",79%,83%,65%,67%,86%,51%,CMS identified issues with this plan's data ,98%,98%,55%,86%,87%,67%,87%,52%,49%,90%,9%,86%,82%,80%,81,82,91,87,89,87,0.17,3%,Medicare shows only a Star Rating for this topic ,100%,100%,95%,97%,0.17,3%,Medicare shows only a Star Rating for this topic ,89,90,98,88%,92%,91%,92%,83%
H5959 ,Local CCP ,"BCBSM, Inc. ",Blue Cross and Blue Shield of Minnesota ,"Aware Integrated, Inc. ",85%,83%,74%,71%,88%,46%,Plan not required to report measure ,Plan not required to report measure ,Plan not required to report measure ,30%,87%,94%,63%,82%,54%,51%,75%,9%,88%,69%,57%,81,81,90,87,87,87,0.05,4%,Medicare shows only a Star Rating for this topic ,100%,98%,100%,95%,0.05,4%,Medicare shows only a Star Rating for this topic ,88,91,99,90%,92%,91%,77%,88%
H5965 ,Local CCP ,WELLCARE HEALTH INSURANCE COMPANY OF WASHINGTON ,Wellcare ,Centene Corporation ,58%,55%,52%,Not enough data available ,Not enough data available ,42%,76%,89%,89%,Not enough data available ,62%,77%,54%,77%,59%,40%,63%,11%,85%,54%,39%,75,Not enough data available ,87,82,80,86,1.01,37%,Medicare shows only a Star Rating for this topic ,Not enough data available ,Not enough data available ,100%,100%,1.01,37%,Medicare shows only a Star Rating for this topic ,82,Not enough data available ,99,86%,88%,87%,89%,81%
H5969 ,Local CCP ,ALOHACARE ,AlohaCare ,AlohaCare ,57%,49%,58%,Not enough data available ,Not enough data available ,55%,46%,100%,72%,Not enough data available ,65%,71%,58%,60%,59%,Not enough data available ,69%,8%,81%,52%,49%,75,Not enough data available ,87,85,87,Not enough data available ,0.11,11%,Medicare shows only a Star Rating for this topic ,Not enough data available ,Not enough data available ,97%,92%,0.11,11%,Medicare shows only a Star Rating for this topic ,87,Not enough data available ,98,89%,91%,93%,95%,94%
H5970 ,Local CCP ,HUMANA INSURANCE COMPANY OF NEW YORK ,Humana ,Humana Inc. ,72%,66%,63%,72%,82%,49%,82%,95%,99%,35%,74%,83%,52%,80%,58%,42%,78%,12%,86%,65%,56%,79,Not enough data available ,Not enough data available ,82,81,Not enough data available ,0.21,16%,Medicare shows only a Star Rating for this topic ,99%,97%,100%,100%,0.21,16%,Medicare shows only a Star Rating for this topic ,83,89,85,86%,89%,88%,92%,86%
H5989 ,Local CCP ,"HEALTHFIRST HEALTH PLAN, INC. ",Healthfirst Medicare Plan ,"Healthfirst, Inc. ",78%,69%,65%,Not enough data available ,Not enough data available ,53%,Plan not required to report measure ,Plan not required to report measure ,Plan not required to report measure ,33%,83%,86%,59%,76%,54%,Not enough data available ,85%,10%,86%,66%,63%,77,Not enough data available ,88,85,87,86,0.14,21%,Medicare shows only a Star Rating for this topic ,100%,100%,100%,98%,0.14,21%,Medicare shows only a Star Rating for this topic ,86,Not enough data available ,99,86%,88%,85%,90%,89%
H5991 ,Local CCP ,HEALTH INSURANCE PLAN OF GREATER NEW YORK ,EmblemHealth ,"EmblemHealth, Inc. ",73%,70%,63%,Not enough data available ,Not enough data available ,52%,CMS identified issues with this plan's data ,89%,90%,Not enough data available ,78%,76%,56%,80%,74%,Not enough data available ,60%,11%,84%,59%,61%,79,79,89,84,85,Not enough data available ,0.33,24%,Medicare shows only a Star Rating for this topic ,Not enough data available ,Not enough data available ,97%,100%,0.33,24%,Medicare shows only a Star Rating for this topic ,84,87,98,88%,89%,89%,93%,85%
H5992 ,Local CCP ,"SENIOR WHOLE HEALTH OF NEW YORK, INC. ",Senior Whole Health of New York ,"Molina Healthcare, Inc. ",56%,63%,Plan too small to be measured ,Plan too small to be measured ,Plan too small to be measured ,Plan too small to be measured ,70%,88%,99%,Not enough data available ,75%,54%,43%,67%,Plan too small to be measured ,Plan too small to be measured ,26%,No data available ,Not enough data available ,29%,No data available ,Plan too small to be measured ,Plan too small to be measured ,Plan too small to be measured ,Plan too small to be measured ,Plan too small to be measured ,Plan too small to be measured ,Not enough data available ,Not enough data available ,Not enough data available ,Not enough data available ,Not enough data available ,100%,100%,Not enough data available ,Not enough data available ,Medicare shows only a Star Rating for this topic ,Plan too small to be measured ,Plan too small to be measured ,99,89%,86%,88%,98%,94%
H5995 ,Local CCP ,ATRIO HEALTH PLANS ,ATRIO Health Plans ,ATRIO Health Plans ,62%,58%,Plan too small to be measured ,Not enough data available ,Not enough data available ,43%,Plan not required to report measure ,Plan not required to report measure ,Plan not required to report measure ,Not enough data available ,75%,33%,53%,52%,Not enough data available ,Not enough data available ,14%,10%,71%,23%,54%,Plan too small to be measured ,Plan too small to be measured ,Plan too small to be measured ,Plan too small to be measured ,Plan too small to be measured ,Plan too small to be measured ,0.08,Not enough data available ,Medicare shows only a Star Rating for this topic ,100%,85%,92%,95%,0.08,Not enough data available ,Medicare shows only a Star Rating for this topic ,Plan too small to be measured ,Plan too small to be measured ,98,87%,87%,91%,89%,84%
H6018 ,Local CCP ,DEVOTED HEALTH INSURANCE COMPANY OF PENNSYLVANIA I ,Devoted Health ,"Devoted Health, Inc. ",Not enough data available ,73%,55%,Plan too new to be measured ,Plan too new to be measured ,40%,Plan not required to report measure ,Plan not required to report measure ,Plan not required to report measure ,Not enough data available ,72%,83%,68%,87%,Not enough data available ,Not enough data available ,93%,No data available ,Not enough data available ,66%,Not enough data available ,80,83,92,84,84,86,1.04,45%,Not enough data available ,Not enough data available ,Not enough data available ,98%,100%,1.04,45%,Not enough data available ,84,87,99,89%,91%,92%,94%,86%
H6019 ,Local CCP ,SAN MATEO HEALTH COMMISSION ,HEALTH PLAN OF SAN MATEO ,Health Plan of San Mateo ,71%,73%,80%,Plan too new to be measured ,Plan too new to be measured ,60%,46%,88%,92%,22%,77%,78%,57%,69%,78%,Not enough data available ,67%,12%,86%,53%,59%,77,77,86,84,86,84,0.03,1%,Medicare shows only a Star Rating for this topic ,94%,100%,87%,89%,0.03,1%,Medicare shows only a Star Rating for this topic ,86,85,96,86%,86%,85%,86%,89%
H6078 ,Local CCP ,"Group Retiree Health Solutions, Inc. ",Blue Medicare Advantage ,"Elevance Health, Inc. ",77%,64%,75%,65%,84%,51%,Plan not required to report measure ,Plan not required to report measure ,Plan not required to report measure ,Not enough data available ,74%,80%,63%,75%,61%,49%,81%,11%,84%,71%,66%,84,85,90,90,91,87,0.04,Not enough data available ,Medicare shows only a Star Rating for this topic ,100%,100%,Not enough data available ,Not enough data available ,0.04,Not enough data available ,Medicare shows only a Star Rating for this topic ,88,92,Not enough data available ,85%,91%,89%,Not enough data available ,85%
