H8320 ,Local CCP ,"Devoted of Illinois, Inc. ",Devoted Health ,"Devoted Health, Inc. ",Plan too new to be measured ,Plan too new to be measured ,Plan too new to be measured ,Plan too new to be measured ,Plan too new to be measured ,Plan too new to be measured ,Plan too new to be measured ,Plan too new to be measured ,Plan too new to be measured ,Plan too new to be measured ,Plan too new to be measured ,Plan too new to be measured ,Plan too new to be measured ,Plan too new to be measured ,Plan too new to be measured ,Plan too new to be measured ,Plan too new to be measured ,Plan too new to be measured ,Plan too new to be measured ,Plan too new to be measured ,Plan too new to be measured ,Plan too new to be measured ,Plan too new to be measured ,Plan too new to be measured ,Plan too new to be measured ,Plan too new to be measured ,Plan too new to be measured ,Plan too new to be measured ,Not enough data available ,Plan too new to be measured ,Not enough data available ,Not enough data available ,98%,100%,Plan too new to be measured ,Not enough data available ,Plan too new to be measured ,Plan too new to be measured ,Plan too new to be measured ,Plan too new to be measured ,Plan too new to be measured ,Plan too new to be measured ,Plan too new to be measured ,Plan too new to be measured ,Plan too new to be measured
H8330 ,Local CCP ,TUFTS ASSOCIATED HEALTH MAINTENANCE ORGANIZATION ,Tufts Health Plan ,"Point32Health, Inc. ",75%,72%,79%,Plan too new to be measured ,Plan too new to be measured ,64%,92%,95%,99%,22%,85%,89%,55%,78%,76%,55%,66%,13%,89%,58%,71%,76,77,89,84,89,84,0.12,2%,Medicare shows only a Star Rating for this topic ,99%,98%,97%,98%,0.12,2%,Medicare shows only a Star Rating for this topic ,87,86,99,91%,90%,89%,94%,90%
H8332 ,Local CCP ,AETNA BETTER HEALTH OF KANSAS INC. ,Aetna Medicare ,CVS Health Corporation ,76%,71%,Plan too small to be measured ,68%,81%,53%,Plan not required to report measure ,Plan not required to report measure ,Plan not required to report measure ,53%,82%,91%,67%,83%,56%,50%,93%,9%,88%,53%,53%,Plan too small to be measured ,Plan too small to be measured ,Plan too small to be measured ,Plan too small to be measured ,Plan too small to be measured ,Plan too small to be measured ,0.29,3%,Medicare shows only a Star Rating for this topic ,99%,100%,98%,100%,0.29,3%,Medicare shows only a Star Rating for this topic ,Plan too small to be measured ,Plan too small to be measured ,99,85%,89%,88%,97%,89%
H8379 ,Local CCP ,"PRIORITY HEALTH CHOICE, INC. ",Priority Health Medicare ,Corewell Health ,73%,70%,60%,73%,84%,51%,75%,88%,84%,33%,76%,86%,68%,81%,64%,52%,67%,10%,86%,70%,60%,82,84,90,87,88,86,0.12,28%,Medicare shows only a Star Rating for this topic ,100%,93%,100%,100%,0.12,28%,Medicare shows only a Star Rating for this topic ,89,89,99,87%,89%,87%,95%,86%
H8385 ,Local CCP ,SANFORD HEALTH PLAN ,Align powered by Sanford Health Plan ,Sanford Health ,88%,86%,72%,Plan too new to be measured ,Plan too new to be measured ,49%,Plan not required to report measure ,Plan not required to report measure ,Plan not required to report measure ,Not enough data available ,84%,91%,58%,87%,48%,44%,77%,6%,85%,72%,60%,84,88,89,89,86,88,0.16,4%,Medicare shows only a Star Rating for this topic ,59%,76%,97%,100%,0.16,4%,Medicare shows only a Star Rating for this topic ,86,92,99,87%,90%,87%,91%,85%
H8390 ,Local CCP ,CARESOURCE GEORGIA CO. ,CareSource ,CareSource ,Plan too small to be measured ,Plan too small to be measured ,Plan too small to be measured ,Plan too small to be measured ,Plan too small to be measured ,Plan too small to be measured ,No data available ,No data available ,No data available ,Plan too small to be measured ,Plan too small to be measured ,Plan too small to be measured ,Plan too small to be measured ,Plan too small to be measured ,Plan too small to be measured ,Plan too small to be measured ,Plan too small to be measured ,Plan too small to be measured ,Plan too small to be measured ,Plan too small to be measured ,Plan too small to be measured ,Plan too small to be measured ,Plan too small to be measured ,Plan too small to be measured ,Plan too small to be measured ,Plan too small to be measured ,Plan too small to be measured ,Not enough data available ,Not enough data available ,Not enough data available ,Not enough data available ,Not enough data available ,100%,100%,Not enough data available ,Not enough data available ,Not enough data available ,Plan too small to be measured ,Plan too small to be measured ,99,Not enough data available ,Not enough data available ,Not enough data available ,Not enough data available ,Not enough data available
H8432 ,Local CCP ,"ANTHEM HP, LLC. ",Anthem Blue Cross and Blue Shield HP ,"Elevance Health, Inc. ",71%,71%,73%,71%,84%,57%,51%,95%,93%,32%,76%,79%,53%,73%,69%,43%,78%,10%,87%,70%,59%,78,Not enough data available ,88,86,83,87,0.22,18%,Medicare shows only a Star Rating for this topic ,97%,98%,100%,100%,0.22,18%,Medicare shows only a Star Rating for this topic ,85,90,99,88%,89%,87%,96%,88%
H8457 ,Local CCP ,"LONGEVITY HEALTH PLAN OF NEW YORK, INC. ",Longevity Health Plan ,"Longevity Health Founders, LLC ",Not enough data available ,Not enough data available ,Plan too small to be measured ,Not enough data available ,Not enough data available ,No data available ,CMS identified issues with this plan's data ,99%,99%,Not enough data available ,Not enough data available ,Not enough data available ,Not enough data available ,Not enough data available ,No data available ,No data available ,Not enough data available ,No data available ,Not enough data available ,Not enough data available ,96%,Plan too small to be measured ,Plan too small to be measured ,Plan too small to be measured ,Plan too small to be measured ,Plan too small to be measured ,Plan too small to be measured ,0.1,18%,Not enough data available ,Not enough data available ,Not enough data available ,98%,97%,0.1,18%,Medicare shows only a Star Rating for this topic ,Plan too small to be measured ,Plan too small to be measured ,100,92%,88%,90%,93%,93%
H8481 ,Local CCP ,HAWAII MEDICAL SERVICE ASSOCIATION (HMSA) ,HMSA Akamai Advantage Dual Care ,Hawaii Medical Service Association ,Plan too new to be measured ,Plan too new to be measured ,Plan too new to be measured ,Plan too new to be measured ,Plan too new to be measured ,Plan too new to be measured ,Plan too new to be measured ,Plan too new to be measured ,Plan too new to be measured ,Plan too new to be measured ,Plan too new to be measured ,Plan too new to be measured ,Plan too new to be measured ,Plan too new to be measured ,Plan too new to be measured ,Plan too new to be measured ,Plan too new to be measured ,Plan too new to be measured ,Plan too new to be measured ,Plan too new to be measured ,Plan too new to be measured ,Plan too new to be measured ,Plan too new to be measured ,Plan too new to be measured ,Plan too new to be measured ,Plan too new to be measured ,Plan too new to be measured ,Plan too new to be measured ,Plan too new to be measured ,Plan too new to be measured ,Not enough data available ,Not enough data available ,Plan too new to be measured ,Plan too new to be measured ,Plan too new to be measured ,Plan too new to be measured ,Plan too new to be measured ,Plan too new to be measured ,Plan too new to be measured ,Plan too new to be measured ,Plan too new to be measured ,Plan too new to be measured ,Plan too new to be measured ,Plan too new to be measured ,Plan too new to be measured
H8492 ,Local CCP ,DIGNITY CARE CORPORATION ,American Health Advantage of Louisiana ,Mitchell Family Office ,Plan too small to be measured ,Plan too small to be measured ,Plan too small to be measured ,Not enough data available ,Not enough data available ,Plan too small to be measured ,100%,100%,100%,Plan too small to be measured ,Plan too small to be measured ,Plan too small to be measured ,Plan too small to be measured ,Plan too small to be measured ,Plan too small to be measured ,Plan too small to be measured ,Plan too small to be measured ,Plan too small to be measured ,Plan too small to be measured ,Plan too small to be measured ,Plan too small to be measured ,Plan too small to be measured ,Plan too small to be measured ,Plan too small to be measured ,Plan too small to be measured ,Plan too small to be measured ,Plan too small to be measured ,Not enough data available ,Not enough data available ,Not enough data available ,Not enough data available ,Not enough data available ,88%,98%,Not enough data available ,Not enough data available ,Medicare shows only a Star Rating for this topic ,Plan too small to be measured ,Plan too small to be measured ,100,84%,81%,82%,98%,91%
H8547 ,Local CCP ,ILLINOIS BLUE CROSS BLUE SHIELD INSURANCE COMPANY ,Blue Cross and Blue Shield of Illinois ,Health Care Service Corporation ,81%,81%,72%,Not enough data available ,Not enough data available ,63%,Plan not required to report measure ,Plan not required to report measure ,Plan not required to report measure ,Not enough data available ,80%,90%,81%,80%,68%,Not enough data available ,65%,No data available ,97%,60%,70%,84,85,90,89,88,90,0.54,23%,Medicare shows only a Star Rating for this topic ,Not enough data available ,Not enough data available ,95%,98%,0.54,23%,Medicare shows only a Star Rating for this topic ,88,90,99,80%,88%,85%,93%,89%
H8552 ,Local CCP ,ANTHEM BLUE CROSS LIFE AND HEALTH INS COMPANY ,Anthem Blue Cross Life and Health Insurance Compan ,"Elevance Health, Inc. ",61%,61%,57%,72%,80%,43%,72%,95%,93%,23%,65%,73%,49%,64%,56%,39%,67%,9%,84%,61%,52%,78,78,Not enough data available ,81,77,Not enough data available ,0.33,12%,Medicare shows only a Star Rating for this topic ,100%,100%,100%,100%,0.33,12%,Medicare shows only a Star Rating for this topic ,79,Not enough data available ,99,85%,87%,87%,87%,82%
H8554 ,Local CCP ,GHS INSURANCE COMPANY ,"Blue Cross and Blue Shield of OK, TX ",Health Care Service Corporation ,61%,68%,65%,Not enough data available ,Not enough data available ,54%,13%,No data available ,No data available ,Not enough data available ,61%,78%,60%,69%,Not enough data available ,Not enough data available ,66%,No data available ,No data available ,45%,No data available ,84,Not enough data available ,92,87,89,Not enough data available ,0.64,27%,Medicare shows only a Star Rating for this topic ,Not enough data available ,Not enough data available ,95%,98%,0.64,27%,Medicare shows only a Star Rating for this topic ,88,91,99,85%,88%,88%,98%,89%
H8578 ,Local CCP ,"HEALTH NEW ENGLAND, INC. ",Health New England Medicare Advantage Plans ,"Baystate Health, Inc. ",83%,76%,79%,74%,81%,52%,Plan not required to report measure ,Plan not required to report measure ,Plan not required to report measure ,26%,74%,89%,63%,86%,53%,47%,86%,11%,88%,76%,57%,77,79,91,85,86,85,0.07,4%,Medicare shows only a Star Rating for this topic ,100%,78%,83%,86%,0.07,4%,Medicare shows only a Star Rating for this topic ,84,88,99,89%,92%,90%,95%,91%
H8597 ,Local CCP ,AETNA BETTER HEALTH OF TEXAS INC. ,Aetna Medicare ,CVS Health Corporation ,72%,67%,64%,72%,84%,57%,70%,100%,95%,32%,80%,84%,60%,78%,74%,46%,89%,9%,86%,50%,55%,84,82,92,88,88,89,0.65,47%,Medicare shows only a Star Rating for this topic ,99%,99%,98%,100%,0.65,47%,Medicare shows only a Star Rating for this topic ,87,89,99,88%,87%,86%,98%,89%
H8604 ,Local CCP ,THP INSURANCE COMPANY ,The Health Plan ,"The Health Plan of West Virginia, Inc. ",76%,79%,71%,74%,78%,44%,Plan not required to report measure ,Plan not required to report measure ,Plan not required to report measure ,Not enough data available ,65%,87%,46%,74%,49%,37%,70%,No data available ,No data available ,48%,59%,85,85,95,88,90,88,0.08,6%,Medicare shows only a Star Rating for this topic ,Not enough data available ,Not enough data available ,95%,94%,0.08,6%,Medicare shows only a Star Rating for this topic ,89,92,99,84%,90%,90%,92%,86%
H8634 ,Local CCP ,HEALTH CARE SERVICE CORPORATION ,"Blue Cross and Blue Shield of IL, NM, OK, TX ",Health Care Service Corporation ,76%,74%,67%,68%,84%,54%,44%,100%,86%,28%,69%,82%,60%,75%,53%,43%,63%,10%,84%,54%,65%,82,83,90,86,86,88,0.33,10%,Not enough data available ,99%,96%,95%,98%,0.33,10%,Not enough data available ,85,86,99,85%,87%,85%,92%,85%
H8649 ,Local CCP ,AETNA HEALTH OF UTAH INC. ,Aetna Medicare ,CVS Health Corporation ,58%,64%,61%,74%,81%,45%,53%,100%,88%,48%,70%,85%,48%,74%,54%,47%,94%,6%,90%,59%,50%,86,88,92,88,87,88,0.18,21%,Medicare shows only a Star Rating for this topic ,95%,97%,98%,100%,0.18,21%,Medicare shows only a Star Rating for this topic ,86,92,99,85%,89%,89%,92%,84%
H8711 ,Local CCP ,WELLCARE HEALTH INSURANCE COMPANY OF NEW JERSEY ,Wellcare ,Centene Corporation ,Plan too small to be measured ,Plan too small to be measured ,Plan too small to be measured ,Not enough data available ,Not enough data available ,Plan too small to be measured ,Plan not required to report measure ,Plan not required to report measure ,Plan not required to report measure ,Plan too small to be measured ,Plan too small to be measured ,Plan too small to be measured ,Plan too small to be measured ,Plan too small to be measured ,Plan too small to be measured ,Plan too small to be measured ,Plan too small to be measured ,Plan too small to be measured ,Plan too small to be measured ,Plan too small to be measured ,Plan too small to be measured ,Plan too small to be measured ,Plan too small to be measured ,Plan too small to be measured ,Plan too small to be measured ,Plan too small to be measured ,Plan too small to be measured ,Not enough data available ,Not enough data available ,Not enough data available ,Not enough data available ,Not enough data available ,Not enough data available ,Not enough data available ,Not enough data available ,Not enough data available ,Not enough data available ,Plan too small to be measured ,Plan too small to be measured ,99,Not enough data available ,86%,95%,Not enough data available ,Not enough data available
H8764 ,Local CCP ,ASPIRE HEALTH PLAN ,Aspire Health ,Montage Health ,79%,84%,76%,72%,86%,60%,Plan not required to report measure ,Plan not required to report measure ,Plan not required to report measure ,58%,81%,86%,71%,73%,59%,46%,83%,10%,85%,75%,77%,78,78,92,86,87,84,0.06,2%,Medicare shows only a Star Rating for this topic ,68%,97%,98%,92%,0.06,2%,Medicare shows only a Star Rating for this topic ,86,87,98,84%,87%,84%,69%,88%
H8768 ,Local CCP ,CARE IMPROVEMENT PLUS SOUTH CENTRAL INSURANCE CO. ,UnitedHealthcare ,"UnitedHealth Group, Inc. ",76%,73%,68%,71%,87%,52%,Plan not required to report measure ,Plan not required to report measure ,Plan not required to report measure ,36%,88%,91%,60%,82%,51%,45%,63%,11%,87%,52%,58%,80,82,Not enough data available ,84,83,87,0.15,18%,Medicare shows only a Star Rating for this topic ,100%,99%,100%,100%,0.15,18%,Medicare shows only a Star Rating for this topic ,84,88,100,85%,91%,89%,91%,86%
H8783 ,Local CCP ,"UCARE HEALTH, INC. ",UCare ,UCare Minnesota ,82%,82%,76%,75%,88%,44%,Plan not required to report measure ,Plan not required to report measure ,Plan not required to report measure ,Not enough data available ,81%,91%,38%,78%,48%,42%,75%,12%,90%,71%,68%,82,84,90,88,87,89,0.04,5%,Medicare shows only a Star Rating for this topic ,Not enough data available ,Not enough data available ,95%,97%,0.04,5%,Medicare shows only a Star Rating for this topic ,89,93,100,85%,92%,91%,89%,89%
H8794 ,Local CCP ,"KAISER FOUNDATION HP, INC. ",Kaiser Permanente ,"Kaiser Foundation Health Plan, Inc. ",83%,84%,Plan too small to be measured ,Plan too new to be measured ,Plan too new to be measured ,Plan too new to be measured ,81%,96%,93%,74%,88%,86%,86%,85%,Plan too new to be measured ,Plan too new to be measured ,94%,11%,92%,83%,82%,Plan too small to be measured ,Plan too small to be measured ,Plan too small to be measured ,Plan too small to be measured ,Plan too small to be measured ,Plan too small to be measured ,0.14,6%,Not enough data available ,99%,99%,98%,98%,0.14,6%,Not enough data available ,Plan too small to be measured ,Plan too small to be measured ,100,89%,90%,89%,94%,92%
H8797 ,Local CCP ,"PERENNIAL ADVANTAGE OF OHIO, INC. ",Perennial Advantage ,"Perennial Consortium, LLC ",Not enough data available ,Not enough data available ,Plan too small to be measured ,Plan too small to be measured ,Plan too small to be measured ,No data available ,95%,97%,100%,Not enough data available ,Not enough data available ,Not enough data available ,Not enough data available ,Not enough data available ,No data available ,No data available ,Not enough data available ,No data available ,Not enough data available ,Not enough data available ,76%,Plan too small to be measured ,Plan too small to be measured ,Plan too small to be measured ,Plan too small to be measured ,Plan too small to be measured ,Plan too small to be measured ,Not enough data available ,Not enough data available ,Not enough data available ,Not enough data available ,Not enough data available ,98%,98%,Not enough data available ,Not enough data available ,Medicare shows only a Star Rating for this topic ,Plan too small to be measured ,Plan too small to be measured ,99,91%,89%,93%,97%,96%
H8832 ,Local CCP ,ALIGNMENT HEALTH ADVANTAGE PLAN INC ,Alignment Health Plan ,"Alignment Healthcare USA, LLC ",Plan too new to be measured ,Plan too new to be measured ,Plan too new to be measured ,Plan too new to be measured ,Plan too new to be measured ,Plan too new to be measured ,Plan not required to report measure ,Plan not required to report measure ,Plan not required to report measure ,Plan too new to be measured ,Plan too new to be measured ,Plan too new to be measured ,Plan too new to be measured ,Plan too new to be measured ,Plan too new to be measured ,Plan too new to be measured ,Plan too new to be measured ,Plan too new to be measured ,Plan too new to be measured ,Plan too new to be measured ,Plan too new to be measured ,Plan too new to be measured ,Plan too new to be measured ,Plan too new to be measured ,Plan too new to be measured ,Plan too new to be measured ,Plan too new to be measured ,Plan too new to be measured ,Not enough data available ,Plan too new to be measured ,Not enough data available ,Not enough data available ,100%,100%,Plan too new to be measured ,Not enough data available ,Plan too new to be measured ,Plan too new to be measured ,Plan too new to be measured ,Plan too new to be measured ,Plan too new to be measured ,Plan too new to be measured ,Plan too new to be measured ,Plan too new to be measured ,Plan too new to be measured
H8845 ,Local CCP ,"MOLINA HEALTHCARE OF ARIZONA, INC. ",Molina Healthcare of Arizona ,"Molina Healthcare, Inc. ",Plan too small to be measured ,Plan too small to be measured ,Plan too small to be measured ,Plan too small to be measured ,Plan too small to be measured ,Plan too small to be measured ,59%,75%,82%,Plan too small to be measured ,Plan too small to be measured ,Plan too small to be measured ,Plan too small to be measured ,Plan too small to be measured ,Plan too small to be measured ,Plan too small to be measured ,Plan too small to be measured ,Plan too small to be measured ,Plan too small to be measured ,Plan too small to be measured ,Plan too small to be measured ,Plan too small to be measured ,Plan too small to be measured ,Plan too small to be measured ,Plan too small to be measured ,Plan too small to be measured ,Plan too small to be measured ,Not enough data available ,Not enough data available ,Not enough data available ,Not enough data available ,Not enough data available ,100%,100%,Not enough data available ,Not enough data available ,Medicare shows only a Star Rating for this topic ,Plan too small to be measured ,Plan too small to be measured ,99,91%,86%,90%,Not enough data available ,86%
H8849 ,Local CCP ,WELLPOINT INSURANCE COMPANY ,Wellpoint ,"Elevance Health, Inc. ",71%,73%,74%,Not enough data available ,Not enough data available ,56%,CMS identified issues with this plan's data ,94%,94%,58%,75%,82%,67%,77%,73%,Not enough data available ,69%,12%,90%,53%,54%,80,Not enough data available ,Not enough data available ,84,86,Not enough data available ,0.37,20%,Medicare shows only a Star Rating for this topic ,99%,98%,100%,100%,0.37,20%,Medicare shows only a Star Rating for this topic ,87,Not enough data available ,99,87%,87%,86%,94%,93%
H8854 ,Local CCP ,"CAREFIRST ADVANTAGE DSNP, INC. ",CareFirst BlueCross BlueShield Medicare Advantage ,"CareFirst, Inc. ",73%,66%,65%,73%,91%,50%,68%,95%,95%,Not enough data available ,74%,81%,54%,69%,73%,Not enough data available ,75%,13%,86%,68%,57%,83,84,89,85,87,86,0.31,13%,Medicare shows only a Star Rating for this topic ,93%,95%,98%,97%,0.31,13%,Medicare shows only a Star Rating for this topic ,85,85,98,81%,80%,78%,88%,89%
H8879 ,Local CCP ,"Healthy Mississippi, Inc. ","Healthy Mississippi, Inc. ",Singh Holdings LLC ,Plan too new to be measured ,Plan too new to be measured ,Plan too new to be measured ,Plan too new to be measured ,Plan too new to be measured ,Plan too new to be measured ,Plan not required to report measure ,Plan not required to report measure ,Plan not required to report measure ,Plan too new to be measured ,Plan too new to be measured ,Plan too new to be measured ,Plan too new to be measured ,Plan too new to be measured ,Plan too new to be measured ,Plan too new to be measured ,Plan too new to be measured ,Plan too new to be measured ,Plan too new to be measured ,Plan too new to be measured ,Plan too new to be measured ,Plan too new to be measured ,Plan too new to be measured ,Plan too new to be measured ,Plan too new to be measured ,Plan too new to be measured ,Plan too new to be measured ,Plan too new to be measured ,Not enough data available ,Plan too new to be measured ,Not enough data available ,Not enough data available ,95%,94%,Plan too new to be measured ,Not enough data available ,Plan too new to be measured ,Plan too new to be measured ,Plan too new to be measured ,Plan too new to be measured ,Plan too new to be measured ,Plan too new to be measured ,Plan too new to be measured ,Plan too new to be measured ,Plan too new to be measured
H8889 ,Local CCP ,MEDICA HEALTH PLANS ,Medica ,Medica Holding Company ,81%,79%,73%,72%,86%,47%,No data available ,No data available ,No data available ,22%,80%,90%,53%,80%,50%,49%,82%,10%,87%,74%,61%,83,84,90,87,86,89,0.11,8%,Medicare shows only a Star Rating for this topic ,92%,95%,98%,99%,0.11,8%,Medicare shows only a Star Rating for this topic ,85,89,99,89%,92%,91%,84%,85%
H8894 ,Local CCP ,Inland Empire Health Plan ,IEHP DualChoice ,INLAND EMPIRE HEALTH PLAN ,75%,70%,60%,Plan too new to be measured ,Plan too new to be measured ,52%,55%,90%,91%,46%,78%,80%,69%,70%,72%,Not enough data available ,78%,11%,86%,46%,52%,78,79,90,85,90,82,0.16,6%,Medicare shows only a Star Rating for this topic ,96%,95%,84%,83%,0.16,6%,Medicare shows only a Star Rating for this topic ,89,87,98,84%,84%,82%,53%,89%
H8902 ,Local CCP ,"SCAN HEALTH PLAN TEXAS, INC. ",SCAN Health Plan ,SCAN Group ,Plan too small to be measured ,Plan too small to be measured ,Plan too small to be measured ,Plan too new to be measured ,Plan too new to be measured ,Plan too small to be measured ,92%,Not enough data available ,Not enough data available ,Plan too small to be measured ,Plan too small to be measured ,Plan too small to be measured ,Plan too small to be measured ,Plan too small to be measured ,Plan too small to be measured ,Plan too small to be measured ,Plan too small to be measured ,Plan too small to be measured ,Plan too small to be measured ,Plan too small to be measured ,Plan too small to be measured ,Plan too small to be measured ,Plan too small to be measured ,Plan too small to be measured ,Plan too small to be measured ,Plan too small to be measured ,Plan too small to be measured ,Not enough data available ,Not enough data available ,Not enough data available ,Not enough data available ,Not enough data available ,97%,100%,Not enough data available ,Not enough data available ,Not enough data available ,Plan too small to be measured ,Plan too small to be measured ,99,85%,89%,93%,Not required to report ,90%
H8908 ,Local CCP ,"HUMANA MEDICAL PLAN OF MICHIGAN, INC. ",Humana ,Humana Inc. ,69%,68%,61%,Not enough data available ,Not enough data available ,49%,77%,95%,98%,31%,78%,86%,59%,78%,72%,Not enough data available ,79%,12%,88%,67%,56%,81,Not enough data available ,88,86,84,Not enough data available ,0.18,30%,Medicare shows only a Star Rating for this topic ,100%,98%,100%,100%,0.18,30%,Medicare shows only a Star Rating for this topic ,86,89,85,83%,86%,85%,84%,89%
