contract_id,contract_name,organization_marketing_name,total_enrollment,csnp_enrollment,dsnp_enrollment,csnp_dsnp_enrollment,csnp_pct,dsnp_pct,csnp_dsnp_pct
H7147,DEVOTED HEALTH PLAN OF COLORADO INC,Devoted Health,6741,0,2762,2762,0,41,41
H7149,AETNA HEALTH INC. (PA),Aetna Medicare,9860,0,847,847,0,8.6,8.6
H7163,Primewell Health Services of Mississippi Inc.,Primewell Health Services,367,0,71,71,0,19.3,19.3
H7169,BUCKEYE HEALTH PLAN COMMUNITY SOLUTIONS; INC.,Wellcare,2149,0,824,824,0,38.3,38.3
H7239,PROMINENCE HEALTHFIRST OF FLORIDA INC,Prominence Health Plan,1815,0,242,242,0,13.3,13.3
H7284,HUMANA HEALTH INSURANCE COMPANY OF FLORIDA; INC.,Humana,18166,0,6378,6378,0,35.1,35.1
H7323,WELLCARE NATIONAL HEALTH INSURANCE COMPANY,Wellcare,5591,0,847,847,0,15.1,15.1
H7326,WELLCARE OF SOUTH CAROLINA; INC.,Wellcare,16814,0,1840,1840,0,10.9,10.9
H7355,DEVOTED HEALTH INSURANCE COMPANY OF MISSISSIPPI,Devoted Health,2031,0,771,771,0,38,38
H7389,CIGNA HEALTH AND LIFE INSURANCE COMPANY,Cigna Healthcare,4865,0,13,13,0,0.3,0.3
H7397,DEVOTED HEALTH INSURANCE COMPANY OF ARKANSAS INC,Devoted Health,1074,0,217,217,0,20.2,20.2
H7464,UNITEDHEALTHCARE OF THE MID-ATLANTIC; INC.,UnitedHealthcare,24588,0,24588,24588,0,100,100
H7518,WELLCARE OF MISSOURI HEALTH INSURANCE COMPANY; INC,Wellcare,2487,0,472,472,0,19,19
H7524,EXCELLUS HEALTH PLAN COMMUNITY CARE LLC,Excellus Health Plan Community Care LLC,1266,0,1266,1266,0,100,100
H7598,GROUP HEALTH COOPERATIVE OF EAU CLAIRE,Group Health Cooperative of Eau Claire,215,0,215,215,0,100,100
H7605,DEVOTED HEALTH PLAN OF TENNESSEE INC,Devoted Health,2745,266,0,266,9.7,0,9.7
H7607,CLEVER CARE OF GOLDEN STATE; INC.,Clever Care Health Plan,28859,9470,0,9470,32.8,0,32.8
H7678,MOLINA HEALTHCARE OF TEXAS; INC.,Molina Healthcare of Texas; Inc.,4389,0,4389,4389,0,100,100
H7680,PROMINENCE HEALTHFIRST OF TEXAS,Prominence Health Plan,12336,1019,3220,4239,8.3,26.1,34.4
H7710,HIGHMARK BCBSD; INC.,Highmark Blue Cross Blue Shield,2290,0,2290,2290,0,100,100
H7993,DEVOTED HEALTH PLAN OF TEXAS; INC.,Devoted Health,25063,1138,936,2074,4.5,3.7,8.3
H8173,DEVOTED HEALTH PLAN OF ARIZONA; INC.,Devoted Health,7353,1128,0,1128,15.3,0,15.3
H8176,MOLINA HEALTHCARE OF SOUTH CAROLINA;INC,Molina Healthcare of South Carolina,1096,0,1096,1096,0,100,100
H8189,MANAGED HEALTH SERVICES INSURANCE CORP.,Wellcare by Allwell,8282,0,8282,8282,0,100,100
H8298,HORIZON HEALTHCARE OF NEW JERSEY; INC.,Horizon Blue Cross Blue Shield of New Jersey,22573,0,22573,22573,0,100,100
H8330,TUFTS ASSOCIATED HEALTH MAINTENANCE ORGANIZATION,Tufts Health Plan,13766,0,13766,13766,0,100,100
H8379,PRIORITY HEALTH CHOICE; INC.,Priority Health Medicare,8517,0,8517,8517,0,100,100
H8390,CARESOURCE GEORGIA CO.,CareSource,89,0,89,89,0,100,100
H8432,ANTHEM HEALTHCHOICE HMO; INC.,Anthem Blue Cross and Blue Shield,47253,0,25956,25956,0,54.9,54.9
H8552,ANTHEM BLUE CROSS LIFE AND HEALTH INS COMPANY,Anthem Blue Cross Life and Health Insurance Compan,12379,1016,0,1016,8.2,0,8.2
H8554,GHS INSURANCE COMPANY,Blue Cross and Blue Shield of OK; TX,909,0,80,80,0,8.8,8.8
H8597,AETNA BETTER HEALTH OF TEXAS INC.,Aetna Medicare,19424,0,19424,19424,0,100,100
H8634,HEALTH CARE SERVICE CORPORATION,Blue Cross and Blue Shield of IL; NM,31607,0,4148,4148,0,13.1,13.1
H8649,AETNA HEALTH OF UTAH INC.,Aetna Medicare,5272,0,217,217,0,4.1,4.1
H8794,KAISER FOUNDATION HP; INC.,Kaiser Permanente,121586,0,121586,121586,0,100,100
H8845,MOLINA HEALTHCARE OF ARIZONA; INC.,Molina Healthcare of Arizona,888,0,888,888,0,100,100
H8849,WELLPOINT INSURANCE COMPANY,Wellpoint,54991,3051,32491,35542,5.5,59.1,64.6
H8854,CAREFIRST ADVANTAGE DSNP; INC.,CareFirst BlueCross BlueShield Medicare Advantage,5207,0,5207,5207,0,100,100
H8889,MEDICA HEALTH PLANS,Medica,60664,0,300,300,0,0.5,0.5
H8894,Inland Empire Health Plan,IEHP DualChoice,37689,0,37689,37689,0,100,100
H8902,SCAN HEALTH PLAN TEXAS; INC.,SCAN Health Plan,520,208,0,208,40,0,40
H8908,HUMANA MEDICAL PLAN OF MICHIGAN; INC.,Humana,33645,265,21652,21917,0.8,64.4,65.1
H8928,FALLON COMMUNITY HEALTH PLAN,Fallon Health,9658,0,9658,9658,0,100,100
H8967,SANFORD HEALTH PLAN,Great Plains Medicare Advantage,309,0,69,69,0,22.3,22.3
H9047,PROVIDENCE HEALTH ASSURANCE,Providence Medicare Advantage Plans,79625,0,3611,3611,0,4.5,4.5
H9065,AMH HEALTH; LLC,AMH Health,18745,0,7690,7690,0,41,41
H9066,VISITING NURSE ASSOCIATION OF CENTRAL NEW YORK,Nascentia Health Plus,551,0,308,308,0,55.9,55.9
H9147,BLUE CROSS AND BLUE SHIELD OF NC SENIOR HEALTH,Blue Cross and Blue Shield of North Carolina,1985,0,1985,1985,0,100,100
H9207,HEALTH PARTNERS PLANS; INC.,Jefferson Health Plans,15246,0,7654,7654,0,50.2,50.2
H9306,ALTERWOOD ADVANTAGE; INC.,Alterwood Advantage,9639,0,2421,2421,0,25.1,25.1
H9364,WELLCARE OF MAINE; INC.,Wellcare,12655,0,8186,8186,0,64.7,64.7
H9387,SUNFLOWER STATE HEALTH PLAN; INC.,Wellcare by Allwell,1354,0,524,524,0,38.7,38.7
H9525,COMPCARE HEALTH SERVICES INSURANCE CORPORATION,Anthem Blue Cross and Blue Shield,149532,869,16351,17220,0.6,10.9,11.5
H9585,BOSTON MEDICAL CENTER HEALTH PLAN; INC.,WellSense Health Plan,1215,0,1215,1215,0,100,100
H9630,ARKANSAS HEALTH & WELLNESS HEALTH PLAN; INC.,Wellcare by Allwell,24202,0,7546,7546,0,31.2,31.2
H9686,ALIGNMENT HEALTH PLAN OF NEVADA; INC.,Alignment Health Plan,1901,287,1614,1901,15.1,84.9,100
H9706,HCSC INSURANCE SERVICES COMPANY,Blue Cross and Blue Shield of Texas,5636,0,292,292,0,5.2,5.2
H9725,CIGNA HEALTHCARE OF NORTH CAROLINA; INC.,Cigna Healthcare,27948,0,653,653,0,2.3,2.3
H9730,WELLCARE HEALTH INSURANCE COMPANY OF KENTUCKY; INC,Wellcare,36598,0,17556,17556,0,48,48
H9763,OCHSNER HEALTH PLAN; INC.,Ochsner Health Plan,5824,0,101,101,0,1.7,1.7
H9826,COMMUNITY HEALTH CHOICE TEXAS; INC.,Community Health Choice,750,0,750,750,0,100,100
H9900,WELLCARE OF OKLAHOMA; INC.,Wellcare,1936,0,708,708,0,36.6,36.6
H9917,ALIGN SENIOR CARE FLORIDA; INC.,Align Senior Care,164,0,0,0,0,0,0
H9946,SHARED HEALTH MISSISSIPPI; INC.,Shared Health Dual Freedom,878,0,878,878,0,100,100
H9952,MEDICA HEALTH PLANS,Medica,1965,0,1965,1965,0,100,100
H9955,MOLINA HEALTHCARE OF OHIO; INC.,Molina Healthcare of Ohio,1325,0,1325,1325,0,100,100
H9986,HPMP OF FLORIDA; INC.,Florida Complete Care,1186,0,152,152,0,12.8,12.8
R0759,CARE IMPROVEMENT PLUS SOUTH CENTRAL INSURANCE CO.,UnitedHealthcare,26835,0,1678,1678,0,6.3,6.3
R2604,CARE IMPROVEMENT PLUS SOUTH CENTRAL INSURANCE CO.,UnitedHealthcare,21195,11253,0,11253,53.1,0,53.1
R3444,CARE IMPROVEMENT PLUS SOUTH CENTRAL INSURANCE CO.,UnitedHealthcare,6503,2851,0,2851,43.8,0,43.8
R6801,CARE IMPROVEMENT PLUS SOUTH CENTRAL INSURANCE CO.,UnitedHealthcare,52875,20893,13483,34376,39.5,25.5,65