H7028 ,Devoted Health ,DEVOTED HEALTH INSURANCE COMPANY OF SOUTH CAROLINA ,"Devoted Health, Inc. ",Not Available ,Not Available ,Not Available ,Not Available ,Not Available
H7063 ,Blue Cross and Blue Shield of Kansas ,"BLUECROSS BLUESHIELD KANSAS SOLUTIONS, INC. ",Blue Cross Blue Shield of Kansas ,22%,31%,19%,7%,12%
H7074 ,Alignment Health Plan ,"ALIGNMENT HEALTH PLAN OF NORTH CAROLINA, INC. ","Alignment Healthcare USA, LLC ",Not Available ,Not Available ,Not Available ,Not Available ,Not Available
H7093 ,Anthem Blue Cross and Blue Shield ,COMMUNITY INSURANCE COMPANY ,"Elevance Health, Inc. ",14%,9%,21%,Not Available ,12%
H7115 ,Memorial Hermann Health Plan ,MEMORIAL HERMANN HEALTH PLAN ,Memorial Hermann Health System ,26%,24%,18%,8%,19%
H7123 ,UPMC for Life Complete Care ,"UPMC HEALTH COVERAGE, INC. ",UPMC Health System ,Not Available ,Not Available ,Not Available ,Not Available ,Not Available
H7147 ,Devoted Health ,DEVOTED HEALTH PLAN OF COLORADO INC ,"Devoted Health, Inc. ",Not Available ,Not Available ,Not Available ,Not Available ,Not Available
H7149 ,Aetna Medicare ,AETNA HEALTH INC. (PA) ,CVS Health Corporation ,16%,22%,18%,Not Available ,14%
H7151 ,Devoted Health ,"DEVOTED HEALTH PLAN OF ILLINOIS, INC. ","Devoted Health, Inc. ",Not Available ,Not Available ,Not Available ,Not Available ,Not Available
H7163 ,Primewell Health Services ,Primewell Health Services of Mississippi Inc. ,Louisiana Health Service & Indemnity Company ,Not Available ,Not Available ,Not Available ,Not Available ,Not Available
H7169 ,Wellcare ,"BUCKEYE HEALTH PLAN COMMUNITY SOLUTIONS, INC. ",Centene Corporation ,17%,30%,11%,Not Available ,23%
H7175 ,Wellcare ,"WELLCARE HEALTH INSURANCE OF NORTH CAROLINA, INC. ",Centene Corporation ,22%,24%,12%,Not Available ,17%
H7199 ,Devoted Health ,DEVOTED HEALTH  PLAN OF OREGON ,"Devoted Health, Inc. ",Not Available ,Not Available ,Not Available ,Not Available ,Not Available
H7220 ,Indiana University Health Plans ,"INDIANA UNIVERSITY HEALTH PLANS NFP, INC. ",Indiana University Health ,15%,34%,15%,8%,10%
H7239 ,Prominence Health Plan ,PROMINENCE HEALTHFIRST OF FLORIDA INC ,"Universal Health Services, Inc. ",Plan too new to be measured ,Plan too new to be measured ,Plan too new to be measured ,Plan too new to be measured ,Plan too new to be measured
H7284 ,Humana ,"HUMANA HEALTH INSURANCE COMPANY OF FLORIDA, INC. ",Humana Inc. ,11%,22%,13%,Not Available ,10%
H7301 ,Aetna Medicare ,"COVENTRY HEALTH CARE OF ILLINOIS, INC. ",CVS Health Corporation ,12%,12%,20%,Not Available ,15%
H7323 ,Wellcare ,WELLCARE NATIONAL HEALTH INSURANCE COMPANY ,Centene Corporation ,Not Available ,36%,13%,Not Available ,19%
H7326 ,Wellcare ,"WELLCARE OF SOUTH CAROLINA, INC. ",Centene Corporation ,21%,20%,16%,11%,17%
H7330 ,Zing Health ,"ZING HEALTH, INC. ","Zing Health Consolidator, Inc ",Not Available ,Not Available ,Not Available ,Not Available ,Not Available
H7355 ,Devoted Health ,DEVOTED HEALTH INSURANCE COMPANY OF MISSISSIPPI ,"Devoted Health, Inc. ",Plan too new to be measured ,Plan too new to be measured ,Plan too new to be measured ,Plan too new to be measured ,Plan too new to be measured
H7379 ,CareFirst BlueCross BlueShield Medicare Advantage ,"CAREFIRST ADVANTAGE PPO, INC. ","CareFirst, Inc. ",Not Available ,Not Available ,Not Available ,Not Available ,Not Available
H7389 ,Cigna Healthcare ,CIGNA HEALTH AND LIFE INSURANCE COMPANY ,The Cigna Group ,36%,35%,18%,Not Available ,21%
H7397 ,Devoted Health ,DEVOTED HEALTH INSURANCE COMPANY OF ARKANSAS INC ,"Devoted Health, Inc. ",Plan too new to be measured ,Plan too new to be measured ,Plan too new to be measured ,Plan too new to be measured ,Plan too new to be measured
H7464 ,UnitedHealthcare ,"UNITEDHEALTHCARE OF THE MID-ATLANTIC, INC. ","UnitedHealth Group, Inc. ",29%,44%,17%,Not Available ,17%
H7471 ,Devoted Health ,DEVOTED HEALTH INSURANCE COMPANY OF INDIANA ,"Devoted Health, Inc. ",Plan too new to be measured ,Plan too new to be measured ,Plan too new to be measured ,Plan too new to be measured ,Plan too new to be measured
H7511 ,Great Plains Medicare Advantage ,"GOOD SAMARITAN INSURANCE PLAN OF NEBRASKA, INC. ",Sanford Health ,Not Available ,Not Available ,Not Available ,Not Available ,Not Available
H7512 ,Ascension Complete ,CENTENE VENTURE COMPANY MICHIGAN ,Centene Corporation ,Not Available ,Not Available ,Not Available ,Not Available ,Not Available
H7518 ,Wellcare ,"WELLCARE OF MISSOURI HEALTH INSURANCE COMPANY, INC ",Centene Corporation ,23%,30%,18%,Not Available ,22%
H7522 ,Medicare y Mucho Mas ,"MMM HEALTHCARE, LLC ","Elevance Health, Inc. ",Not Available ,Not Available ,Not Available ,Not Available ,Not Available
H7524 ,Excellus Health Plan Community Care LLC ,EXCELLUS HEALTH PLAN COMMUNITY CARE LLC ,"Lifetime Healthcare, Inc. ",Not Available ,Not Available ,Not Available ,Not Available ,Not Available
H7557 ,Longevity Health Plan ,"LONGEVITY HEALTH PLAN OF MICHIGAN, INC. ","Longevity Health Founders, LLC ",Not Available ,Not Available ,Not Available ,Not Available ,Not Available
H7559 ,Molina Healthcare of Virginia ,"Molina Healthcare of Virginia, LLC ","Molina Healthcare, Inc. ",28%,36%,18%,Not Available ,Not Available
H7598 ,Group Health Cooperative of Eau Claire ,GROUP HEALTH COOPERATIVE OF EAU CLAIRE ,Group Health Cooperative of Eau Claire ,Not Available ,Not Available ,Not Available ,Not Available ,Not Available
H7605 ,Devoted Health ,DEVOTED HEALTH PLAN OF TENNESSEE INC ,"Devoted Health, Inc. ",Not Available ,Not Available ,Not Available ,Not Available ,Not Available
H7607 ,Clever Care Health Plan ,"CLEVER CARE OF GOLDEN STATE, INC. ","Clever Care Health Plan, Inc. ",Not Available ,19%,20%,Not Available ,Not Available
H7617 ,Humana ,EMPHESYS INSURANCE COMPANY ,Humana Inc. ,Not Available ,Not Available ,Not Available ,Not Available ,Not Available
H7646 ,University of Michigan Health Plan ,UNIVERSITY OF MICHIGAN HEALTH MEDICARE ,University of Michigan Health ,23%,27%,20%,11%,13%
H7670 ,Mass Advantage ,"CENTRAL MASS HEALTH, LLC ",Central Mass Health Holding LLC ,Not Available ,Not Available ,Not Available ,Not Available ,Not Available
H7678 ,"Molina Healthcare of Texas, Inc. ","MOLINA HEALTHCARE OF TEXAS, INC. ","Molina Healthcare, Inc. ",Not Available ,40%,14%,Not Available ,11%
H7680 ,Prominence Health Plan ,PROMINENCE HEALTHFIRST OF TEXAS ,"Universal Health Services, Inc. ",12%,45%,9%,Not Available ,13%
H7710 ,Highmark Blue Cross Blue Shield ,"HIGHMARK BCBSD, INC. ",Highmark Health ,Plan too new to be measured ,Plan too new to be measured ,Plan too new to be measured ,Plan too new to be measured ,Plan too new to be measured
H7778 ,UnitedHealthcare ,"UNITEDHEALTHCARE OF ILLINOIS, INC. ","UnitedHealth Group, Inc. ",Not Available ,Not Available ,Not Available ,Not Available ,Not Available
H7779 ,American Health Advantage of Tennessee ,"AMERICAN HEALTH PLAN, INC. ",Mitchell Family Office ,Not Available ,Not Available ,Not Available ,Not Available ,Not Available
H7787 ,Cigna Healthcare ,"HEALTHSPRING LIFE & HEALTH INSURANCE COMPANY, INC. ",The Cigna Group ,20%,35%,16%,Not Available ,15%
H7813 ,"iCircle Services of the Finger Lakes, Inc ","ICIRCLE SERVICES OF THE FINGER LAKES, INC. ","CDS Monarch, Inc. ",Not Available ,Not Available ,Not Available ,Not Available ,Not Available
H7849 ,Cigna Healthcare ,CIGNA HEALTH AND LIFE INSURANCE COMPANY ,The Cigna Group ,22%,33%,19%,13%,17%
H7917 ,BlueCross BlueShield of Tennessee ,"BLUECROSS BLUESHIELD OF TENNESSEE, INC. ",BlueCross BlueShield of Tennessee ,12%,14%,24%,8%,5%
H7925 ,Wellcare by Allwell ,"CENTENE VENTURE COMPANY INDIANA, INC. ",Centene Corporation ,16%,22%,12%,Not Available ,21%
H7980 ,WellSense Health Plan ,"BOSTON MEDICAL CENTER HEALTH PLAN, INC. ","BMC Health System, Inc. ",Plan too new to be measured ,Plan too new to be measured ,Plan too new to be measured ,Plan too new to be measured ,Plan too new to be measured
H7993 ,Devoted Health ,"DEVOTED HEALTH PLAN OF TEXAS, INC. ","Devoted Health, Inc. ",15%,32%,14%,6%,11%
H8003 ,Blue Cross Blue Shield of South Carolina ,BLUECROSS AND BLUESHIELD OF SOUTH CAROLINA ,BlueCross BlueShield of South Carolina (BCBSSC) ,12%,18%,29%,11%,7%
H8010 ,Clover Health ,CLOVER HMO OF NEW JERSEY INC. ,"Clover Health Holdings, Inc. ",Not Available ,Not Available ,Not Available ,Not Available ,Not Available
H8014 ,Clear Spring Health ,CLEAR SPRING HEALTH INSURANCE COMPANY ,Group 1001 ,Not Available ,Not Available ,Not Available ,Not Available ,Not Available
H8019 ,Medica ,MEDICA CENTRAL HEALTH PLAN ,Medica Holding Company ,Not Available ,Not Available ,Not Available ,Not Available ,Not Available
H8064 ,FirstMedicare Direct ,FIRSTCAROLINACARE INSURANCE COMPANY ,The Carle Foundation ,Not Available ,Not Available ,Not Available ,Not Available ,Not Available
H8067 ,Provider Partners Health Plans ,"PROVIDER PARTNERS HEALTH PLAN, INC. ","Rifkin Managed Care Holding, LLC ",Not Available ,Not Available ,Not Available ,Not Available ,Not Available
H8070 ,UCare ,UCARE MINNESOTA ,UCare Minnesota ,Not Available ,Not Available ,Not Available ,Not Available ,Not Available
H8093 ,Georgia Health Advantage ,"GEORGIA ASSURANCE, INC. ",Mitchell Family Office ,Not Available ,Not Available ,Not Available ,Not Available ,Not Available
H8095 ,Wellmark Advantage Health Plan ,"WELLMARK ADVANTAGE HEALTH PLAN, INC. ",Blue Cross Blue Shield of Michigan Mutual Ins. Co. ,Not Available ,Not Available ,Not Available ,Not Available ,Not Available
H8121 ,Ascension Complete ,CENTENE VENTURE COMPANY TENNESSEE ,Centene Corporation ,Not Available ,Not Available ,Not Available ,Not Available ,Not Available
H8133 ,Blue Cross and Blue Shield of Texas ,GHS INSURANCE COMPANY ,Health Care Service Corporation ,30%,29%,25%,Not Available ,20%
H8142 ,Baylor Scott & White Health Plan ,SCOTT AND WHITE HEALTH PLAN ,Baylor Scott & White Holdings ,12%,27%,27%,Not Available ,9%
H8145 ,Humana ,HUMANA INSURANCE COMPANY ,Humana Inc. ,8%,22%,22%,3%,8%
H8166 ,Highmark Blue Cross Blue Shield ,HIGHMARK BCBSD INC. ,Highmark Health ,Not Available ,Not Available ,Not Available ,Not Available ,Not Available
H8173 ,Devoted Health ,"DEVOTED HEALTH PLAN OF ARIZONA, INC. ","Devoted Health, Inc. ",14%,29%,18%,9%,11%
H8176 ,Molina Healthcare of South Carolina ,"MOLINA HEALTHCARE OF SOUTH CAROLINA,INC ","Molina Healthcare, Inc. ",27%,32%,14%,Not Available ,17%
H8181 ,Blue Cross and Blue Shield of Nebraska ,"SAPPHIRE EDGE, INC. ",Blue Cross Blue Shield of Nebraska ,18%,10%,31%,10%,10%
H8189 ,Wellcare by Allwell ,MANAGED HEALTH SERVICES INSURANCE CORP. ,Centene Corporation ,5%,10%,6%,Not Available ,Not Available
H8211 ,UnitedHealthcare ,CARE IMPROVEMENT PLUS SOUTH CENTRAL INSURANCE CO. ,"UnitedHealth Group, Inc. ",18%,17%,32%,11%,16%
H8298 ,Horizon Blue Cross Blue Shield of New Jersey ,"HORIZON HEALTHCARE OF NEW JERSEY, INC. ","Horizon Mutual Holdings, Inc ",Not Available ,Not Available ,Not Available ,Not Available ,Not Available
H8320 ,Devoted Health ,"Devoted of Illinois, Inc. ","Devoted Health, Inc. ",Plan too new to be measured ,Plan too new to be measured ,Plan too new to be measured ,Plan too new to be measured ,Plan too new to be measured
H8330 ,Tufts Health Plan ,TUFTS ASSOCIATED HEALTH MAINTENANCE ORGANIZATION ,"Point32Health, Inc. ",Not Available ,Not Available ,Not Available ,Not Available ,Not Available
H8332 ,Aetna Medicare ,AETNA BETTER HEALTH OF KANSAS INC. ,CVS Health Corporation ,26%,14%,24%,Not Available ,16%
H8379 ,Priority Health Medicare ,"PRIORITY HEALTH CHOICE, INC. ",Corewell Health ,14%,14%,19%,11%,10%
H8385 ,Align powered by Sanford Health Plan ,SANFORD HEALTH PLAN ,Sanford Health ,Not Available ,Not Available ,Not Available ,Not Available ,Not Available
H8390 ,CareSource ,CARESOURCE GEORGIA CO. ,CareSource ,Not Available ,Not Available ,Not Available ,Not Available ,Not Available
H8432 ,Anthem Blue Cross and Blue Shield ,"ANTHEM HEALTHCHOICE HMO, INC. ","Elevance Health, Inc. ",28%,18%,28%,Not Available ,11%
H8457 ,Longevity Health Plan ,"LONGEVITY HEALTH PLAN OF NEW YORK, INC. ","Longevity Health Founders, LLC ",Not Available ,Not Available ,Not Available ,Not Available ,Not Available
H8492 ,American Health Advantage of Louisiana ,DIGNITY CARE CORPORATION ,Mitchell Family Office ,Not Available ,Not Available ,Not Available ,Not Available ,Not Available
H8547 ,Blue Cross and Blue Shield of Illinois ,ILLINOIS BLUE CROSS BLUE SHIELD INSURANCE COMPANY ,Health Care Service Corporation ,Not Available ,Not Available ,Not Available ,Not Available ,Not Available
H8552 ,Anthem Blue Cross Life and Health Insurance Compan ,ANTHEM BLUE CROSS LIFE AND HEALTH INS COMPANY ,"Elevance Health, Inc. ",27%,27%,34%,Not Available ,16%
H8553 ,Wellcare ,"WELLCARE HEALTH INSURANCE OF THE SOUTHWEST, INC. ",Centene Corporation ,24%,28%,17%,Not Available ,19%
H8554 ,"Blue Cross and Blue Shield of OK, TX ",GHS INSURANCE COMPANY ,Health Care Service Corporation ,Not Available ,Not Available ,Not Available ,Not Available ,Not Available
H8578 ,Health New England Medicare Advantage Plans ,"HEALTH NEW ENGLAND, INC. ","Baystate Health, Inc. ",15%,23%,22%,5%,5%
H8597 ,Aetna Medicare ,AETNA BETTER HEALTH OF TEXAS INC. ,CVS Health Corporation ,13%,26%,9%,Not Available ,12%
H8604 ,The Health Plan ,THP INSURANCE COMPANY ,"The Health Plan of West Virginia, Inc. ",Not Available ,Not Available ,Not Available ,Not Available ,Not Available
H8634 ,"Blue Cross and Blue Shield of IL, NM ",HEALTH CARE SERVICE CORPORATION ,Health Care Service Corporation ,20%,22%,41%,20%,25%
H8649 ,Aetna Medicare ,AETNA HEALTH OF UTAH INC. ,CVS Health Corporation ,17%,24%,28%,Not Available ,9%
H8711 ,Wellcare ,WELLCARE HEALTH INSURANCE COMPANY OF NEW JERSEY ,Centene Corporation ,Not Available ,Not Available ,Not Available ,Not Available ,Not Available
H8764 ,Aspire Health ,ASPIRE HEALTH PLAN ,Montage Health ,Not Available ,Not Available ,Not Available ,Not Available ,Not Available
H8768 ,UnitedHealthcare ,CARE IMPROVEMENT PLUS SOUTH CENTRAL INSURANCE CO. ,"UnitedHealth Group, Inc. ",13%,23%,16%,Not Available ,11%
H8783 ,UCare ,"UCARE HEALTH, INC. ",UCare Minnesota ,Not Available ,Not Available ,Not Available ,Not Available ,Not Available
H8794 ,Kaiser Permanente ,"KAISER FOUNDATION HP, INC. ","Kaiser Foundation Health Plan, Inc. ",Plan too new to be measured ,Plan too new to be measured ,Plan too new to be measured ,Plan too new to be measured ,Plan too new to be measured
H8797 ,Perennial Advantage ,"PERENNIAL ADVANTAGE OF OHIO, INC. ","Perennial Consortium, LLC ",Not Available ,Not Available ,Not Available ,Not Available ,Not Available
H8823 ,Sentara Medicare ,SENTARA MEDICARE ADVANTAGE OF NORTH CAROLINA INC ,Sentara Health Care (SHC) ,Plan too new to be measured ,Plan too new to be measured ,Plan too new to be measured ,Plan too new to be measured ,Plan too new to be measured
H8832 ,Alignment Health Plan ,ALIGNMENT HEALTH ADVANTAGE PLAN INC ,"Alignment Healthcare USA, LLC ",Plan too new to be measured ,Plan too new to be measured ,Plan too new to be measured ,Plan too new to be measured ,Plan too new to be measured
H8845 ,Molina Healthcare of Arizona ,"MOLINA HEALTHCARE OF ARIZONA, INC. ","Molina Healthcare, Inc. ",Not Available ,Not Available ,Not Available ,Not Available ,Not Available
H8849 ,Wellpoint ,WELLPOINT INSURANCE COMPANY ,"Elevance Health, Inc. ",Not Available ,34%,18%,Not Available ,17%
H8854 ,CareFirst BlueCross BlueShield Medicare Advantage ,"CAREFIRST ADVANTAGE DSNP, INC. ","CareFirst, Inc. ",22%,36%,19%,Not Available ,16%
H8879 ,"Healthy Mississippi, Inc. ","Healthy Mississippi, Inc. ",Singh Holdings LLC ,Plan too new to be measured ,Plan too new to be measured ,Plan too new to be measured ,Plan too new to be measured ,Plan too new to be measured
H8889 ,Medica ,MEDICA HEALTH PLANS ,Medica Holding Company ,9%,4%,27%,8%,10%
H8894 ,IEHP DualChoice ,Inland Empire Health Plan ,INLAND EMPIRE HEALTH PLAN ,Not Available ,Not Available ,Not Available ,Not Available ,Not Available
H8902 ,SCAN Health Plan ,"SCAN HEALTH PLAN TEXAS, INC. ",SCAN Group ,Not Available ,Not Available ,Not Available ,Not Available ,Not Available
H8908 ,Humana ,"HUMANA MEDICAL PLAN OF MICHIGAN, INC. ",Humana Inc. ,15%,25%,17%,Not Available ,12%
H8917 ,Devoted Health ,DEVOTED HEALTH INSURANCE COMPANY OF WASHINGTON ,"Devoted Health, Inc. ",Plan too new to be measured ,Plan too new to be measured ,Plan too new to be measured ,Plan too new to be measured ,Plan too new to be measured
H8928 ,Fallon Health ,FALLON COMMUNITY HEALTH PLAN ,"Fallon Community Health Plan, Inc. ",Not Available ,Not Available ,Not Available ,Not Available ,Not Available
H8947 ,Peak Health ,PEAK HEALTH INSURANCE CORPORATION ,"West Virginia United Health System, Inc. ",Plan too new to be measured ,Plan too new to be measured ,Plan too new to be measured ,Plan too new to be measured ,Plan too new to be measured
H8967 ,Great Plains Medicare Advantage ,SANFORD HEALTH PLAN ,Sanford Health ,Not Available ,Not Available ,Not Available ,Not Available ,Not Available
H9001 ,Fallon Health ,FALLON COMMUNITY HEALTH PLAN ,"Fallon Community Health Plan, Inc. ",17%,37%,18%,8%,9%
H9003 ,Kaiser Permanente ,KAISER FOUNDATION HP OF THE N W ,"Kaiser Foundation Health Plan, Inc. ",27%,20%,16%,3%,14%
H9042 ,MyTruAdvantage ,"SOUTHEASTERN INDIANA HEALTH ORGANIZATION, INC. ","SIHO Holding, Inc. ",Not Available ,Not Available ,Not Available ,Not Available ,Not Available
H9047 ,Providence Medicare Advantage Plans ,PROVIDENCE HEALTH ASSURANCE ,Providence St Joseph Health ,14%,17%,16%,4%,9%
H9065 ,AMH Health ,"AMH HEALTH, LLC ","Elevance Health, Inc. ",12%,17%,14%,11%,12%
H9066 ,Nascentia Health Plus ,VISITING NURSE ASSOCIATION OF CENTRAL NEW YORK ,VISITING NURSE ASSOCIATION OF CENTRAL NEW YORK ,Not Available ,Not Available ,Not Available ,Not Available ,Not Available
H9096 ,Dean Advantage ,"DEAN HEALTH PLAN, INC. ",Medica Holding Company ,20%,25%,17%,4%,11%
H9147 ,Blue Cross and Blue Shield of North Carolina ,BLUE CROSS AND BLUE SHIELD OF NC SENIOR HEALTH ,Blue Cross and Blue Shield of North Carolina ,Not Available ,Not Available ,Not Available ,Not Available ,Not Available
H9153 ,West Virginia Senior Advantage ,"WEST VIRGINIA SENIOR ADVANTAGE, INC. ","SNP Holdings, LLC ",Not Available ,Not Available ,Not Available ,Not Available ,Not Available
H9179 ,Trinity Health Plan of Michigan ,TRINITY HEALTH PLAN OF MICHIGAN INC ,Trinity Health Corporation ,Plan too new to be measured ,Plan too new to be measured ,Plan too new to be measured ,Plan too new to be measured ,Plan too new to be measured
H9191 ,Provider Partners Health Plans ,"PROVIDER PARTNERS HEALTH PLAN OF MISSOURI, INC. ","Rifkin Managed Care Holding, LLC ",Not Available ,Not Available ,Not Available ,Not Available ,Not Available
H9207 ,Jefferson Health Plans ,"HEALTH PARTNERS PLANS, INC. ",Thomas Jefferson University ,Not Available ,Not Available ,Not Available ,Not Available ,Not Available
H9219 ,AMH Health ,"AMH HEALTH PLANS OF MAINE, INC. ","Elevance Health, Inc. ",Not Available ,Not Available ,Not Available ,Not Available ,Not Available
H9231 ,Devoted Health ,DEVOTED HEALTH INSURANCE COMPANY OF TENNESSEE INC ,"Devoted Health, Inc. ",Not Available ,Not Available ,Not Available ,Not Available ,Not Available
H9306 ,Alterwood Advantage ,"ALTERWOOD ADVANTAGE, INC. ","LifeBridge Health, Inc. ",28%,41%,22%,18%,20%
H9364 ,Wellcare ,"WELLCARE OF MAINE, INC. ",Centene Corporation ,16%,17%,11%,7%,13%
H9387 ,Wellcare by Allwell ,"SUNFLOWER STATE HEALTH PLAN, INC. ",Centene Corporation ,24%,38%,15%,21%,16%
H9412 ,Geisinger Gold ,"GEISINGER QUALITY OPTIONS, INC. ","Risant Health, Inc. ",Not Available ,Not Available ,Not Available ,Not Available ,Not Available
H9431 ,Aetna Medicare ,FIRST HEALTH LIFE & HEALTH INSURANCE COMPANY ,CVS Health Corporation ,18%,17%,29%,9%,13%
H9460 ,Cigna Healthcare ,"CIGNA HEALTHCARE OF ST LOUIS, INC. ",The Cigna Group ,Not Available ,Not Available ,Not Available ,Not Available ,Not Available
H9469 ,Simply Healthcare ,WELLPOINT LIFE AND HEALTH INSURANCE COMPANY ,"Elevance Health, Inc. ",Not Available ,Not Available ,Not Available ,Not Available ,Not Available
H9485 ,Mass General Brigham Health Plan ,"Mass General Brigham Health Plan, Inc. ",Mass General Brigham Incorporated ,Not Available ,Not Available ,Not Available ,Not Available ,Not Available
H9489 ,Vermont Blue Advantage ,"VERMONT BLUE ADVANTAGE, INC. ",Blue Cross Blue Shield of Michigan Mutual Ins. Co. ,Not Available ,Not Available ,Not Available ,Not Available ,Not Available
H9525 ,Anthem Blue Cross and Blue Shield ,COMPCARE HEALTH SERVICES INSURANCE CORPORATION ,"Elevance Health, Inc. ",14%,12%,14%,8%,10%
H9529 ,WyoBlue Advantage ,WYOBLUE ADVANTAGE INC ,Blue Cross Blue Shield of Michigan Mutual Ins. Co. ,Plan too new to be measured ,Plan too new to be measured ,Plan too new to be measured ,Plan too new to be measured ,Plan too new to be measured
H9572 ,Blue Cross Blue Shield of Michigan ,BCBS OF MICHIGAN MUTUAL INSURANCE COMPANY ,Blue Cross Blue Shield of Michigan Mutual Ins. Co. ,21%,15%,27%,Not Available ,7%
H9585 ,WellSense Health Plan ,"BOSTON MEDICAL CENTER HEALTH PLAN, INC. ","BMC Health System, Inc. ",Not Available ,Not Available ,Not Available ,Not Available ,Not Available
H9589 ,Clear Spring Health ,"CLEAR SPRING HEALTH (GA), INC. ",Group 1001 ,Not Available ,Not Available ,Not Available ,Not Available ,Not Available
H9590 ,Longevity Health ,"LONGEVITY HEALTH PLAN OF ILLINOIS, INC. ","Longevity Health Founders, LLC ",Not Available ,Not Available ,Not Available ,Not Available ,Not Available
H9615 ,MVP HEALTH CARE ,"MVP HEALTH PLAN, INC. ","MVP Health Care, Inc. ",14%,26%,24%,7%,6%
H9630 ,Wellcare by Allwell ,"ARKANSAS HEALTH & WELLNESS HEALTH PLAN, INC. ",Centene Corporation ,14%,33%,13%,6%,10%
H9656 ,Blue Cross of Idaho ,"BLUE CROSS OF IDAHO CARE PLUS, INC. ","Gemstone Holdings, Inc. ",Plan too new to be measured ,Plan too new to be measured ,Plan too new to be measured ,Plan too new to be measured ,Plan too new to be measured
H9678 ,Healthfirst Medicare Plan ,"HEALTHFIRST INSURANCE COMPANY, INC. ","Healthfirst, Inc. ",Not Available ,Not Available ,Not Available ,Not Available ,Not Available
H9686 ,Alignment Health Plan ,"ALIGNMENT HEALTH PLAN OF NEVADA, INC. ","Alignment Healthcare USA, LLC ",31%,33%,16%,Not Available ,23%
H9690 ,American Health Advantage of Indiana ,AMERICAN HEALTH PLAN OF INDIANA INC ,Mitchell Family Office ,Plan too new to be measured ,Plan too new to be measured ,Plan too new to be measured ,Plan too new to be measured ,Plan too new to be measured
H9699 ,Arkansas Blue Medicare ,"USABLE HMO, INC. ",USAble Mutual Insurance Company ,11%,10%,16%,Not Available ,8%
H9700 ,Devoted Health ,DEVOTED HEALTH PLAN OF NORTH CAROLINA INC ,"Devoted Health, Inc. ",Plan too new to be measured ,Plan too new to be measured ,Plan too new to be measured ,Plan too new to be measured ,Plan too new to be measured
H9706 ,Blue Cross and Blue Shield of Texas ,HCSC INSURANCE SERVICES COMPANY ,Health Care Service Corporation ,31%,42%,21%,17%,23%
H9725 ,Cigna Healthcare ,"CIGNA HEALTHCARE OF NORTH CAROLINA, INC. ",The Cigna Group ,18%,16%,18%,9%,17%
H9730 ,Wellcare ,"WELLCARE HEALTH INSURANCE COMPANY OF KENTUCKY, INC ",Centene Corporation ,14%,22%,16%,Not Available ,16%
H9763 ,Ochsner Health Plan ,"OCHSNER HEALTH PLAN, INC. ",Ochsner Clinic Foundation ,Not Available ,Not Available ,Not Available ,Not Available ,Not Available
H9808 ,CARE N' CARE INSURANCE COMPANY OF NORTH CAROLINA ,CARE N' CARE INSURANCE COMPANY OF NORTH CAROLINA ,"HTA Holdings, LLC ",10%,9%,14%,9%,8%
H9811 ,Wellcare by Allwell ,"MAGNOLIA HEALTH PLAN, INC. ",Centene Corporation ,Not Available ,Not Available ,Not Available ,Not Available ,Not Available
H9826 ,Community Health Choice ,"COMMUNITY HEALTH CHOICE TEXAS, INC. ",Harris County Hospital District ,Not Available ,Not Available ,Not Available ,Not Available ,Not Available
H9827 ,Trinity Health Plan New York ,"MOUNT CARMEL HEALTH PLAN OF NEW YORK, INC. ",Trinity Health Corporation ,Not Available ,Not Available ,Not Available ,Not Available ,Not Available
H9834 ,Quartz Medicare Advantage ,QUARTZ HEALTH PLAN MN CORPORATION ,University of Wisconsin Hospitals and Clincs Autho ,Not Available ,Not Available ,Not Available ,Not Available ,Not Available
H9884 ,Devoted Health ,DEVOTED HEALTH INSURANCE COMPANY ,"Devoted Health, Inc. ",15%,46%,10%,Not Available ,9%
H9888 ,Devoted Health ,DEVOTED HEALTH INSURANCE COMPANY OF ALABAMA INC ,"Devoted Health, Inc. ",Not Available ,Not Available ,Not Available ,Not Available ,Not Available
H9900 ,Wellcare ,"WELLCARE OF OKLAHOMA, INC. ",Centene Corporation ,20%,30%,17%,Not Available ,24%
H9904 ,Mass Advantage ,"CENTRAL MASS HEALTH, LLC ",Central Mass Health Holding LLC ,Not Available ,Not Available ,Not Available ,Not Available ,Not Available
H9907 ,Tufts Health Plan ,TUFTS ASSOCIATED HEALTH MAINTENANCE ORGANIZATION ,"Point32Health, Inc. ",Not Available ,Not Available ,Not Available ,Not Available ,Not Available
H9909 ,American Health Advantage of MS ,"AMERICAN HEALTH PLAN OF MS, INC. ",Mitchell Family Office ,Not Available ,Not Available ,Not Available ,Not Available ,Not Available
H9917 ,Align Senior Care ,"ALIGN SENIOR CARE FLORIDA, INC. ","Curana Health Holdings, LLC ",Not Available ,Not Available ,Not Available ,Not Available ,Not Available
H9942 ,Longevity Health Plan ,LONGEVITY HEALTH PLAN OF NEW JERSEY INSURANCE COMP ,"Longevity Health Founders, LLC ",Not Available ,Not Available ,Not Available ,Not Available ,Not Available
H9946 ,Shared Health Dual Freedom ,"SHARED HEALTH MISSISSIPPI, INC. ",BlueCross BlueShield of Tennessee ,Plan too new to be measured ,Plan too new to be measured ,Plan too new to be measured ,Plan too new to be measured ,Plan too new to be measured
