H2582 ,UnitedHealthcare ,ROCKY MOUNTAIN HEALTH MAINTENANCE ORGANIZATION INC ,"UnitedHealth Group, Inc. ",Not Available ,Not Available ,Not Available ,Not Available ,Not Available
H2591 ,Health Alliance Medicare ,"HEALTH ALLIANCE - MIDWEST, INC. ",The Carle Foundation ,Not Available ,Not Available ,Not Available ,Not Available ,Not Available
H2593 ,Wellpoint ,"WELLPOINT TEXAS, INC. ","Elevance Health, Inc. ",Not Available ,Not Available ,Not Available ,Not Available ,Not Available
H2610 ,Essence Healthcare ,"ESSENCE HEALTHCARE, INC. ",Lumeris Group Holdings Corporation ,8%,16%,10%,3%,6%
H2624 ,CARE N' CARE INSURANCE COMPANY OF NORTH CAROLINA ,CARE N' CARE INSURANCE COMPANY OF NORTH CAROLINA ,"HTA Holdings, LLC ",Not Available ,Not Available ,Not Available ,Not Available ,Not Available
H2663 ,Aetna Medicare ,"COVENTRY HEALTH CARE OF MISSOURI, INC. ",CVS Health Corporation ,12%,9%,18%,9%,11%
H2686 ,Devoted Health ,DEVOTED HEALTH INSURANCE COMPANY OF HAWAII INC ,"Devoted Health, Inc. ",Not Available ,Not Available ,Not Available ,Not Available ,Not Available
H2694 ,eternalHealth ,"ETERNALHEALTH, INC. ","Eternal Health of Delaware, Inc. ",Not Available ,Not Available ,Not Available ,Not Available ,Not Available
H2697 ,Devoted Health ,"DEVOTED HEALTH PLAN OF OHIO, INC. ","Devoted Health, Inc. ",22%,43%,18%,Not Available ,12%
H2715 ,Molina Healthcare of Illinois ,MOLINA HEALTHCARE OF ILLINOIS INC ,"Molina Healthcare, Inc. ",Not Available ,Not Available ,Not Available ,Not Available ,Not Available
H2722 ,Primewell Health Services ,"Primewell Health Services of Arkansas, Inc. ",Louisiana Health Service & Indemnity Company ,Not Available ,Not Available ,Not Available ,Not Available ,Not Available
H2737 ,Health New England Medicare Advantage Plans ,"HEALTH NEW ENGLAND, INC. ","Baystate Health, Inc. ",Not Available ,Not Available ,Not Available ,Not Available ,Not Available
H2752 ,Cigna Healthcare ,CIGNA HEALTHCARE OF CONNECTICUT INC. ,The Cigna Group ,Not Available ,Not Available ,Not Available ,Not Available ,Not Available
H2775 ,Wellcare ,AMERICAN PROGRESSIVE LIFE & HLTH INS COMPANY OF NY ,Centene Corporation ,23%,32%,15%,Not Available ,18%
H2802 ,UnitedHealthcare ,"UNITEDHEALTHCARE OF THE MIDLANDS, INC. ","UnitedHealth Group, Inc. ",12%,11%,12%,5%,8%
H2816 ,Wellcare ,AMERICAN PROGRESSIVE LIFE & HLTH INS COMPANY OF NY ,Centene Corporation ,Not Available ,Not Available ,Not Available ,Not Available ,Not Available
H2819 ,Blue Shield of California ,CALIFORNIA PHYSICIANS' SERVICE ,California Physicians' Service ,Plan too new to be measured ,Plan too new to be measured ,Plan too new to be measured ,Plan too new to be measured ,Plan too new to be measured
H2836 ,Anthem Blue Cross and Blue Shield ,"ANTHEM HEALTH PLANS, INC. ","Elevance Health, Inc. ",17%,20%,36%,8%,10%
H2853 ,Ascension Complete ,CENTENE VENTURE COMPANY TENNESSEE ,Centene Corporation ,Not Available ,Not Available ,Not Available ,Not Available ,Not Available
H2875 ,Humana ,HUMANA WI HEALTH ORGANIZATION INSURANCE CORP ,Humana Inc. ,Plan too new to be measured ,Plan too new to be measured ,Plan too new to be measured ,Plan too new to be measured ,Plan too new to be measured
H2915 ,Wellcare by Allwell ,"PENNSYLVANIA HEALTH & WELLNESS, INC. ",Centene Corporation ,21%,34%,11%,8%,18%
H2923 ,Devoted Health ,DEVOTED HEALTH PLAN OF OREGON INC ,"Devoted Health, Inc. ",Not Available ,Not Available ,Not Available ,Not Available ,Not Available
H2926 ,PrimeWest Health ,PRIMEWEST RURAL MN HEALTH CARE ACCESS INITIATIVE ,PrimeWest Rural MN Health Care Access Initiative ,Not Available ,Not Available ,Not Available ,Not Available ,Not Available
H2942 ,Cox HealthPlans ,COX HEALTH SYSTEMS HMO INC ,CoxHealth ,Not Available ,Not Available ,Not Available ,Not Available ,Not Available
H2960 ,Senior Care Plus ,"HOMETOWN HEALTH PLAN, INC. ",Renown Health ,21%,37%,21%,9%,14%
H2962 ,Ultimate Health Plans ,"ULTIMATE HEALTH PLANS, INC. ","Ultimate Healthcare Holdings, LLC ",23%,24%,10%,Not Available ,15%
H3015 ,Shared Health Dual Plus ,"SHARED HEALTH MISSISSIPPI, INC. ",BlueCross BlueShield of Tennessee ,Not Available ,Not Available ,Not Available ,Not Available ,Not Available
H3038 ,Molina Healthcare of California ,MOLINA HEALTHCARE OF CALIFORNIA ,"Molina Healthcare, Inc. ",Plan too new to be measured ,Plan too new to be measured ,Plan too new to be measured ,Plan too new to be measured ,Plan too new to be measured
H3041 ,Devoted Health ,DEVOTED HEALTH PLAN OF SOUTH CAROLINA INC ,"Devoted Health, Inc. ",Not Available ,Not Available ,Not Available ,Not Available ,Not Available
H3047 ,Wellcare ,WELLCARE HEALTH INSURANCE COMPANY OF LOUISIANA ,Centene Corporation ,15%,23%,20%,Not Available ,15%
H3048 ,SECUR Health Plan ,SECUR INC ,Chapters CareNu Inc ,Plan too new to be measured ,Plan too new to be measured ,Plan too new to be measured ,Plan too new to be measured ,Plan too new to be measured
H3071 ,Clear Spring Health ,"CLEAR SPRING HEALTH COMMUNITY CARE, INC. ",Group 1001 ,Not Available ,Not Available ,Not Available ,Not Available ,Not Available
H3080 ,Devoted Health ,DEVOTED HEALTH PLAN OF ALABAMA INC ,"Devoted Health, Inc. ",Not Available ,Not Available ,Not Available ,Not Available ,Not Available
H3113 ,UnitedHealthcare ,"OXFORD HEALTH PLANS (NJ), INC. ","UnitedHealth Group, Inc. ",Not Available ,33%,16%,Not Available ,12%
H3124 ,Jefferson Health Plans ,PARTNERS INSURANCE COMPANY OF NEW JERSEY INC ,Thomas Jefferson University ,Plan too new to be measured ,Plan too new to be measured ,Plan too new to be measured ,Plan too new to be measured ,Plan too new to be measured
H3138 ,Kaiser Permanente ,KAISER PERMANENTE INSURANCE COMPANY ,"Kaiser Foundation Health Plan, Inc. ",Plan too new to be measured ,Plan too new to be measured ,Plan too new to be measured ,Plan too new to be measured ,Plan too new to be measured
H3146 ,Aetna Medicare ,AETNA BETTER HEALTH INC. (GA) ,CVS Health Corporation ,14%,21%,16%,Not Available ,16%
H3152 ,Aetna Medicare ,AETNA HEALTH INC. (NJ) ,CVS Health Corporation ,15%,25%,25%,Not Available ,10%
H3170 ,Blue Cross and Blue Shield of Nebraska ,"SAPPHIRE EDGE, INC. ",Blue Cross Blue Shield of Nebraska ,Not Available ,Not Available ,Not Available ,Not Available ,Not Available
H3186 ,Align powered by Sanford Health Plan ,SANFORD HEALTH PLAN OF MINNESOTA ,Sanford Health ,Not Available ,Not Available ,Not Available ,Not Available ,Not Available
H3189 ,Essence Healthcare ,"ESSENCE HEALTHCARE OF OHIO, INC. ",Lumeris Group Holdings Corporation ,Not Available ,Not Available ,Not Available ,Not Available ,Not Available
H3192 ,Aetna Medicare ,AETNA HEALTH OF MICHIGAN INC. ,CVS Health Corporation ,15%,23%,18%,Not Available ,17%
H3204 ,Presbyterian Health Plan ,PRESBYTERIAN HEALTH PLAN ,Presbyterian Healthcare Services ,19%,27%,20%,Not Available ,16%
H3219 ,Allina Health Aetna Medicare ,ALLINA HEALTH AND AETNA INSURANCE COMPANY ,Allina Health and Aetna Insurance Holding Company ,18%,26%,20%,10%,15%
H3239 ,Aetna Medicare ,"AETNA BETTER HEALTH, INC. (LA) ",CVS Health Corporation ,Not Available ,Not Available ,Not Available ,Not Available ,Not Available
H3240 ,Wellpoint ,"WELLPOINT NEW JERSEY, INC. ","Elevance Health, Inc. ",Not Available ,Not Available ,Not Available ,Not Available ,Not Available
H3251 ,Blue Cross and Blue Shield of New Mexico ,HEALTH CARE SERVICE CORPORATION ,Health Care Service Corporation ,21%,24%,18%,Not Available ,18%
H3256 ,UnitedHealthcare ,CARE IMPROVEMENT PLUS SOUTH CENTRAL INSURANCE CO. ,"UnitedHealth Group, Inc. ",9%,7%,11%,Not Available ,9%
H3259 ,BlueCare Plus Tennessee ,VOLUNTEER STATE HEALTH PLAN ,BlueCross BlueShield of Tennessee ,Not Available ,Not Available ,Not Available ,Not Available ,Not Available
H3274 ,Align Senior Care ,ALIGN SENIOR CARE CALIFORNIA INC. ,"Curana Health Holdings, LLC ",Not Available ,Not Available ,Not Available ,Not Available ,Not Available
H3276 ,ConnectiCare ,"CONNECTICARE INSURANCE COMPANY, INC. ","EmblemHealth, Inc. ",Not Available ,Not Available ,Not Available ,Not Available ,Not Available
H3288 ,Aetna Medicare ,AETNA HEALTH AND LIFE INSURANCE COMPANY ,CVS Health Corporation ,15%,19%,20%,Not Available ,13%
H3291 ,PruittHealth Premier ,"PRUITTHEALTH PREMIER, INC. ","UNICO Services, Inc. ",Not Available ,Not Available ,Not Available ,Not Available ,Not Available
H3305 ,MVP HEALTH CARE ,"MVP HEALTH PLAN, INC. ","MVP Health Care, Inc. ",8%,9%,37%,7%,6%
H3307 ,UnitedHealthcare ,"OXFORD HEALTH PLANS (NY), INC. ","UnitedHealth Group, Inc. ",14%,23%,32%,Not Available ,8%
H3312 ,Aetna Medicare ,AETNA HEALTH INC. (NY) ,CVS Health Corporation ,15%,22%,14%,Not Available ,11%
H3330 ,EmblemHealth ,HEALTH INSURANCE PLAN OF GREATER NEW YORK ,"EmblemHealth, Inc. ",Not Available ,Not Available ,Not Available ,Not Available ,Not Available
H3335 ,"Excellus Health Plan, Inc ","EXCELLUS HEALTH PLAN, INC. ","Lifetime Healthcare, Inc. ",16%,14%,31%,Not Available ,12%
H3342 ,Anthem Blue Cross and Blue Shield ,"ANTHEM HEALTHCHOICE ASSURANCE, INC. ","Elevance Health, Inc. ",Not Available ,Not Available ,Not Available ,Not Available ,Not Available
H3344 ,Independent Health ,INDEPENDENT HEALTH BENEFITS CORPORATION ,"Independent Health Association, Inc. ",Not Available ,Not Available ,Not Available ,Not Available ,Not Available
H3347 ,Elderplan ,"ELDERPLAN, INC. ","Elderplan, Inc. ",Not Available ,Not Available ,Not Available ,Not Available ,Not Available
H3351 ,"Excellus Health Plan, Inc ","EXCELLUS HEALTH PLAN, INC. ","Lifetime Healthcare, Inc. ",7%,6%,17%,5%,4%
H3359 ,Healthfirst Medicare Plan ,"HEALTHFIRST HEALTH PLAN, INC. ","Healthfirst, Inc. ",Not Available ,Not Available ,Not Available ,Not Available ,Not Available
H3362 ,Independent Health ,"INDEPENDENT HEALTH ASSOCIATION, INC. ","Independent Health Association, Inc. ",Not Available ,13%,34%,Not Available ,7%
H3379 ,UnitedHealthcare ,"UNITEDHEALTHCARE OF NEW YORK, INC. ","UnitedHealth Group, Inc. ",12%,25%,15%,Not Available ,12%
H3384 ,Highmark Blue Cross Blue Shield or Highmark Blue S ,Highmark Western and Northeastern New York Inc. ,Highmark Health ,18%,12%,23%,10%,13%
H3387 ,UnitedHealthcare ,"UNITEDHEALTHCARE OF NEW YORK, INC. ","UnitedHealth Group, Inc. ",Not Available ,Not Available ,Not Available ,Not Available ,Not Available
H3388 ,CDPHP Medicare Advantage ,"CAPITAL DISTRICT PHYSICIANS' HEALTH PLAN, INC. ","Capital District Physicians' Health Plan, Inc. ",9%,19%,25%,7%,6%
H3404 ,Blue Cross and Blue Shield of North Carolina ,BLUE CROSS AND BLUE SHIELD OF NORTH CAROLINA ,Blue Cross and Blue Shield of North Carolina ,13%,8%,28%,Not Available ,11%
H3407 ,El Paso Health Medicare Advantage ,"EL PASO FIRST HEALTH PLANS, INC. ",El Paso County Hospital District ,Not Available ,Not Available ,Not Available ,Not Available ,Not Available
H3418 ,UnitedHealthcare ,CARE IMPROVEMENT PLUS SOUTH CENTRAL INSURANCE CO. ,"UnitedHealth Group, Inc. ",16%,30%,19%,Not Available ,11%
H3419 ,Perennial Advantage ,"PERENNIAL ADVANTAGE OF COLORADO, INC. ","Perennial Consortium, LLC ",Not Available ,Not Available ,Not Available ,Not Available ,Not Available
H3443 ,Alignment Health Plan ,"ALIGNMENT HEALTH PLAN OF ARIZONA, INC. ","Alignment Healthcare USA, LLC ",34%,49%,7%,Not Available ,22%
H3447 ,Anthem HealthKeepers ,"HEALTHKEEPERS, INC. ","Elevance Health, Inc. ",8%,13%,13%,6%,7%
H3449 ,Blue Cross and Blue Shield of North Carolina ,BLUE CROSS AND BLUE SHIELD OF NORTH CAROLINA ,Blue Cross and Blue Shield of North Carolina ,12%,18%,25%,Not Available ,13%
H3467 ,ProCare Advantage ,"PROCARE ADVANTAGE, LLC ",First Sacramento Capital Funding LLC ,Not Available ,Not Available ,Not Available ,Not Available ,Not Available
H3499 ,Wellcare by Allwell ,COORDINATED CARE CORPORATION ,Centene Corporation ,12%,23%,9%,Not Available ,15%
H3528 ,ConnectiCare ,"CONNECTICARE, INC. ","EmblemHealth, Inc. ",15%,18%,27%,10%,8%
H3533 ,Humana ,"HUMANA HEALTH COMPANY OF NEW YORK, INC. ",Humana Inc. ,Not Available ,28%,17%,Not Available ,10%
H3536 ,Anthem Blue Cross and Blue Shield ,"MATTHEW THORNTON HEALTH PLAN, INC. ","Elevance Health, Inc. ",17%,18%,22%,Not Available ,15%
H3551 ,eternalHealth ,ETERNALHEALTH OF ARIZONA INC ,"Eternal Health of Delaware, Inc. ",Plan too new to be measured ,Plan too new to be measured ,Plan too new to be measured ,Plan too new to be measured ,Plan too new to be measured
H3554 ,Arkansas Blue Medicare ,USABLE PPO INSURANCE COMPANY ,USAble Mutual Insurance Company ,15%,7%,20%,10%,12%
H3557 ,Blue Cross & Blue Shield of Rhode Island ,BLUE CROSS & BLUE SHIELD OF RHODE ISLAND ,Blue Cross & Blue Shield of Rhode Island ,Not Available ,Not Available ,Not Available ,Not Available ,Not Available
H3561 ,Wellcare by Health Net ,"HEALTH NET COMMUNITY SOLUTIONS, INC. ",Centene Corporation ,19%,27%,9%,Not Available ,Not Available
H3597 ,Aetna Medicare ,AETNA HEALTH INC. (ME) ,CVS Health Corporation ,14%,12%,20%,Not Available ,12%
H3653 ,Paramount Elite Medicare Plans ,"PARAMOUNT CARE, INC. ",MEDICAL MUTUAL OF OHIO ,14%,22%,27%,Not Available ,12%
H3655 ,Anthem Blue Cross and Blue Shield ,COMMUNITY INSURANCE COMPANY ,"Elevance Health, Inc. ",16%,19%,17%,Not Available ,14%
H3660 ,SummaCare Medicare Advantage Plans ,SUMMACARE INC. ,Summa Health ,14%,15%,25%,Not Available ,9%
H3664 ,PrimeTime Health Plan ,AULTCARE HEALTH INSURING CORPORATION ,Aultman Health Foundation ,Not Available ,Not Available ,Not Available ,Not Available ,Not Available
H3668 ,MediGold ,"MOUNT CARMEL HEALTH PLAN, INC. ",Trinity Health Corporation ,12%,25%,16%,8%,7%
H3672 ,The Health Plan ,"THE HEALTH PLAN OF WEST VIRGINIA, INC. ","The Health Plan of West Virginia, Inc. ",15%,21%,16%,9%,7%
H3706 ,GlobalHealth ,"GLOBALHEALTH, INC. ","MHH Healthcare, L.P. ",28%,32%,17%,Not Available ,15%
H3708 ,American Health Advantage of Oklahoma ,"OKLAHOMA SUPERIOR SELECT, INC. ",Mitchell Family Office ,Not Available ,Not Available ,Not Available ,Not Available ,Not Available
H3727 ,Communicare Advantage ,OH CHS SNP INC. ,"SNP Holdings, LLC ",Not Available ,Not Available ,Not Available ,Not Available ,Not Available
H3748 ,Aetna Medicare ,"AETNA BETTER HEALTH OF WASHINGTON, INC. ",CVS Health Corporation ,9%,12%,16%,6%,7%
H3755 ,CommunityCare Senior Health Plan (HMO) ,"COMMUNITYCARE GOVERNMENT PROGRAMS, INC. ",St Francis Health System & St John Health System ,11%,25%,16%,8%,7%
H3777 ,Experience Health ,BLUE CROSS AND BLUE SHIELD OF NORTH CAROLINA ,Blue Cross and Blue Shield of North Carolina ,Not Available ,Not Available ,Not Available ,Not Available ,Not Available
H3794 ,UnitedHealthcare ,"UNITEDHEALTHCARE OF WISCONSIN, INC. ","UnitedHealth Group, Inc. ",Not Available ,Not Available ,Not Available ,Not Available ,Not Available
H3800 ,Provider Partners Health Plans ,PROVIDER PARTNERS HEALTH PLAN OF ILLINOIS ,"Rifkin Managed Care Holding, LLC ",Not Available ,Not Available ,Not Available ,Not Available ,Not Available
H3805 ,UnitedHealthcare ,"UnitedHealthcare Benefits of Texas, Inc. ","UnitedHealth Group, Inc. ",14%,22%,20%,8%,9%
H3810 ,AllCare Advantage ,"ALLCARE HEALTH PLAN, INC. ","AllCare Health, Inc. ",Not Available ,Not Available ,Not Available ,Not Available ,Not Available
H3811 ,Samaritan Advantage Health Plans ,"SAMARITAN HEALTH PLANS, INC. ",Samaritan Health Services ,Not Available ,Not Available ,Not Available ,Not Available ,Not Available
H3814 ,ATRIO Health Plans ,ATRIO HEALTH PLANS ,ATRIO Health Plans ,Not Available ,Not Available ,Not Available ,Not Available ,Not Available
H3815 ,Alignment Health Plan ,ALIGNMENT HEALTH PLAN ,"Alignment Healthcare USA, LLC ",18%,39%,13%,Not Available ,16%
H3817 ,Regence BlueCross BlueShield of Oregon ,REGENCE BLUECROSS BLUESHIELD OF OREGON ,"Cambia Health Solutions, Inc. ",12%,34%,22%,Not Available ,5%
H3822 ,"Blue Cross and Blue Shield of IL, NM ",HEALTH CARE SERVICE CORPORATION ,Health Care Service Corporation ,18%,26%,19%,Not Available ,13%
H3828 ,Saint Alphonsus Health Plan ,"MOUNT CARMEL HEALTH PLAN OF IDAHO, INC. ",Trinity Health Corporation ,Not Available ,Not Available ,Not Available ,Not Available ,Not Available
H3832 ,HMSA Akamai Advantage ,HAWAII MEDICAL SERVICE ASSOCIATION ,Hawaii Medical Service Association ,16%,10%,41%,Not Available ,10%
H3864 ,PacificSource Medicare ,PACIFICSOURCE COMMUNITY HEALTH PLANS ,PacificSource ,11%,6%,16%,5%,Not Available
H3890 ,Johns Hopkins Advantage MD ,"HOPKINS HEALTH ADVANTAGE, INC. ",Johns Hopkins Healthcare LLC ,18%,22%,33%,Not Available ,10%
H3907 ,UPMC for Life ,"UPMC HEALTH PLAN, INC. ",UPMC Health System ,5%,9%,24%,4%,6%
H3909 ,Independence Blue Cross ,QCC INSURANCE COMPANY ,"Independence Health Group, Inc. ",16%,11%,21%,Not Available ,11%
H3916 ,Highmark Blue Cross Blue Shield or Highmark Blue S ,HIGHMARK SENIOR HEALTH COMPANY ,Highmark Health ,19%,12%,24%,Not Available ,11%
H3923 ,Capital Blue Cross ,CAPITAL ADVANTAGE INSURANCE COMPANY ,CAPITAL BLUE CROSS ,11%,9%,31%,Not Available ,10%
H3924 ,Geisinger Gold ,GEISINGER INDEMNITY INSURANCE COMPANY ,"Risant Health, Inc. ",7%,8%,23%,3%,3%
H3928 ,Aetna Medicare ,AETNA HEALTH INC. (LA) ,CVS Health Corporation ,Not Available ,Not Available ,Not Available ,Not Available ,Not Available
H3931 ,Aetna Medicare ,AETNA HEALTH INC. (PA) ,CVS Health Corporation ,20%,26%,22%,10%,13%
H3949 ,Cigna Healthcare ,"BRAVO HEALTH PENNSYLVANIA, INC. ",The Cigna Group ,13%,29%,11%,Not Available ,11%
H3952 ,Independence Blue Cross ,"KEYSTONE HEALTH PLAN EAST, INC. ","Independence Health Group, Inc. ",14%,17%,23%,7%,7%
H3954 ,Geisinger Gold ,GEISINGER HEALTH PLAN ,"Risant Health, Inc. ",7%,12%,13%,5%,5%
H3957 ,Highmark Blue Cross Blue Shield or Highmark Blue S ,HIGHMARK CHOICE COMPANY ,Highmark Health ,11%,19%,22%,6%,6%
H3959 ,Aetna Medicare ,AETNA HEALTH INC. (PA) ,CVS Health Corporation ,16%,20%,23%,Not Available ,17%
H3962 ,Capital Blue Cross ,"KEYSTONE HEALTH PLAN CENTRAL, INC. ",CAPITAL BLUE CROSS ,13%,19%,20%,8%,6%
H3975 ,Wellcare ,"WELLCARE HEALTH INSURANCE COMPANY OF KENTUCKY, INC ",Centene Corporation ,13%,30%,14%,8%,13%
H3979 ,Blue Cross and Blue Shield of Oklahoma ,"GHS HEALTH MAINTENANCE ORGANIZATION, INC. ",Health Care Service Corporation ,Not Available ,Not Available ,Not Available ,Not Available ,Not Available
H4003 ,Medicare y Mucho Mas ,"MMM HEALTHCARE, LLC ","Elevance Health, Inc. ",7%,18%,11%,4%,7%
H4004 ,PMC Medicare Choice ,"MMM HEALTHCARE, LLC ","Elevance Health, Inc. ",13%,22%,13%,9%,10%
H4005 ,Triple-S Advantage ,"TRIPLE S ADVANTAGE, INC. ",Guidewell Mutual Holding Corporation ,Not Available ,Not Available ,Not Available ,Not Available ,Not Available
H4007 ,Humana ,"HUMANA HEALTH PLANS OF PUERTO RICO, INC. ",Humana Inc. ,17%,28%,8%,Not Available ,16%
H4036 ,Anthem Blue Cross and Blue Shield ,"ANTHEM INSURANCE COMPANIES, INC. ","Elevance Health, Inc. ",11%,12%,25%,7%,9%
H4045 ,Santa Clara Family Health Plan ,SANTA CLARA COUNTY HEALTH AUTHORITY ,SANTA CLARA COUNTY HEALTH AUTHORITY ,Not Available ,Not Available ,Not Available ,Not Available ,Not Available
H4054 ,Provider Partners Health Plans ,"PROVIDER PARTNERS HEALTH PLAN OF TEXAS, INC. ","Rifkin Managed Care Holding, LLC ",Not Available ,Not Available ,Not Available ,Not Available ,Not Available
H4073 ,Wellcare ,"WELLCARE HEALTH INSURANCE OF NORTH CAROLINA, INC. ",Centene Corporation ,Not Available ,29%,Not Available ,Not Available ,27%
H4091 ,Simpra Advantage ,"SIMPRA ADVANTAGE, INC. ","Associated Care Ventures, Inc. ",Not Available ,Not Available ,Not Available ,Not Available ,Not Available
H4093 ,Provider Partners Health Plans ,"PROVIDER PARTNERS HEALTH PLAN OF PENNSYLVANIA, INC ","Rifkin Managed Care Holding, LLC ",Not Available ,Not Available ,Not Available ,Not Available ,Not Available
H4140 ,"Doctors HealthCare Plans, Inc. ","DOCTORS HEALTHCARE PLANS, INC. ","DOCTORS HEALTHCARE PLANS, INC. ",Not Available ,Not Available ,Not Available ,Not Available ,Not Available
H4141 ,Humana ,"HUMANA EMPLOYERS HEALTH PLAN OF GEORGIA, INC. ",Humana Inc. ,17%,17%,8%,Not Available ,8%
H4152 ,Blue Cross & Blue Shield of Rhode Island ,BLUE CROSS & BLUE SHIELD OF RHODE ISLAND ,Blue Cross & Blue Shield of Rhode Island ,13%,15%,16%,10%,10%
H4161 ,Anthem Blue Cross Partnership Plan ,"BLUE CROSS OF CALIFORNIA PARTNERSHIP PLAN, INC. ","Elevance Health, Inc. ",Not Available ,Not Available ,Not Available ,Not Available ,Not Available
H4172 ,NHC Advantage ,"NHC ADVANTAGE, LLC ","Missouri Healthcare Advisors, LLC ",Not Available ,Not Available ,Not Available ,Not Available ,Not Available
H4213 ,Arkansas Blue Medicare ,USABLE MUTUAL INSURANCE COMPANY ,USAble Mutual Insurance Company ,Not Available ,Not Available ,Not Available ,Not Available ,Not Available
H4227 ,VISTA Health Plan Inc. ,"VISTA HEALTH PLAN, INC. ","Independence Health Group, Inc. ",16%,36%,18%,Not Available ,15%
H4232 ,American Health Advantage of Utah ,"AMERICAN HEALTH PLAN OF UT, INC. ",Mitchell Family Office ,Not Available ,Not Available ,Not Available ,Not Available ,Not Available
H4279 ,UPMC for Life Complete Care ,"UPMC FOR YOU, INC ",UPMC Health System ,10%,17%,7%,6%,8%
H4286 ,"Leon Health, Inc. ","LEON HEALTH, INC. ","LMC Family Holdings, LLC ",Not Available ,Not Available ,Not Available ,Not Available ,Not Available
H4346 ,Anthem Blue Cross and Blue Shield ,"HMO COLORADO, INC. ","Elevance Health, Inc. ",28%,45%,9%,Not Available ,16%
H4407 ,Cigna Healthcare ,"HEALTHSPRING LIFE & HEALTH INSURANCE COMPANY, INC. ",The Cigna Group ,21%,28%,15%,14%,15%
H4439 ,Provider Partners Health Plans ,PROVIDER PARTNERS HEALTH PLAN OF NORTH CAROLINA ,"Rifkin Managed Care Holding, LLC ",Plan too new to be measured ,Plan too new to be measured ,Plan too new to be measured ,Plan too new to be measured ,Plan too new to be measured
H4444 ,Provider Partners Health Plan of Indiana ,PROVIDER PARTNERS HEALTH PLAN OF INDIANA ,"Rifkin Managed Care Holding, LLC ",Plan too new to be measured ,Plan too new to be measured ,Plan too new to be measured ,Plan too new to be measured ,Plan too new to be measured
H4461 ,Humana ,CARITEN HEALTH PLAN INC. ,Humana Inc. ,20%,42%,14%,Not Available ,9%
H4471 ,Anthem Blue Cross ,"BLUE CROSS OF CALIFORNIA PARTNERSHIP PLAN, INC. ","Elevance Health, Inc. ",Plan too new to be measured ,Plan too new to be measured ,Plan too new to be measured ,Plan too new to be measured ,Plan too new to be measured
H4490 ,American Health Advantage of Missouri ,"AMERICAN HEALTH PLAN OF MISSOURI, INC. ",Mitchell Family Office ,Not Available ,Not Available ,Not Available ,Not Available ,Not Available
H4497 ,Medical Mutual of Ohio ,MEDICAL MUTUAL OF OHIO ,MEDICAL MUTUAL OF OHIO ,11%,17%,32%,7%,6%
H4499 ,Sentara Medicare ,SENTARA HEALTH PLANS ,Sentara Health Care (SHC) ,Plan too new to be measured ,Plan too new to be measured ,Plan too new to be measured ,Plan too new to be measured ,Plan too new to be measured
H4506 ,Wellcare ,"SELECTCARE OF TEXAS, INC. ",Centene Corporation ,22%,20%,10%,8%,15%
H4513 ,Cigna Healthcare ,"HEALTHSPRING LIFE & HEALTH INSURANCE COMPANY, INC. ",The Cigna Group ,27%,29%,13%,Not Available ,15%
H4514 ,UnitedHealthcare ,"UNITEDHEALTHCARE COMMUNITY PLAN OF TEXAS, L.L.C. ","UnitedHealth Group, Inc. ",Not Available ,Not Available ,Not Available ,Not Available ,Not Available
H4523 ,Aetna Medicare ,AETNA HEALTH INC. (TX) ,CVS Health Corporation ,18%,30%,16%,11%,10%
H4527 ,UnitedHealthcare ,"PHYSICIANS HEALTH CHOICE OF TEXAS, LLC ","UnitedHealth Group, Inc. ",12%,16%,18%,Not Available ,10%
H4537 ,Wellcare ,"WELLCARE HEALTH INSURANCE COMPANY OF OKLAHOMA, INC ",Centene Corporation ,Not Available ,Not Available ,Not Available ,Not Available ,Not Available
H4544 ,Peoples Health ,"PEOPLES HEALTH, INC. ","UnitedHealth Group, Inc. ",16%,36%,11%,4%,11%
H4604 ,UnitedHealthcare ,"UNITEDHEALTHCARE OF THE ROCKIES, INC. ","UnitedHealth Group, Inc. ",19%,13%,16%,7%,14%
H4605 ,Regence BlueCross BlueShield of Utah ,REGENCE BLUECROSS BLUESHIELD OF UTAH ,"Cambia Health Solutions, Inc. ",Not Available ,Not Available ,Not Available ,Not Available ,Not Available
H4618 ,"Sonder Health Plans, Inc. ","SONDER HEALTH PLANS, INC. ","Avian Health Holdings, LLC ",Plan too new to be measured ,Plan too new to be measured ,Plan too new to be measured ,Plan too new to be measured ,Plan too new to be measured
H4620 ,Essence Healthcare ,"ESSENCE HEALTHCARE OF OHIO, INC. ",Lumeris Group Holdings Corporation ,Not Available ,Not Available ,Not Available ,Not Available ,Not Available
H4623 ,Humana ,"HUMANA REGIONAL HEALTH PLAN, INC. ",Humana Inc. ,5%,12%,6%,4%,6%
H4624 ,Zing Health ,"ZING HEALTH OF MICHIGAN, INC. ","Zing Health Consolidator, Inc ",Not Available ,Not Available ,Not Available ,Not Available ,Not Available
H4647 ,UCLA Health Medicare Advantage Plan ,"NEW CENTURY HEALTH PLAN, INC. ",The Regents of the University of California ,Plan too new to be measured ,Plan too new to be measured ,Plan too new to be measured ,Plan too new to be measured ,Plan too new to be measured
H4661 ,Wellcare ,CELTIC INSURANCE COMPANY ,Centene Corporation ,Plan too new to be measured ,Plan too new to be measured ,Plan too new to be measured ,Plan too new to be measured ,Plan too new to be measured
H4676 ,Troy Medicare ,"TROY HEALTH, INC. ","Troy Holdings, Inc. ",Not Available ,Not Available ,Not Available ,Not Available ,Not Available
H4694 ,Anthem HealthKeepers ,"HEALTHKEEPERS, INC. ","Elevance Health, Inc. ",Plan too new to be measured ,Plan too new to be measured ,Plan too new to be measured ,Plan too new to be measured ,Plan too new to be measured
H4704 ,Anthem Blue Cross Life and Health Insurance Compan ,ANTHEM BLUE CROSS LIFE AND HEALTH INS COMPANY ,"Elevance Health, Inc. ",Plan too new to be measured ,Plan too new to be measured ,Plan too new to be measured ,Plan too new to be measured ,Plan too new to be measured
H4711 ,Aetna Medicare ,"COVENTRY HEALTH CARE OF NEBRASKA, INC. ",CVS Health Corporation ,Not Available ,Not Available ,Not Available ,Not Available ,Not Available
