CONTRACT_ID,Organization Marketing Name,Contract Name,Parent Organization,Problems Getting the Plan to Provide and Pay for Needed Care,Problems with Coverage of Doctors and Hospitals,Financial Reasons for Disenrollment,Problems with Prescription Drug Benefits and Coverage,Problems Getting Information and Help from the Plan
E3014 ,Pennsylvania Public School Employees Retirement Sy ,PSERS HOP PROGRAM ,Commonwealth of PA Pub Schools Retirement System ,Not Applicable ,Not Applicable ,Not Available ,Not Available ,Not Available
H0028 ,Humana ,"CHA HMO, INC. ",Humana Inc. ,15%,26%,10%,10%,14%
H0029 ,Allwell ,"COORDINATED CARE OF WASHINGTON, INC. ",Centene Corporation ,Not Available ,Not Available ,Not Available ,Not Available ,Not Available
H0034 ,"Hamaspik, Inc. ","HAMASPIK, INC. ","Hamaspik of Rockland County, Inc. ",Not Available ,Not Available ,Not Available ,Not Available ,Not Available
H0062 ,Wellcare by Allwell ,"SUPERIOR HEALTHPLAN, INC. ",Centene Corporation ,Not Available ,Not Available ,Not Available ,Not Available ,Not Available
H0074 ,Wellcare ,"WELLCARE OF MISSISSIPPI, INC. ",Centene Corporation ,Not Available ,Not Available ,Not Available ,Not Available ,Not Available
H0104 ,Blue Cross and Blue Shield of Alabama ,BLUE CROSS AND BLUE SHIELD OF ALABAMA ,BlueCross BlueShield of Alabama ,9%,6%,20%,Not Available ,8%
H0107 ,Blue Cross and Blue Shield of Montana ,HEALTH CARE SERVICE CORPORATION ,Health Care Service Corporation ,20%,13%,35%,12%,13%
H0111 ,Wellcare ,"WELLCARE OF GEORGIA, INC. ",Centene Corporation ,23%,26%,17%,15%,14%
H0154 ,VIVA Medicare ,"VIVA HEALTH, INC. ","Triton Health Systems, L.L.C. ",8%,9%,10%,4%,6%
H0169 ,UnitedHealthcare ,"UNITEDHEALTHCARE OF WISCONSIN, INC. ","UnitedHealth Group, Inc. ",11%,16%,5%,4%,6%
H0174 ,Wellcare ,"WELLCARE OF TEXAS, INC. ",Centene Corporation ,24%,31%,22%,16%,20%
H0251 ,UnitedHealthcare ,"UNITEDHEALTHCARE PLAN OF THE RIVER VALLEY, INC. ","UnitedHealth Group, Inc. ",7%,14%,8%,0%,4%
H0270 ,Wellcare ,WELLCARE HEALTH INSURANCE COMPANY OF AMERICA ,Centene Corporation ,22%,24%,25%,6%,13%
H0292 ,Humana ,"HUMANA HEALTH PLAN OF OHIO, INC. ",Humana Inc. ,14%,10%,21%,Not Available ,10%
H0294 ,UnitedHealthcare ,UNITEDHEALTHCARE INSURANCE COMPANY ,"UnitedHealth Group, Inc. ",13%,16%,23%,Not Available ,10%
H0302 ,Blue Cross Blue Shield of Arizona (AZ Blue) ,"MEDISUN, INC. ",Blue Cross Blue Shield of Arizona ,16%,26%,19%,6%,9%
H0321 ,UnitedHealthcare ,"ARIZONA PHYSICIANS IPA, INC. ","UnitedHealth Group, Inc. ",Not Available ,Not Available ,Not Available ,Not Available ,Not Available
H0332 ,KelseyCare Advantage ,"KS PLAN ADMINISTRATORS, LLC ","UnitedHealth Group, Inc. ",18%,28%,10%,8%,17%
H0342 ,CarePartners of Connecticut ,"CAREPARTNERS OF CONNECTICUT, INC. ","Point32Health, Inc. ",Not Available ,Not Available ,Not Available ,Not Available ,Not Available
H0351 ,Wellcare by Allwell ,"HEALTH NET OF ARIZONA, INC. ",Centene Corporation ,20%,20%,25%,Not Available ,24%
H0354 ,Cigna Healthcare ,"CIGNA HEALTHCARE OF ARIZONA, INC. ",The Cigna Group ,22%,24%,13%,11%,15%
H0363 ,Longevity Health Plan ,"LONGEVITY HEALTH PLAN OF COLORADO, INC. ","Longevity Health Founders, LLC ",Not Available ,Not Available ,Not Available ,Not Available ,Not Available
H0421 ,UnitedHealthcare ,CARE IMPROVEMENT PLUS SOUTH CENTRAL INSURANCE CO. ,"UnitedHealth Group, Inc. ",Plan too new to be measured ,Plan too new to be measured ,Plan too new to be measured ,Plan too new to be measured ,Plan too new to be measured
H0423 ,MetroPlus Health Plan ,"METROPLUS HEALTH PLAN, INC. ",New York City Health and Hospitals Corporation ,Not Available ,Not Available ,Not Available ,Not Available ,Not Available
H0432 ,UnitedHealthcare ,"UNITEDHEALTHCARE OF THE MIDLANDS, INC. ","UnitedHealth Group, Inc. ",17%,23%,12%,Not Available ,9%
H0439 ,Cigna Healthcare ,"CIGNA HEALTHCARE OF GEORGIA, INC. ",The Cigna Group ,11%,9%,18%,Not Available ,10%
H0473 ,Humana ,HUMANA INSURANCE COMPANY OF KENTUCKY ,Humana Inc. ,11%,31%,19%,Not Available ,10%
H0504 ,Blue Shield of California ,CALIFORNIA PHYSICIANS' SERVICE ,California Physicians' Service ,12%,30%,17%,6%,7%
H0523 ,Aetna Medicare ,AETNA HEALTH OF CALIFORNIA INC. ,CVS Health Corporation ,Not Available ,Not Available ,Not Available ,Not Available ,Not Available
H0524 ,Kaiser Permanente ,"KAISER FOUNDATION HP, INC. ","Kaiser Foundation Health Plan, Inc. ",25%,24%,14%,7%,17%
H0543 ,UnitedHealthcare ,UHC OF CALIFORNIA ,"UnitedHealth Group, Inc. ",18%,51%,10%,8%,16%
H0544 ,Anthem Blue Cross ,BLUE CROSS OF CALIFORNIA ,"Elevance Health, Inc. ",22%,38%,10%,Not Available ,15%
H0562 ,Wellcare by Health Net ,"HEALTH NET OF CALIFORNIA, INC. ",Centene Corporation ,15%,35%,18%,Not Available ,16%
H0571 ,CCHP (Chinese Community Health Plan) ,CHINESE COMMUNITY HEALTH PLAN ,Chinese Hospital Association ,Not Available ,Not Available ,Not Available ,Not Available ,Not Available
H0609 ,UnitedHealthcare ,"UnitedHealthcare Benefits of Texas, Inc. ","UnitedHealth Group, Inc. ",18%,22%,16%,9%,14%
H0624 ,UnitedHealthcare ,"UnitedHealthcare Benefits of Texas, Inc. ","UnitedHealth Group, Inc. ",Not Available ,Not Available ,Not Available ,Not Available ,Not Available
H0628 ,Aetna Medicare ,AETNA HEALTH OF OHIO INC. ,CVS Health Corporation ,13%,11%,19%,Not Available ,11%
H0630 ,Kaiser Permanente ,KAISER FOUNDATION HP OF CO ,"Kaiser Foundation Health Plan, Inc. ",17%,23%,16%,5%,14%
H0672 ,Cigna Healthcare ,"CIGNA HEALTHCARE OF COLORADO, INC. ",The Cigna Group ,31%,33%,13%,Not Available ,19%
H0710 ,UnitedHealthcare ,CARE IMPROVEMENT PLUS SOUTH CENTRAL INSURANCE CO. ,"UnitedHealth Group, Inc. ",Not Available ,Not Available ,Not Available ,Not Available ,Not Available
H0712 ,Wellcare ,"WELLCARE OF CONNECTICUT, INC. ",Centene Corporation ,Not Available ,Not Available ,Not Available ,Not Available ,Not Available
H0724 ,Wellcare by Allwell ,"BUCKEYE HEALTH PLAN COMMUNITY SOLUTIONS, Inc. ",Centene Corporation ,19%,17%,15%,Not Available ,13%
H0738 ,AmeriHealth Caritas VIP Care (HMO-D-SNP) ,"AmeriHealth Caritas VIP Next, Inc. ","Independence Health Group, Inc. ",Not Available ,Not Available ,Not Available ,Not Available ,Not Available
H0755 ,UnitedHealthcare ,CARE IMPROVEMENT PLUS SOUTH CENTRAL INSURANCE CO. ,"UnitedHealth Group, Inc. ",12%,17%,21%,8%,9%
H0764 ,UnitedHealthcare ,"UNITEDHEALTHCARE OF NEW ENGLAND, INC. ","UnitedHealth Group, Inc. ",Not Available ,Not Available ,Not Available ,Not Available ,Not Available
H0783 ,Humana ,"HUMANA BENEFIT PLAN OF TEXAS, INC. ",Humana Inc. ,Not Available ,Not Available ,Not Available ,Not Available ,Not Available
H0845 ,UnitedHealthcare ,"UNITEDHEALTHCARE OF ILLINOIS, INC. ","UnitedHealth Group, Inc. ",Plan too new to be measured ,Plan too new to be measured ,Plan too new to be measured ,Plan too new to be measured ,Plan too new to be measured
H0885 ,Braven Health ,HEALTHIER NEW JERSEY INSURANCE COMPANY ,"Horizon Mutual Holdings, Inc ",20%,19%,23%,18%,15%
H0907 ,Wellpoint ,"WELLPOINT IOWA, INC. ","Elevance Health, Inc. ",30%,41%,13%,Not Available ,14%
H0908 ,Wellcare by Allwell ,"BUCKEYE COMMUNITY HEALTH PLAN, INC. ",Centene Corporation ,21%,30%,18%,Not Available ,21%
H0913 ,Wellcare ,"WELLCARE HEALTH PLANS OF NEW JERSEY, INC. ",Centene Corporation ,Not Available ,Not Available ,Not Available ,Not Available ,Not Available
H0976 ,SCAN Health Plan ,SCAN HEALTH PLAN ,SCAN Group ,Plan too new to be measured ,Plan too new to be measured ,Plan too new to be measured ,Plan too new to be measured ,Plan too new to be measured
H0978 ,SCAN Health Plan ,"SCAN HEALTH PLAN NEVADA, INC. ",SCAN Group ,Not Available ,Not Available ,Not Available ,Not Available ,Not Available
H0982 ,Solis Health Plans ,"SOLIS HEALTH PLANS, INC. ","Athena Healthcare Holdings, LLC ",Not Available ,Not Available ,Not Available ,Not Available ,Not Available
H1016 ,AvMed Medicare ,"AVMED, INC. ",Sentara Health Care (SHC) ,Not Available ,Not Available ,Not Available ,Not Available ,Not Available
H1019 ,"CarePlus Health Plans, Inc. ","CAREPLUS HEALTH PLANS, INC. ",Humana Inc. ,19%,24%,9%,7%,10%
H1032 ,Wellcare ,"Sunshine State Health Plan, Inc. ",Centene Corporation ,13%,18%,14%,7%,16%
H1035 ,Florida Blue HMO ,"FLORIDA BLUE MEDICARE, INC. ",Guidewell Mutual Holding Corporation ,21%,24%,9%,Not Available ,12%
H1036 ,Humana ,"HUMANA MEDICAL PLAN, INC. ",Humana Inc. ,18%,34%,6%,10%,11%
H1045 ,UnitedHealthcare ,"PREFERRED CARE PARTNERS, INC. ","UnitedHealth Group, Inc. ",12%,17%,20%,9%,12%
H1099 ,"Health First Health Plans, Inc. ",HEALTH FIRST HEALTH PLANS ,"Health First Shared Services, Inc. ",18%,29%,24%,Not Available ,16%
H1109 ,Aetna Medicare ,AETNA HEALTH INC.(GA) ,CVS Health Corporation ,Not Available ,Not Available ,Not Available ,Not Available ,Not Available
H1112 ,Wellcare ,"WELLCARE OF GEORGIA, INC. ",Centene Corporation ,16%,22%,19%,Not Available ,17%
H1119 ,Valor Health Plan ,"TSG GUARD, INC. ","The Schroer Group, Inc. ",Not Available ,Not Available ,Not Available ,Not Available ,Not Available
H1170 ,Kaiser Permanente ,"KAISER FOUNDATION HP OF GA, INC. ","Kaiser Foundation Health Plan, Inc. ",26%,27%,14%,Not Available ,13%
H1181 ,Network Health Medicare Advantage Plans ,NETWORK HEALTH INSURANCE CORPORATION ,"Network Health, Inc. ",Not Available ,Not Available ,Not Available ,Not Available ,Not Available
H1189 ,CHRISTUS Health Advantage ,CHRISTUS HEALTH PLAN ,CHRISTUS Health ,23%,40%,18%,Not Available ,12%
H1206 ,Aetna Medicare ,"COVENTRY HEALTH CARE OF ILLINOIS, INC. ",CVS Health Corporation ,Plan too new to be measured ,Plan too new to be measured ,Plan too new to be measured ,Plan too new to be measured ,Plan too new to be measured
H1215 ,Wellcare ,"NEBRASKA TOTAL CARE, INC. ",Centene Corporation ,21%,23%,17%,Not Available ,17%
H1224 ,L.A. Care Health Plan ,LOCAL INITIATIVE HEALTH AUTHORITY FOR LA COUNTY ,Local Initiative Health Authority for LA County ,Not Available ,Not Available ,Not Available ,Not Available ,Not Available
H1225 ,Johns Hopkins Advantage MD ,"HOPKINS HEALTH ADVANTAGE, INC. ",Johns Hopkins Healthcare LLC ,28%,27%,28%,Not Available ,14%
H1230 ,Kaiser Permanente ,"KAISER FOUNDATION HP, INC. ","Kaiser Foundation Health Plan, Inc. ",16%,18%,41%,Not Available ,10%
H1248 ,Blue Cross and Blue Shield of Louisiana ,LOUISIANA HEALTH SERVICE & INDEMNITY COMPANY ,Louisiana Health Service & Indemnity Company ,Not Available ,Not Available ,Not Available ,Not Available ,Not Available
H1277 ,Align Senior Care ,"ALIGN SENIOR CARE, INC. ","Curana Health Holdings, LLC ",Not Available ,Not Available ,Not Available ,Not Available ,Not Available
H1278 ,UnitedHealthcare ,CARE IMPROVEMENT PLUS SOUTH CENTRAL INSURANCE CO. ,"UnitedHealth Group, Inc. ",9%,11%,24%,8%,8%
H1280 ,eternalHealth ,"ETERNALHEALTH, INC. ","Eternal Health of Delaware, Inc. ",Not Available ,Not Available ,Not Available ,Not Available ,Not Available
H1285 ,UnitedHealthcare Community Plan ,"UNITEDHEALTHCARE COMMUNITY PLAN OF OHIO, INC. ","UnitedHealth Group, Inc. ",Plan too new to be measured ,Plan too new to be measured ,Plan too new to be measured ,Plan too new to be measured ,Plan too new to be measured
H1290 ,Devoted Health ,"DEVOTED HEALTH PLAN OF FLORIDA, INC. ","Devoted Health, Inc. ",Not Available ,36%,13%,Not Available ,13%
H1302 ,Blue Cross of Idaho ,"BLUE CROSS OF IDAHO CARE PLUS, INC. ","Gemstone Holdings, Inc. ",Not Available ,Not Available ,Not Available ,Not Available ,Not Available
H1304 ,Regence BlueShield of Idaho ,"REGENCE BLUESHIELD OF IDAHO, INC. ","Cambia Health Solutions, Inc. ",9%,9%,28%,Not Available ,6%
H1339 ,Johns Hopkins Advantage MD ,"JOHNS HOPKINS HEALTH PLAN OF VIRGINIA, INC. ",Johns Hopkins Healthcare LLC ,Plan too new to be measured ,Plan too new to be measured ,Plan too new to be measured ,Plan too new to be measured ,Plan too new to be measured
H1347 ,Patrius Health ,"PATRIUS HEALTH, INC. ",BlueCross BlueShield of Alabama ,Not Available ,Not Available ,Not Available ,Not Available ,Not Available
H1350 ,Blue Cross of Idaho ,"BLUE CROSS OF IDAHO CARE PLUS, INC. ","Gemstone Holdings, Inc. ",4%,19%,27%,5%,6%
H1360 ,UnitedHealthcare ,"UnitedHealthcare Benefits of Texas, Inc. ","UnitedHealth Group, Inc. ",Not Available ,Not Available ,Not Available ,Not Available ,Not Available
H1365 ,Martin's Point Generations Advantage ,"MARTIN'S POINT GENERATIONS ADVANTAGE, INC. ","Martin's Point Health Care, Inc. ",Not Available ,Not Available ,Not Available ,Not Available ,Not Available
H1372 ,AgeRight Advantage ,"MARQUIS ADVANTAGE, INC. ","Marquis Companies I, Inc. ",Not Available ,Not Available ,Not Available ,Not Available ,Not Available
H1395 ,Wellcare ,"NEBRASKA TOTAL CARE, INC. ",Centene Corporation ,20%,17%,21%,Not Available ,11%
H1416 ,Wellcare ,"HARMONY HEALTH PLAN,  INC. ",Centene Corporation ,20%,25%,21%,Not Available ,17%
H1423 ,Wellpoint ,"WELLPOINT OHIO, INC. ","Elevance Health, Inc. ",31%,38%,15%,8%,16%
H1463 ,Health Alliance Medicare ,"HEALTH ALLIANCE CONNECT, INC. ",The Carle Foundation ,28%,39%,32%,Not Available ,11%
H1468 ,Humana ,"HUMANA BENEFIT PLAN OF ILLINOIS, INC. ",Humana Inc. ,17%,35%,15%,Not Available ,12%
H1526 ,Gold Kidney Health Plan ,GOLD KIDNEY OF FLORIDA INC ,Gold Kidney Health Plan ,Plan too new to be measured ,Plan too new to be measured ,Plan too new to be measured ,Plan too new to be measured ,Plan too new to be measured
H1537 ,UnitedHealthcare ,CARE IMPROVEMENT PLUS SOUTH CENTRAL INSURANCE CO. ,"UnitedHealth Group, Inc. ",Not Available ,Not Available ,Not Available ,Not Available ,Not Available
H1587 ,Tribute Health Plans ,"ARKANSAS SUPERIOR SELECT, INC. ","Select Founders, LLC ",Not Available ,Not Available ,Not Available ,Not Available ,Not Available
H1607 ,Anthem Blue Cross and Blue Shield ,"ANTHEM INSURANCE COMPANIES, INC. ","Elevance Health, Inc. ",12%,10%,30%,Not Available ,12%
H1608 ,Aetna Medicare ,COVENTRY HEALTH AND LIFE INSURANCE COMPANY ,CVS Health Corporation ,15%,11%,16%,Not Available ,10%
H1609 ,Aetna Medicare ,AETNA HEALTH INC. (FL) ,CVS Health Corporation ,25%,26%,16%,Not Available ,16%
H1610 ,Aetna Better Health of Virginia ,"COVENTRY HEALTH CARE OF VIRGINIA, INC. ",CVS Health Corporation ,20%,22%,8%,Not Available ,14%
H1619 ,Jefferson Health Plans ,PARTNERS INSURANCE COMPANY INC ,Thomas Jefferson University ,Plan too new to be measured ,Plan too new to be measured ,Plan too new to be measured ,Plan too new to be measured ,Plan too new to be measured
H1644 ,Longevity Health Plan ,"LONGEVITY HEALTH PLAN OF FLORIDA, INC. ","Longevity Health Founders, LLC ",Not Available ,Not Available ,Not Available ,Not Available ,Not Available
H1651 ,"Medical Associates Health Plan, Inc. ","MEDICAL ASSOCIATES HEALTH PLAN, INC. ","Medical Associates Clinic, P.C. ",Not Available ,Not Available ,Not Available ,Not Available ,Not Available
H1659 ,UnitedHealthcare ,CARE IMPROVEMENT PLUS SOUTH CENTRAL INSURANCE CO. ,"UnitedHealth Group, Inc. ",Not Available ,Not Available ,Not Available ,Not Available ,Not Available
H1664 ,Wellcare by Allwell ,"HOME STATE HEALTH PLAN, INC. ",Centene Corporation ,31%,26%,16%,10%,20%
H1666 ,"Blue Cross and Blue Shield of NM, TX ",HCSC INSURANCE SERVICES COMPANY ,Health Care Service Corporation ,27%,22%,33%,18%,21%
H1692 ,Aetna Medicare ,"COVENTRY HEALTH CARE OF WEST VIRGINIA, INC. ",CVS Health Corporation ,14%,19%,25%,Not Available ,12%
H1722 ,Healthfirst Medicare Plan ,"HEALTHFIRST HEALTH PLAN, INC. ","Healthfirst, Inc. ",Not Available ,Not Available ,Not Available ,Not Available ,Not Available
H1737 ,Health Alliance Medicare ,"HEALTH ALLIANCE - MIDWEST, INC. ",The Carle Foundation ,Not Available ,Not Available ,Not Available ,Not Available ,Not Available
H1748 ,"Sonder Health Plans, Inc. ","SONDER HEALTH PLANS, INC. ","Avian Health Holdings, LLC ",Not Available ,Not Available ,Not Available ,Not Available ,Not Available
H1774 ,Wellcare by Allwell ,"CENTENE VENTURE COMPANY INDIANA, INC. ",Centene Corporation ,Not Available ,Not Available ,Not Available ,Not Available ,Not Available
H1787 ,Great Plains Medicare Advantage ,SANFORD HEALTH PLAN ,Sanford Health ,Not Available ,Not Available ,Not Available ,Not Available ,Not Available
H1799 ,Passport Advantage ,"MOLINA HEALTHCARE OF KENTUCKY, INC. ","Molina Healthcare, Inc. ",Not Available ,Not Available ,Not Available ,Not Available ,Not Available
H1822 ,SCAN Health Plan ,"SCAN DESERT HEALTH PLAN, INC. ",SCAN Group ,38%,40%,10%,6%,28%
H1846 ,MediGold ,MOUNT CARMEL HEALTH INSURANCE COMPANY ,Trinity Health Corporation ,Not Available ,Not Available ,Not Available ,Not Available ,Not Available
H1862 ,Wellcare ,"WELLCARE HEALTH PLANS OF VERMONT, INC. ",Centene Corporation ,Not Available ,Not Available ,Not Available ,Not Available ,Not Available
H1889 ,UnitedHealthcare ,CARE IMPROVEMENT PLUS SOUTH CENTRAL INSURANCE CO. ,"UnitedHealth Group, Inc. ",13%,30%,10%,Not Available ,12%
H1894 ,Wellpoint ,"WELLPOINT WASHINGTON, INC. ","Elevance Health, Inc. ",29%,47%,22%,Not Available ,18%
H1914 ,Wellcare ,"WELLCARE HEALTH INSURANCE OF CONNECTICUT, INC. ",Centene Corporation ,27%,24%,21%,13%,22%
H1947 ,Healthy Blue ,"COMMUNITY CARE HEALTH PLAN OF LOUISIANA, INC. ","Elevance Health, Inc. ",Not Available ,40%,18%,Not Available ,Not Available
H1951 ,Humana ,"HUMANA HEALTH BENEFIT PLAN OF LOUISIANA, INC. ",Humana Inc. ,9%,20%,14%,6%,10%
H1961 ,Peoples Health ,"PEOPLES HEALTH, INC. ","UnitedHealth Group, Inc. ",12%,14%,9%,6%,9%
H1969 ,Regence BlueShield of Idaho ,"REGENCE BLUESHIELD OF IDAHO, INC. ","Cambia Health Solutions, Inc. ",12%,12%,31%,10%,6%
H1993 ,Astiva Health ,"ASTIVA HEALTH, INC. ",Astiva Health Holdings Incorporated ,29%,27%,23%,23%,22%
H1994 ,Select Health ,"SELECTHEALTH, INC. ","Intermountain Health Care, Inc. ",16%,24%,29%,12%,11%
H1997 ,Regence BlueShield ,REGENCE BLUESHIELD ,"Cambia Health Solutions, Inc. ",Not Available ,Not Available ,Not Available ,Not Available ,Not Available
H2001 ,UnitedHealthcare ,"SIERRA HEALTH AND LIFE INSURANCE COMPANY, INC. ","UnitedHealth Group, Inc. ",8%,5%,21%,Not Available ,7%
H2029 ,Humana ,"HUMANA INSURANCE OF PUERTO RICO, INC. ",Humana Inc. ,Not Available ,Not Available ,Not Available ,Not Available ,Not Available
H2032 ,Baylor Scott & White Health Plan ,Baylor Scott & White Insurance Company ,Baylor Scott & White Holdings ,Not Available ,Not Available ,Not Available ,Not Available ,Not Available
H2034 ,Community Care ,"COMMUNITY CARE HEALTH PLAN, INC. ","Community Care, Inc. ",Not Available ,Not Available ,Not Available ,Not Available ,Not Available
H2041 ,Devoted Health ,DEVOTED HEALTH PLAN OF MISSOURI INC ,"Devoted Health, Inc. ",Plan too new to be measured ,Plan too new to be measured ,Plan too new to be measured ,Plan too new to be measured ,Plan too new to be measured
H2056 ,Aetna Medicare ,AETNA BETTER HEALTH OF MICHIGAN INC. ,CVS Health Corporation ,18%,20%,17%,8%,13%
H2096 ,Shared Health Dual Freedom ,SHARED HEALTH INSURANCE COMPANY ,BlueCross BlueShield of Tennessee ,Plan too new to be measured ,Plan too new to be measured ,Plan too new to be measured ,Plan too new to be measured ,Plan too new to be measured
H2108 ,Cigna Healthcare ,"BRAVO HEALTH MID-ATLANTIC, INC. ",The Cigna Group ,32%,47%,24%,18%,23%
H2117 ,Wellcare ,"MERIDIAN HEALTH PLAN OF MICHIGAN, INC. ",Centene Corporation ,21%,47%,14%,Not Available ,18%
H2128 ,Wellcare ,CELTIC INSURANCE COMPANY ,Centene Corporation ,23%,34%,20%,Not Available ,24%
H2162 ,Wellcare ,"WELLCARE OF NEW HAMPSHIRE, INC. ",Centene Corporation ,Not Available ,Not Available ,Not Available ,Not Available ,Not Available
H2168 ,VillageCareMAX ,VILLAGE SENIOR SERVICES CORPORATION ,"Village Care of New York, Inc. ",Not Available ,Not Available ,Not Available ,Not Available ,Not Available
H2172 ,Kaiser Permanente ,KAISER FDTN HLTH PLAN OF THE MID-ATLANTIC STATES ,"Kaiser Foundation Health Plan, Inc. ",34%,32%,21%,Not Available ,22%
H2174 ,Wellcare by Trillium ,"TRILLIUM COMMUNITY HEALTH PLAN, INC. ",Centene Corporation ,Not Available ,Not Available ,Not Available ,Not Available ,Not Available
H2185 ,Align Senior Care ,"LIFEWORKS ADVANTAGE, LLC ","Curana Health Holdings, LLC ",Not Available ,Not Available ,Not Available ,Not Available ,Not Available
H2224 ,Senior Whole Health ,"SENIOR WHOLE HEALTH, LLC ","Molina Healthcare, Inc. ",Not Available ,Not Available ,Not Available ,Not Available ,Not Available
H2225 ,Commonwealth Care Alliance Massachusetts ,"COMMONWEALTH CARE ALLIANCE, INC. ","Commonwealth Care Alliance, Inc. ",Not Available ,Not Available ,Not Available ,Not Available ,Not Available
H2226 ,UnitedHealthcare ,UNITEDHEALTHCARE INSURANCE COMPANY ,"UnitedHealth Group, Inc. ",Not Available ,Not Available ,Not Available ,Not Available ,Not Available
H2230 ,Blue Cross Blue Shield of Massachusetts ,"BCBS  OF MASSACHUSETTS HMO BLUE, INC. ","Blue Cross and Blue Shield of Massachusetts, Inc. ",14%,18%,20%,Not Available ,8%
H2235 ,BayCare Health Plans ,"BAYCARE SELECT HEALTH PLANS, INC. ","BayCare Health System, Inc. ",21%,28%,23%,7%,11%
H2237 ,iCare ,INDEPENDENT CARE HEALTH PLAN ,Humana Inc. ,15%,25%,12%,Not Available ,16%
H2246 ,Select Health ,"SELECTHEALTH, INC. ","Intermountain Health Care, Inc. ",Not Available ,Not Available ,Not Available ,Not Available ,Not Available
H2247 ,UnitedHealthcare ,"UNITEDHEALTHCARE COMMUNITY PLAN, INC. ","UnitedHealth Group, Inc. ",18%,30%,10%,Not Available ,13%
H2256 ,Tufts Health Plan ,TUFTS ASSOCIATED HEALTH MAINTENANCE ORGANIZATION ,"Point32Health, Inc. ",11%,25%,18%,6%,7%
H2261 ,Blue Cross Blue Shield of Massachusetts ,"BCBS  OF MASSACHUSETTS HMO BLUE, INC. ","Blue Cross and Blue Shield of Massachusetts, Inc. ",8%,15%,18%,Not Available ,6%
H2272 ,UnitedHealthcare ,"UNITEDHEALTHCARE OF NEW ENGLAND, INC. ","UnitedHealth Group, Inc. ",Not Available ,Not Available ,Not Available ,Not Available ,Not Available
H2292 ,UnitedHealthcare ,CARE IMPROVEMENT PLUS SOUTH CENTRAL INSURANCE CO. ,"UnitedHealth Group, Inc. ",Not Available ,Not Available ,Not Available ,Not Available ,Not Available
H2293 ,Aetna Medicare ,SILVERSCRIPT INSURANCE COMPANY ,CVS Health Corporation ,Not Available ,Not Available ,Not Available ,Not Available ,Not Available
H2320 ,Priority Health Medicare ,PRIORITY HEALTH ,Corewell Health ,8%,9%,22%,4%,6%
H2322 ,HAP Senior Plus (PPO) ,ALLIANCE HEALTH AND LIFE INSURANCE COMPANY ,Henry Ford Health System ,9%,9%,19%,5%,8%
H2354 ,HAP Senior Plus ,HEALTH ALLIANCE PLAN OF MICHIGAN ,Henry Ford Health System ,10%,13%,20%,Not Available ,8%
H2392 ,Kansas Health Advantage ,"KANSAS SUPERIOR SELECT, INC. ",Kansas Superior Select ,Not Available ,Not Available ,Not Available ,Not Available ,Not Available
H2400 ,Signature Advantage (HMO SNP) ,"SIGNATURE ADVANTAGE, LLC ","SA Plan, LLC ",Not Available ,Not Available ,Not Available ,Not Available ,Not Available
H2406 ,UnitedHealthcare ,CARE IMPROVEMENT PLUS SOUTH CENTRAL INSURANCE CO. ,"UnitedHealth Group, Inc. ",7%,14%,20%,7%,8%
H2416 ,PrimeWest Health ,PRIMEWEST RURAL MN HEALTH CARE ACCESS INITIATIVE ,PrimeWest Rural MN Health Care Access Initiative ,Not Available ,Not Available ,Not Available ,Not Available ,Not Available
H2417 ,Itasca Medical Care/IMCare Classic ,ITASCA MEDICAL CARE ,Itasca County ,Not Available ,Not Available ,Not Available ,Not Available ,Not Available
H2419 ,South Country Health Alliance ,SOUTH COUNTRY HEALTH ALLIANCE ,South Country Health Alliance ,Not Available ,Not Available ,Not Available ,Not Available ,Not Available
H2422 ,HealthPartners ,"HEALTHPARTNERS, INC. ","HealthPartners, Inc. ",Not Available ,Not Available ,Not Available ,Not Available ,Not Available
H2425 ,Blue Plus ,HMO Minnesota ,"Aware Integrated, Inc. ",Not Available ,Not Available ,Not Available ,Not Available ,Not Available
H2441 ,Anthem Blue Cross and Blue Shield ,"ANTHEM INSURANCE COMPANIES, INC. ","Elevance Health, Inc. ",Plan too new to be measured ,Plan too new to be measured ,Plan too new to be measured ,Plan too new to be measured ,Plan too new to be measured
H2445 ,UnitedHealthcare ,"UNITEDHEALTHCARE OF THE MID-ATLANTIC, INC. ","UnitedHealth Group, Inc. ",Plan too new to be measured ,Plan too new to be measured ,Plan too new to be measured ,Plan too new to be measured ,Plan too new to be measured
H2450 ,Medica ,MEDICA INSURANCE COMPANY ,Medica Holding Company ,3%,1%,39%,6%,7%
H2456 ,UCare's MSHO ,UCARE MINNESOTA ,UCare Minnesota ,Not Available ,Not Available ,Not Available ,Not Available ,Not Available
H2458 ,Medica ,MEDICA HEALTH PLANS ,Medica Holding Company ,Not Available ,Not Available ,Not Available ,Not Available ,Not Available
H2459 ,UCare ,UCARE MINNESOTA ,UCare Minnesota ,2%,6%,26%,8%,5%
H2461 ,Blue Cross and Blue Shield of Minnesota ,"BCBSM, Inc. ","Aware Integrated, Inc. ",5%,4%,48%,8%,5%
H2462 ,HealthPartners ,"HEALTHPARTNERS, INC. ","HealthPartners, Inc. ",Not Available ,Not Available ,Not Available ,Not Available ,Not Available
H2463 ,Humana ,"HUMANA HEALTH PLAN OF TEXAS, INC. ",Humana Inc. ,11%,10%,19%,3%,6%
H2478 ,Molina Healthcare of Nevada ,MOLINA HEALTHCARE OF NEVADA INC ,"Molina Healthcare, Inc. ",Not Available ,Not Available ,Not Available ,Not Available ,Not Available
H2486 ,Humana ,"HUMANA MEDICAL PLAN OF UTAH, INC. ",Humana Inc. ,24%,31%,19%,Not Available ,17%
H2491 ,Wellcare ,"WELLCARE HEALTH INSURANCE OF ARIZONA, INC. ",Centene Corporation ,Not Available ,31%,20%,Not Available ,16%
H2509 ,UnitedHealthcare ,"UNITEDHEALTHCARE OF FLORIDA, INC. ","UnitedHealth Group, Inc. ",Not Available ,Not Available ,Not Available ,Not Available ,Not Available
H2526 ,Devoted Health ,DEVOTED HEALTH PLAN OF OHIO INC ,"Devoted Health, Inc. ",Not Available ,Not Available ,Not Available ,Not Available ,Not Available
H2563 ,Sentara Medicare ,SENTARA HEALTH PLANS ,Sentara Health Care (SHC) ,18%,30%,15%,9%,14%
